RID,n,nf,nr,Purl,text,JTime,RTime,Rank
1549362726887165956,7,3,7,http://pbs.twimg.com/media/FYBxL2RVQAEL2Tj.jpg,"7月15日以来の宮城県内での大雨被害　資料の誤廃棄防止と情報提供のお願い　ー宮城資料ネット NPO法人宮城歴史資料保全ネットワーク　

被災した歴史資料・文化財の応急処置などへのお願いです。ぜひよろしくお願いします。
https://t.co/X5ice86QrR https://t.co/ka9xznj6Oa",2022-07-19 20:57:14,2022-07-19T11:57:14Z,7
1549362600894353408,3,7,2,http://pbs.twimg.com/media/FYBxEVfUYAMQHJ3.jpg,大雨で電車は大幅に遅延するし、愛用の996はずぶ濡れになるし、蒸し暑さでTシャツが汗だくになっても、行く価値が京都にはある。 https://t.co/XMsEoGRPyL,2022-07-19 20:56:44,2022-07-19T11:56:44Z,15
1549362600894353408,3,7,2,http://pbs.twimg.com/media/FYBxEvSVEAAZmt-.jpg,大雨で電車は大幅に遅延するし、愛用の996はずぶ濡れになるし、蒸し暑さでTシャツが汗だくになっても、行く価値が京都にはある。 https://t.co/XMsEoGRPyL,2022-07-19 20:56:44,2022-07-19T11:56:44Z,15
1549251428920999936,13,0,359,http://pbs.twimg.com/media/FYAL9mTaAAAIYq8.jpg,"安田屋から淡島も見えません。
大雨等十分にご注意下さい https://t.co/uBj0mAJnfA",2022-07-19 20:56:01,2022-07-19T04:34:59Z,4
1549236035045199872,2,0,70,http://pbs.twimg.com/media/FX_99oKaQAIgCUc.jpg,"東海道本線(琵琶湖線)山科～米原間は大雨で11時35分頃から不通

なのに、滋賀県最弱の湖西線が定刻で「サンダーバード」すら動いている。

……琵琶湖県民的には謎な光景です https://t.co/WbqVlpGzoQ",2022-07-19 20:55:48,2022-07-19T03:33:48Z,28
1549362283859521537,1,1,0,http://pbs.twimg.com/media/FYBwx7BUEAAlTSo.jpg,"仕事終了👍今日は京都は大雨やって外の仕事びしょ濡れになってしまった😭九州中心に大荒れやったみたいやけどみなさん大丈夫かな？
被害がなければいいんやけど…。
今日はうららの弁当見てめっちゃ元気出たわ😋
マジでうららが作ったヴィーガン弁当食べたいよ～🥰 https://t.co/TqudRSVXxN",2022-07-19 20:55:28,2022-07-19T11:55:28Z,73
1549362063109025797,2,4,1,http://pbs.twimg.com/media/FYBwk9_UcAA_PKS.jpg,"京都の大雨で、鴨川が！！！
普段と全然違う💦 https://t.co/O7B0KKPIDX",2022-07-19 20:54:36,2022-07-19T11:54:36Z,28
1549362063109025797,2,4,1,http://pbs.twimg.com/media/FYBwlbqVEAAXY3W.jpg,"京都の大雨で、鴨川が！！！
普段と全然違う💦 https://t.co/O7B0KKPIDX",2022-07-19 20:54:36,2022-07-19T11:54:36Z,28
1549257733861699584,1,0,10,http://pbs.twimg.com/media/FYARsZeaAAELN52.jpg,"限界ネトウヨのフクチャンが「告げ口外交」さながらに、三浦瑠麗さんにリプしてる。そして完全にシカトされてる😂

熊本は大雨みたいなので、フクチャンのこと心配してたのに！
#フQチャン https://t.co/YJEF3Ua2U6",2022-07-19 20:53:50,2022-07-19T05:00:02Z,73
1280881426561265665,16,0,76693,http://pbs.twimg.com/ext_tw_video_thumb/1280881312329416704/pu/img/5vDdip09ivLctrCN.jpg,"朝、岐阜公園前から岐阜駅に向かって走行中の出来事。
ドラレコにて。
大雨の影響かな？怖い。 https://t.co/blaAK9uMI1",2022-07-19 20:53:25,2020-07-08T15:08:24Z,2
