RID,n,nf,nr,Purl,text,JTime,RTime,Rank
1552813059734769664,1,0,0,http://pbs.twimg.com/media/FYyzP7LUIAAQn48.jpg,【日経新聞】 台風5号、奄美に接近へ　九州南部など大雨に警戒 https://t.co/As6DgUVdGc https://t.co/oQCVRxqZNi,2022-07-29 09:27:37,2022-07-29T00:27:37Z,19
1552811877197123586,1,0,0,http://pbs.twimg.com/media/FYyyK2EVsAAgJNz.jpg,台風5号、奄美に接近へ　大雨、浸水に警戒呼びかけ(共同通信) https://t.co/P2Nzk4pYmG https://t.co/Q2JAHZewqo,2022-07-29 09:22:56,2022-07-29T00:22:56Z,19
1552810426727075840,1,0,0,http://pbs.twimg.com/media/FYyw2k4aUAEFUwY.jpg,"台風5号、奄美に接近へ 九州南部など大雨に警戒 （日本経済新聞）
黄円の範囲は風速15メートル以上の強風域。白の点線は台風の中心が到達すると予想される範囲台風5号は29日、日本の南の海上を北寄りに進んだ。29日夜には鹿児島県の奄美にか…
https://t.co/Fw8k1ScHqZ
#速報 ＃ニュース
#ニュース速報 https://t.co/q0AnrIpO3I",2022-07-29 09:17:10,2022-07-29T00:17:10Z,19
1552807472372391937,1,8,0,http://pbs.twimg.com/media/FYyuKCPVEAA7tbw.jpg,"おはようございます😊
今日も朝からピーカン☀
今日は山沿いを中心に急な雨や雷雨に注意。厳しい暑さが続き、九州南部は南からの湿った空気の影響で強い雨の降るおそれがあり、特に台風５号に近い奄美、種子島・屋久島地方では大雨の予報🌀
今週も今日で終わり、笑顔の一日をお過ごしください😁👍 https://t.co/W5sLZcVFTw",2022-07-29 09:05:25,2022-07-29T00:05:25Z,19
1552807472372391937,1,8,0,http://pbs.twimg.com/media/FYyuKOFVUAEGWCs.jpg,"おはようございます😊
今日も朝からピーカン☀
今日は山沿いを中心に急な雨や雷雨に注意。厳しい暑さが続き、九州南部は南からの湿った空気の影響で強い雨の降るおそれがあり、特に台風５号に近い奄美、種子島・屋久島地方では大雨の予報🌀
今週も今日で終わり、笑顔の一日をお過ごしください😁👍 https://t.co/W5sLZcVFTw",2022-07-29 09:05:25,2022-07-29T00:05:25Z,19
1552807472372391937,1,8,0,http://pbs.twimg.com/media/FYyuKd-VQAANeIH.jpg,"おはようございます😊
今日も朝からピーカン☀
今日は山沿いを中心に急な雨や雷雨に注意。厳しい暑さが続き、九州南部は南からの湿った空気の影響で強い雨の降るおそれがあり、特に台風５号に近い奄美、種子島・屋久島地方では大雨の予報🌀
今週も今日で終わり、笑顔の一日をお過ごしください😁👍 https://t.co/W5sLZcVFTw",2022-07-29 09:05:25,2022-07-29T00:05:25Z,19
1552807472372391937,1,8,0,http://pbs.twimg.com/media/FYyuKrTUsAAtlAe.jpg,"おはようございます😊
今日も朝からピーカン☀
今日は山沿いを中心に急な雨や雷雨に注意。厳しい暑さが続き、九州南部は南からの湿った空気の影響で強い雨の降るおそれがあり、特に台風５号に近い奄美、種子島・屋久島地方では大雨の予報🌀
今週も今日で終わり、笑顔の一日をお過ごしください😁👍 https://t.co/W5sLZcVFTw",2022-07-29 09:05:25,2022-07-29T00:05:25Z,19
1552597914463047680,1,0,2,http://pbs.twimg.com/media/FYvvjzSUEAEARta.jpg,"こんばんは
お疲れです
今日も最高の温度です広島地方　☀️
大雨の所もあったようですね
皆さん気をつけて下さい
今日の夕景写真です🌄 https://t.co/aEmINMB5du",2022-07-29 09:05:14,2022-07-28T10:12:43Z,19
1552805761943683077,1,2,0,http://pbs.twimg.com/media/FYysdNIUcAAosg9.jpg,"学院長ごきげんよう～

大雨になったり暑くなったり…大変な毎日ですが

体調を崩さないよう祈ってます

今日もお気をつけて

🐕゛

写真は太宰府天満宮で撮ったものです⛩

#雛見沢くるみ #VTuber #Zeeny https://t.co/jhM8IpDl2Z",2022-07-29 08:58:38,2022-07-28T23:58:38Z,19
1552429435596316672,2,0,12,http://pbs.twimg.com/media/FYtWWADUcAA-xyT.jpg,"2022.7.27 67レ:EF66 27
東海管内での大雨の影響で15時間以上の遅れとなったニーナ。関西圏は日没後の通過なので、最近流行りのブルトレイメージ写真に便乗してみました。 https://t.co/YkxcfDfznL",2022-07-29 08:55:30,2022-07-27T23:03:14Z,3
1552652038915620864,1,0,11,http://pbs.twimg.com/media/FYwgzDsakAQeX24.jpg,"【八高線(小川町〜寄居) 上下線 運転再開】
八高線は、大雨による運転規制の影響で、小川町～寄居の上下線で運転を見合わせていましたが、22:09頃に全線で運転を再開しました。 https://t.co/IMsMfgbEoy",2022-07-29 08:55:06,2022-07-28T13:47:47Z,19
1552654018899746818,1,0,10,http://pbs.twimg.com/media/FYwimReakAAyZ2v.jpg,"【特急あずさ 上下線 運転見合わせ】
中央線特急は、山梨県内の中央本線での大雨による運転規制の影響で、上下線で運転を見合わせています。 https://t.co/YaeaE5EXWq",2022-07-29 08:55:02,2022-07-28T13:55:39Z,19
1552665716461309953,1,0,4,http://pbs.twimg.com/media/FYwtPUEaIAA8cy7.jpg,"【東武桐生線 上下線 遅延情報】
桐生線は、大雨による運転規制の影響で、太田～赤城の上下線の一部列車に遅れがでています。 https://t.co/1fK1vmZR0M",2022-07-29 08:54:12,2022-07-28T14:42:08Z,19
1552666212056076288,1,0,5,http://pbs.twimg.com/media/FYwtsMwakAIWUrw.jpg,"【東武伊勢崎線(館林〜伊勢崎) 上下線 遅延情報】
伊勢崎線は、大雨による運転規制の影響で、館林〜伊勢崎の上下線の一部列車に遅れがでています。 https://t.co/ykIym9shmb",2022-07-29 08:54:07,2022-07-28T14:44:06Z,19
1552803611344011264,2,59,1,http://pbs.twimg.com/media/FYyqh4makAAiOHQ.jpg,"／
　おはようｺﾞﾑざいます(*´ο`*)/
＼

京都府宇治市は晴れ🌞

けさは毎月恒例のゴミ拾い🚮
先日の大雨の影響で側溝に
ゴミがいっぱいありました🥶

(*´ο`*)…(ポイ捨てアカン！)

#企業公式が毎朝地元の天気を言い合う https://t.co/GWfCoZXdnK",2022-07-29 08:50:05,2022-07-28T23:50:05Z,3
1552802175486939136,1,3,0,http://pbs.twimg.com/media/FYypTM1aIAAEaP4.jpg,"／
#広報つるおか 8月号を発行！
＼

特集は「考えてみませんか。災害に備えること」です！

夏から10月頃までは、台風等によって、大雨が多くなる季節です。
9/1の「防災の日」を前に、災害への備えについて考えてみませんか。
ぜひご覧ください！

#鶴岡市 HP
https://t.co/NsOYxgNCnJ https://t.co/sbmOEMHDwj",2022-07-29 08:44:22,2022-07-28T23:44:22Z,19
1552794351973314560,7,0,17,http://pbs.twimg.com/media/FYyiOOlaMAAjz8V.jpg,"台風５号、沖縄奄美地方に接近

宮崎県など九州南部
台風が離れても大雨が続く

#おはよう #天気予報 
#台風 #台風５号 
#雷雨 #ゲリラ豪雨 
#猛暑日 #熱中症に気をつけて https://t.co/usl5Leyl8x",2022-07-29 08:39:37,2022-07-28T23:13:17Z,1
1552799822326947848,1,0,0,http://pbs.twimg.com/media/FYynNYhXoAEd0Xy.jpg,勢力は弱くても要警戒と。→「台風が東シナ海へ進んだ後も、九州や四国太平洋側などには断続的に暖かく湿った空気が送り込まれる予想」 #マネジメント 《天気》台風5号（ソングダー）　今夜奄美に接近へ　九州や四国で大雨のおそれ｜ウェザーニュース https://t.co/lCTxbGXIn3 https://t.co/7q2O7BXMIA,2022-07-29 08:35:01,2022-07-28T23:35:01Z,19
1552799822326947848,1,0,0,http://pbs.twimg.com/media/FYynNYkWIAAqMdb.jpg,勢力は弱くても要警戒と。→「台風が東シナ海へ進んだ後も、九州や四国太平洋側などには断続的に暖かく湿った空気が送り込まれる予想」 #マネジメント 《天気》台風5号（ソングダー）　今夜奄美に接近へ　九州や四国で大雨のおそれ｜ウェザーニュース https://t.co/lCTxbGXIn3 https://t.co/7q2O7BXMIA,2022-07-29 08:35:01,2022-07-28T23:35:01Z,19
