RID,n,nf,nr,Purl,text,JTime,RTime,Rank
1565292035288231937,1,0,0,http://pbs.twimg.com/media/FbkIzsQakAE4hSp.jpg,"【中央本線(高尾〜甲府) 上り線 遅延情報】
中央本線は、大雨による運転規制の影響で、甲府〜高尾の上り線の一部列車に40分以上の遅れがでています。 https://t.co/MzjOoip0JA",2022-09-01 19:54:37,2022-09-01T10:54:37Z,26
1565291755490054144,1,0,0,http://pbs.twimg.com/media/FbkIjLNVUAAOKqi.jpg,"#うっちー最長片道切符記録
大雨のせいで飯田線走破に12時間かかりました
岡谷に到着本当は16時前には着いてるはずだったのに

予定が大崩れです https://t.co/pkJGDH9cgK",2022-09-01 19:53:30,2022-09-01T10:53:30Z,26
1565078615158853633,1,0,456,http://pbs.twimg.com/media/FbhGkaxaMAAlVTG.png,"【週間天気予報】
・曇りや雨の日が多く、大雨のおそれも
・台風11号の進路に注意　沖縄は影響長引く
・朝晩の暑さ少し和らぐも昼間は蒸し暑い
https://t.co/27XGe8J8tn https://t.co/RycYnKOMuL",2022-09-01 19:52:57,2022-08-31T20:46:34Z,26
1565291385623683072,1,0,0,http://pbs.twimg.com/media/FbkIN9sVEAAGng9.jpg,"香川県の大雨警報
横になったプーさんやん https://t.co/Z3f2kuvFX1",2022-09-01 19:52:02,2022-09-01T10:52:02Z,26
1565291293324242944,1,0,0,http://pbs.twimg.com/media/FbkIFTbacAAntT7.jpg,"2022年 9/1 飛騨方面遠征3日目
最終日は本来14時くらいまで撮影する予定でしたが大雨を食らって午前中で急遽切り上げ……少しだけバスを撮影の後、ひだ号が運休になり急遽高速バスで撤収しました https://t.co/OsYptRuylo",2022-09-01 19:51:40,2022-09-01T10:51:40Z,26
1565291293324242944,1,0,0,http://pbs.twimg.com/media/FbkIFTeaMAATe9b.jpg,"2022年 9/1 飛騨方面遠征3日目
最終日は本来14時くらいまで撮影する予定でしたが大雨を食らって午前中で急遽切り上げ……少しだけバスを撮影の後、ひだ号が運休になり急遽高速バスで撤収しました https://t.co/OsYptRuylo",2022-09-01 19:51:40,2022-09-01T10:51:40Z,26
1565291293324242944,1,0,0,http://pbs.twimg.com/media/FbkIFTQaMAAmwbk.jpg,"2022年 9/1 飛騨方面遠征3日目
最終日は本来14時くらいまで撮影する予定でしたが大雨を食らって午前中で急遽切り上げ……少しだけバスを撮影の後、ひだ号が運休になり急遽高速バスで撤収しました https://t.co/OsYptRuylo",2022-09-01 19:51:40,2022-09-01T10:51:40Z,26
1565291293324242944,1,0,0,http://pbs.twimg.com/media/FbkIFTQaAAAN0w8.jpg,"2022年 9/1 飛騨方面遠征3日目
最終日は本来14時くらいまで撮影する予定でしたが大雨を食らって午前中で急遽切り上げ……少しだけバスを撮影の後、ひだ号が運休になり急遽高速バスで撤収しました https://t.co/OsYptRuylo",2022-09-01 19:51:40,2022-09-01T10:51:40Z,26
1565290763206168576,1,0,0,http://pbs.twimg.com/media/FbkHpqyaIAEJnNM.jpg,"本日の賄いうどん

徳島県産のすだちを頂いて
贅沢に使わさして貰いました😋

台風が近づいて
大雨で足元が悪いと思いますので
お気をつけてお越しくださいね https://t.co/yv8gkz9Vnr",2022-09-01 19:49:34,2022-09-01T10:49:34Z,26
1565290652308766720,3,1,2,http://pbs.twimg.com/media/FbkHi2XaIAAa0x_.jpg,"大阪・阪神京都・奈良の皆様

今

大阪湾で発達してる

雷雲そちらに向かってますので

落雷・大雨等にお気をつけください

現段階
⬇
姫路
南あわじ市
共に、大雨洪水警報発令中

 #警報
 #落雷
 #大雨
 #近畿地方
 #天気
尚、姫路に関しては
雨の通り道になってます
今後ともお気をつけを https://t.co/4TX5bnvvkg",2022-09-01 19:49:07,2022-09-01T10:49:07Z,3
1565290598700945408,2,8,1,http://pbs.twimg.com/ext_tw_video_thumb/1565290578736062464/pu/img/d80LMiN2IyCZMUZB.jpg,"皆さん、本日もお疲れ様でございます🥰

高松市大雨です😅
帰る頃にはずぶ濡れ😆

東京から高松市に越してきて4ヵ月。

そろそろ香川県で私個人の撮影案件も欲しい❗

ということで、女性リーダーの集まりへ行ってきました❤️

#香川県 #讃岐おもちゃ美術館 #企業公式つぶやき部 #企業公式相互フォロー https://t.co/3Nt5EzwRM6",2022-09-01 19:48:55,2022-09-01T10:48:55Z,6
1564791935478681600,1,0,37,http://pbs.twimg.com/media/FbdB-OMUIAE1kzc.jpg,"うひょー☔💦
豊川やばうぃ😱
大雨洪水警報出てるし🚨🚨🚨
電車止まってるし😫 https://t.co/PtfEJ4FCTW",2022-09-01 19:47:40,2022-08-31T01:47:24Z,26
1565200065027010561,1,0,5,http://pbs.twimg.com/media/Fbi1JpNagAA74WU.jpg,明け方の漁港（東京湾）に上がるオリオン。夏の終わりです。この後大雨でした。 https://t.co/AtkCcrHDnG,2022-09-01 19:47:32,2022-09-01T04:49:10Z,26
1565289695822503938,1,2,0,http://pbs.twimg.com/media/FbkGreGVQAAINBE.jpg,ずっと大雨警報が継続中の大阪市、日の丸みたい😱 https://t.co/EnaM5sAIyB,2022-09-01 19:45:19,2022-09-01T10:45:19Z,26
1565289659759923200,1,0,0,http://pbs.twimg.com/media/FbkGooXUcAIe510.jpg,"みてみて！なんだと思う？！

これね、大雨規制で3時間近く東栄駅で抑止されている飯田線の554Gなんだ！

本当ならもう名古屋についていてひつまぶしを食べている予定だったの！

運転再開見込みは21:00

やったね！あと1時間以上もゆっくりできるよ！！ https://t.co/VYd5HOCMcv",2022-09-01 19:45:11,2022-09-01T10:45:11Z,26
1565289659759923200,1,0,0,http://pbs.twimg.com/media/FbkGpMOVsAEMleJ.jpg,"みてみて！なんだと思う？！

これね、大雨規制で3時間近く東栄駅で抑止されている飯田線の554Gなんだ！

本当ならもう名古屋についていてひつまぶしを食べている予定だったの！

運転再開見込みは21:00

やったね！あと1時間以上もゆっくりできるよ！！ https://t.co/VYd5HOCMcv",2022-09-01 19:45:11,2022-09-01T10:45:11Z,26
1565289652164399105,1,1,0,http://pbs.twimg.com/media/FbkGn_TaIAIpsYy.jpg,"「千葉県東葛飾の大雨警報は解除されたって！？
それはよかった…」

#precure #Tokyomx
#スイートプリキュア https://t.co/hwyZ4YWB5P",2022-09-01 19:45:09,2022-09-01T10:45:09Z,26
1565289530659426304,7,6,6,http://pbs.twimg.com/media/FbkGiIRWQAEJikK.jpg,#台風11号 の進路予測は、まだ朝鮮半島～九州方面までのブレ幅はあるものの、予報円の中のどこに向かっても、#山口県 は台風の大きな影響は避けられない雰囲気。山口県には、月曜夕方以降、火曜にかけて、#暴風、#高波、#大雨 は #警報級 となり、来週前半は #大荒れ の天気となるおそれ。 https://t.co/8lMs25JFYq,2022-09-01 19:44:40,2022-09-01T10:44:40Z,1
1565289193873453058,1,0,0,http://pbs.twimg.com/media/FbkGOTCUcAAgYRQ.jpg,"⚠️気象速報
千葉県の大雨警報は解除 https://t.co/svlVLd4TPA",2022-09-01 19:43:20,2022-09-01T10:43:20Z,26
1565289091893465088,1,3,0,http://pbs.twimg.com/media/FbkGIB0aQAATwaT.jpg,"今日は防災の日！！
いざという時に備えて、iYellのグッズに携帯防災セットが🔦

東京は先ほどから大雨に😭
みなさん帰宅時お気をつけください☔️
私は大雨の中今日もジムへgo🧘‍♀️ https://t.co/nhMUm5f280",2022-09-01 19:42:55,2022-09-01T10:42:55Z,26
1565288695280070656,1,1,0,http://pbs.twimg.com/media/FbkFv17acAAyJot.jpg,大雨と落雷による信号トラブルで野田線に遅れ。柏駅カオス。 https://t.co/LzcDo7YJvR,2022-09-01 19:41:21,2022-09-01T10:41:21Z,26
1565287765860032512,2,17,1,http://pbs.twimg.com/media/FbkE6hqUYAAyXHB.jpg,"【台風11号🌀】※9/1(木)18時時点

鹿児島・宮崎は3日(土)以降、
警報クラスの大雨となるおそれ⚠️

風も強まり、(月)(火)は
西日本の広い範囲で暴風に🌀

台風への備えは、あす(金)までに
行なうようお願いします😌 https://t.co/I1z6DyJna0",2022-09-01 19:37:39,2022-09-01T10:37:39Z,6
1565287765860032512,2,17,1,http://pbs.twimg.com/media/FbkE7GzVEAE1ORG.jpg,"【台風11号🌀】※9/1(木)18時時点

鹿児島・宮崎は3日(土)以降、
警報クラスの大雨となるおそれ⚠️

風も強まり、(月)(火)は
西日本の広い範囲で暴風に🌀

台風への備えは、あす(金)までに
行なうようお願いします😌 https://t.co/I1z6DyJna0",2022-09-01 19:37:39,2022-09-01T10:37:39Z,6
1565287080691118081,1,0,0,http://pbs.twimg.com/media/FbkETK8agAEutii.jpg,"大雨とか台風でいつ電車が止まるか知らんけど🤣来ちゃうよね家と反対方向に🍻
本日、えいゆうツアー5日目❗️
俺の好きな、川西ふるやで英祐一&amp;阿宅ソロが見れるって、始まる前から台風以上やわ😃
#武田英祐一
#阿宅ユウスケ
#川西ふるや https://t.co/TQuiVmBe3L",2022-09-01 19:34:56,2022-09-01T10:34:56Z,26
1565287080691118081,1,0,0,http://pbs.twimg.com/media/FbkETLAaIAIiKzw.jpg,"大雨とか台風でいつ電車が止まるか知らんけど🤣来ちゃうよね家と反対方向に🍻
本日、えいゆうツアー5日目❗️
俺の好きな、川西ふるやで英祐一&amp;阿宅ソロが見れるって、始まる前から台風以上やわ😃
#武田英祐一
#阿宅ユウスケ
#川西ふるや https://t.co/TQuiVmBe3L",2022-09-01 19:34:56,2022-09-01T10:34:56Z,26
1565286999921405952,4,4,4,http://pbs.twimg.com/media/FbkEOdRaUAAJEp4.jpg,"【アーバンパークライン(大宮～柏) 上下線 遅延情報】
東武アーバンパークライン･野田線は、16:07頃、鎌ヶ谷～馬込沢での倒木衝突・17:20頃、大雨による運転規制・17:55頃、落雷による信号トラブルの影響で、大宮～柏の上下線の一部列車に最大１時間程度の大幅な遅れと運休･運転変更がでています。 https://t.co/P720F05tIf",2022-09-01 19:34:37,2022-09-01T10:34:37Z,2
