RID,n,nf,nr,Purl,text,JTime,RTime,Rank
1547824660792098816,1,0,5,http://pbs.twimg.com/media/FXr6Uq5aIAEgClP.jpg,"7/15 14:40時点で岡山県の一部地域で大雨の警戒レベル３相当の #土砂災害情報 が出ております。
#竜巻注意報 も発表されておりますので、ご注意下さい。
#岡山 #岡山大雨 #イマソラ https://t.co/ctg58Jk01c",2022-07-16 20:04:18,2022-07-15T06:05:30Z,104
1548153436935704577,1,0,14,http://pbs.twimg.com/media/FXwlVqXaAAE74J1.jpg,復旧支援に全力挙げる／記録的大雨の被害現場を調査／埼玉・ときがわ町で矢倉氏 #公明新聞電子版 2022年07月16日付  https://t.co/NpW21w4rDe https://t.co/sjEFsmA6sj,2022-07-16 20:04:15,2022-07-16T03:51:57Z,104
1548261228476186627,1,0,0,http://pbs.twimg.com/media/FXyHX7ZakAAe1GR.jpg,大雨で、箟岳山のふもとでは垂直避難が呼びかけられていた中でしたが、皆様のご協力で本日『箟岳山採燈大護摩供』を無事に厳修いたしました。ご協力いただきました皆様に感謝を申し上げます。  #宮城県  #涌谷町  #箟岳山  #箟峯寺  #天台宗  #天台宗陸奥教区 https://t.co/ssVqdKQaiS,2022-07-16 20:00:16,2022-07-16T11:00:16Z,104
1548261167553859587,1,0,0,http://pbs.twimg.com/media/FXyHU79aAAEaBQV.png,"【静岡県土砂災害警戒情報】降り続く大雨のため、土砂災害警戒区域等では命に危険が及ぶ土砂災害がいつ発生してもおかしくない非常に危険な状況です。富士宮市,富士市 https://t.co/TMRdJ1d9MG #静岡県 #土砂災害 #Hayabusa https://t.co/z0Ya3nylRd",2022-07-16 20:00:02,2022-07-16T11:00:02Z,104
1548261129029566464,1,1,0,http://pbs.twimg.com/media/FXyHSphaAAA_l1y.jpg,静岡市から富士市へ大雨です。 https://t.co/exk43VsifB,2022-07-16 19:59:53,2022-07-16T10:59:53Z,104
1548260964591890432,7,5,6,http://pbs.twimg.com/media/FXyHI9MacAEYl43.jpg,"1時間雨量(〜19:50)

静岡市南部・和田島 75.0 mm
静岡市南部・平山 72.0 mm
静岡市南部・麻機 50.0 mm
富士市・桑木穴 53.0 mm

非常に激しい雨を静岡市と富士市で観測

#静岡 #大雨 https://t.co/VTsxFWqM7P",2022-07-16 19:59:13,2022-07-16T10:59:13Z,8
1548146782429151232,1,0,1,http://pbs.twimg.com/media/FXwfRIpaQAESZV4.jpg,"麺辰『特製鶏中華』
ネギがどっさり。鶏のチャーシューは柔らかい。
自家製麺も美味しいね。

宮城は大雨だけど、山形は曇りで今日は山形らしくなく涼しい。 https://t.co/PNtH0vCulU",2022-07-16 19:58:39,2022-07-16T03:25:30Z,104
1548146782429151232,1,0,1,http://pbs.twimg.com/media/FXwfRwwagAAz5T4.jpg,"麺辰『特製鶏中華』
ネギがどっさり。鶏のチャーシューは柔らかい。
自家製麺も美味しいね。

宮城は大雨だけど、山形は曇りで今日は山形らしくなく涼しい。 https://t.co/PNtH0vCulU",2022-07-16 19:58:39,2022-07-16T03:25:30Z,104
1548146782429151232,1,0,1,http://pbs.twimg.com/media/FXwfScAagAADN-Q.jpg,"麺辰『特製鶏中華』
ネギがどっさり。鶏のチャーシューは柔らかい。
自家製麺も美味しいね。

宮城は大雨だけど、山形は曇りで今日は山形らしくなく涼しい。 https://t.co/PNtH0vCulU",2022-07-16 19:58:39,2022-07-16T03:25:30Z,104
1548260466052730882,1,0,0,http://pbs.twimg.com/media/FXyGr3yagAA6Hu1.jpg,"新大阪駅でHT30券売機を一台発見。Jスルーカードにオレンジカードも使えますよ。…シールがほとんど剥げてますが使えますよね？
というわけで久しぶりの東海道新幹線。N700aのX56編成のぞみ54号で東京へ。
静岡県の大雨、大丈夫でしょうか… https://t.co/ABls7Hn0Yf",2022-07-16 19:57:15,2022-07-16T10:57:15Z,104
1548260466052730882,1,0,0,http://pbs.twimg.com/media/FXyGr3saQAApaag.jpg,"新大阪駅でHT30券売機を一台発見。Jスルーカードにオレンジカードも使えますよ。…シールがほとんど剥げてますが使えますよね？
というわけで久しぶりの東海道新幹線。N700aのX56編成のぞみ54号で東京へ。
静岡県の大雨、大丈夫でしょうか… https://t.co/ABls7Hn0Yf",2022-07-16 19:57:15,2022-07-16T10:57:15Z,104
1548260405218541569,1,6,0,http://pbs.twimg.com/media/FXyGoeNagAAXw9g.jpg,"今日は大雨だったので
バイクに乗れず…🤣

過去に撮った写真📸

#バイク乗りと繋がりたい
#バイク好きと繋がりたい
#太平洋フェリー
#仙台新港 https://t.co/1GmB07idH5",2022-07-16 19:57:00,2022-07-16T10:57:00Z,104
1548260196480212993,6,2,5,http://pbs.twimg.com/media/FXyGbr_acAAv5sP.jpg,"「浸水は10年で3度目」堤防決壊、救助が相次ぐ　宮城で記録的大雨
https://t.co/LhNE26YOVJ
 
宮城県大崎市では名蓋川の堤防が決壊するなどして、水田や民家が冠水。
会社員の男性は、自宅そばの盛り土された道路に車をとめて、妻や娘2人と避難。
「まさか堤防が決壊するとは思わなかった」 https://t.co/6QIOMLmyqJ",2022-07-16 19:56:10,2022-07-16T10:56:10Z,10
1548260133284720640,1,0,0,http://pbs.twimg.com/media/FXyFJyxUEAM89R4.jpg,"静岡県中部、「大雨警報発令」にて用水路氾濫の図・・・これはウチから出られんな^^;;;;
＃静岡県　＃大雨警報 https://t.co/ejZWL9g6dF",2022-07-16 19:55:55,2022-07-16T10:55:55Z,104
1548260129341972480,9,18,8,http://pbs.twimg.com/media/FXyGYVUUUAM2era.jpg,"静岡市南部、島田市、掛川市、藤枝市に土砂災害警戒情報が出ています。

県内ではあすの明け方にかけて、
大雨や落雷が予想されています。
川付近にお住まいの方、崖付近や山沿いにお住まいの方、避難指示が出ているところがあります。

心配な場合は、動ける時間帯のうちに避難してくださいね。 https://t.co/JaX5k7c49f",2022-07-16 19:55:54,2022-07-16T10:55:54Z,6
1548259784591577089,3,2,4,http://pbs.twimg.com/media/FXyGEYnakAELRC4.jpg,"【身延線 上下線 運転見合わせ】
身延線は、19:51頃、大雨による運転規制の影響で、西富士宮～芝川の上下線で運転を見合わせています。 https://t.co/ssGbHu1GOz",2022-07-16 19:54:32,2022-07-16T10:54:32Z,18
1548259731776901121,1,2,0,http://pbs.twimg.com/media/FXyGAehaIAAxMHZ.jpg,"今日のスカイツリーお散歩🐰🌟🗼

白系＋虹🌈

小雨の間にサクッとお散歩。昼間は展望台から上が雲に覆われていたけど夜は光見えたよ
関東はこれから大雨かな？
被害が出ないといいなー

モウアイスのダブル北海道小豆を買ったよ。小豆いっぱいらしいからほぼ野菜、明日のおやつが楽しみだな🐰💓🫘🍨🫘 https://t.co/nFvrhPyfWs",2022-07-16 19:54:19,2022-07-16T10:54:19Z,104
1547940021134434305,1,0,45,http://pbs.twimg.com/amplify_video_thumb/1547934535421071360/img/G0tRUrkCZZQ0ek93.jpg,【鹿児島県 大雨警報】薩摩、大隅地方では、１６日朝まで土砂災害に警戒してください。 https://t.co/wtyMTMc5HN,2022-07-16 19:53:03,2022-07-15T13:43:55Z,104
1547940337930231813,1,0,39,http://pbs.twimg.com/amplify_video_thumb/1547938702613024772/img/EVewEh0-xO09itJH.jpg,【岩手県 大雨警報】内陸では、１６日夕方まで土砂災害に警戒してください。 https://t.co/MsBSqkfHEM,2022-07-16 19:52:57,2022-07-15T13:45:10Z,104
1548259348215869441,1,5,0,http://pbs.twimg.com/media/FXyFp4ZVQAIRobt.jpg,"宇宙遊泳＠静岡、お疲れ様でした😌
興奮さめやらぬ中、人生初のさわやかをいただき、帰路に着きました。
大雨の中のドライブ怖いけど、細心の注意を払って帰ります🚗 💨 https://t.co/AZ68qQzVqG",2022-07-16 19:52:48,2022-07-16T10:52:48Z,104
1548245558653231105,1,0,1,http://pbs.twimg.com/media/FXx5FjKakAEMi2G.jpg,"仙台から大雨の通行止めを迂回して宮守発車予定時刻ギリギリに釜石線着いたらSL銀河が抑止に…
スケジュールの都合で長居が出来ずカメラで一枚も写真撮る事無く引き上げでした。 また改めてリベンジに。 https://t.co/TTQHeIg12W",2022-07-16 19:51:55,2022-07-16T09:58:00Z,104
1548113524060082179,1,0,7,http://pbs.twimg.com/media/FXwBCyGUUAAFunU.jpg,復旧支援に全力挙げる／記録的大雨の被害現場を調査／埼玉・ときがわ町で矢倉氏 #公明新聞電子版 2022年07月16日付  https://t.co/45rzkewonb https://t.co/X68oFzVBbZ,2022-07-16 19:51:53,2022-07-16T01:13:21Z,104
1548259019751845888,3,1,3,http://pbs.twimg.com/media/FXyFX5caAAAdiZ-.jpg,"【きのくに線 上下線 終日運転見合わせ】
きのくに線は、17:04頃、大雨による運転規制の影響で、紀伊田原～周参見の上下線で終日運転を見合わせています。 https://t.co/1ElO5LAm1o",2022-07-16 19:51:30,2022-07-16T10:51:30Z,18
1548258653148704768,1,0,0,http://pbs.twimg.com/media/FXyFClgaAAE_LhB.png,"【静岡県土砂災害警戒情報】降り続く大雨のため、土砂災害警戒区域等では命に危険が及ぶ土砂災害がいつ発生してもおかしくない非常に危険な状況です。静岡市南部,島田市,掛川市,藤枝市 https://t.co/TMRdJ1vj0O #静岡県 #土砂災害 #Hayabusa https://t.co/krlSBMxiBP",2022-07-16 19:50:02,2022-07-16T10:50:02Z,104
1548206598689996800,1,0,13,http://pbs.twimg.com/media/FXxVr3BUYAMEIBP.jpg,"大崎市災害対策本部会議から議会に情報提供がありました。
令和4年7月15日大雨による被害状況等(16日11:00現在)
被害状況・避難状況及び救急状況等は別紙の通りです。 https://t.co/Je7DFBmBKJ",2022-07-16 19:49:53,2022-07-16T07:23:12Z,104
1548206598689996800,1,0,13,http://pbs.twimg.com/media/FXxVsSpUIAA2IT7.jpg,"大崎市災害対策本部会議から議会に情報提供がありました。
令和4年7月15日大雨による被害状況等(16日11:00現在)
被害状況・避難状況及び救急状況等は別紙の通りです。 https://t.co/Je7DFBmBKJ",2022-07-16 19:49:53,2022-07-16T07:23:12Z,104
1548074164623671296,1,0,1,http://pbs.twimg.com/media/FXvdPpaaIAA4xpX.jpg,"おはようございます🙋
今朝は小雨🌂
大雨警報出てます😞
今日は休日出勤😢

今朝の家の紫陽花😊

良い週末を🍀 https://t.co/uGu4BglHNj",2022-07-16 19:49:20,2022-07-15T22:36:57Z,104
1548074164623671296,1,0,1,http://pbs.twimg.com/media/FXvdP46aMAIEZj1.jpg,"おはようございます🙋
今朝は小雨🌂
大雨警報出てます😞
今日は休日出勤😢

今朝の家の紫陽花😊

良い週末を🍀 https://t.co/uGu4BglHNj",2022-07-16 19:49:20,2022-07-15T22:36:57Z,104
1548258008815177728,1,0,0,http://pbs.twimg.com/media/FXyEc7KUUAIA1Zs.jpg,"静岡県の皆さん大雨に警戒してください
命を守る行動をしてください
レベル4
#静岡県
#大雨 https://t.co/DSpfH9g1q0",2022-07-16 19:47:29,2022-07-16T10:47:29Z,104
1548257632326037504,1,4,0,http://pbs.twimg.com/media/FXyC0VcUsAA-9C9.jpg,大雨による影響で、陸前山王駅折り返しとなっている東北本線。陸前山王駅では半自動扱いとなっていて、自動扱いに慣れた乗客はちょっと困惑していました。 https://t.co/xo1EvTIXRD,2022-07-16 19:45:59,2022-07-16T10:45:59Z,104
1548257632326037504,1,4,0,http://pbs.twimg.com/media/FXyC1m9UcAAYanu.jpg,大雨による影響で、陸前山王駅折り返しとなっている東北本線。陸前山王駅では半自動扱いとなっていて、自動扱いに慣れた乗客はちょっと困惑していました。 https://t.co/xo1EvTIXRD,2022-07-16 19:45:59,2022-07-16T10:45:59Z,104
1548257632326037504,1,4,0,http://pbs.twimg.com/media/FXyC2qKUIAEHx-g.jpg,大雨による影響で、陸前山王駅折り返しとなっている東北本線。陸前山王駅では半自動扱いとなっていて、自動扱いに慣れた乗客はちょっと困惑していました。 https://t.co/xo1EvTIXRD,2022-07-16 19:45:59,2022-07-16T10:45:59Z,104
1548257632326037504,1,4,0,http://pbs.twimg.com/media/FXyC4cuVEAAnVNc.jpg,大雨による影響で、陸前山王駅折り返しとなっている東北本線。陸前山王駅では半自動扱いとなっていて、自動扱いに慣れた乗客はちょっと困惑していました。 https://t.co/xo1EvTIXRD,2022-07-16 19:45:59,2022-07-16T10:45:59Z,104
1547717340238065664,1,0,10,http://pbs.twimg.com/media/FXqYRcdaQAAyDpu.jpg,"大雨。警報出ているので最新の気象情報に留意し、最大限注意を。
災害が起きないことを願うらしい。
#小林市 #警報 https://t.co/qIonCCYDWg",2022-07-16 19:45:07,2022-07-14T22:59:03Z,104
1548105213126803456,1,0,4,http://pbs.twimg.com/media/FXv5e87aMAAO_T1.jpg,"大雨の影響が心配されます

いさみやは通常営業しております

今日は皮が少し破れたり、サービス価格の大島まんぢゅうがあります
味はいつもと同じです✨
ご自宅のオヤツにオススメです😊 https://t.co/BDmwTIDHqO",2022-07-16 19:43:40,2022-07-16T00:40:19Z,104
1548256840118517760,1,5,0,http://pbs.twimg.com/media/FXyDWphUsAIdwLD.jpg,まるふくさんが大雨災害で被災されてしまったようですね…😭今私はまるふくさんの近くの遠刈田温泉にて宿泊してます。でも、石巻市からここまで来るのに想像を超えた試練の連続でした…😇冠水地獄に引っ掛かりフィットのアンダーカバーがほとんど外れて、道路にガリガリでした🥺何とか直してやっと…着 https://t.co/B0KdWnJhxh https://t.co/Ci708enNbM,2022-07-16 19:42:50,2022-07-16T10:42:50Z,104
1548256840118517760,1,5,0,http://pbs.twimg.com/media/FXyDXz4VUAEcILX.jpg,まるふくさんが大雨災害で被災されてしまったようですね…😭今私はまるふくさんの近くの遠刈田温泉にて宿泊してます。でも、石巻市からここまで来るのに想像を超えた試練の連続でした…😇冠水地獄に引っ掛かりフィットのアンダーカバーがほとんど外れて、道路にガリガリでした🥺何とか直してやっと…着 https://t.co/B0KdWnJhxh https://t.co/Ci708enNbM,2022-07-16 19:42:50,2022-07-16T10:42:50Z,104
1548256381312319488,2,6,1,http://pbs.twimg.com/ext_tw_video_thumb/1548256012532346880/pu/img/Bw9h1gY0Py5O6os1.jpg,"あすは楽天戦実況生中継！
連勝して欲しい！
ミヤテレスタジアムも球場から生放送！

県内では大雨の被害が出ています。
引き続き土砂災害など
注意してお過ごしください。

#ミヤテレスタジアム
#楽天
#楽天イーグルス
#ベガルタ仙台
#阿波野秀幸
#髙橋礼華
#ミヤギテレビ
#松原稜典
#福盛田悠 https://t.co/2Sec5KLupr",2022-07-16 19:41:01,2022-07-16T10:41:01Z,25
1548256354338750464,1,0,0,http://pbs.twimg.com/media/FXyB7kLakAEmMwo.jpg,"宮城は大雨でだいぶ凄い事になってるみたいだなー
普段大したことなく見える川も増水するととんでもないことになるので無理して外出したり田んぼとかの様子を見に行かない事
←普段の志津川のコメリ近く　→本日新聞にでてたコメリ近く

実家近くの川もだいぶ水位あがってきてるから大丈夫だといいけど https://t.co/w0mp1LY54r",2022-07-16 19:40:54,2022-07-16T10:40:54Z,104
1548256354338750464,1,0,0,http://pbs.twimg.com/media/FXyCHluagAAd7JC.png,"宮城は大雨でだいぶ凄い事になってるみたいだなー
普段大したことなく見える川も増水するととんでもないことになるので無理して外出したり田んぼとかの様子を見に行かない事
←普段の志津川のコメリ近く　→本日新聞にでてたコメリ近く

実家近くの川もだいぶ水位あがってきてるから大丈夫だといいけど https://t.co/w0mp1LY54r",2022-07-16 19:40:54,2022-07-16T10:40:54Z,104
1548256092685475840,1,0,0,http://pbs.twimg.com/media/FXyCtioaQAAsvbS.jpg,関東から東北北海道の太平洋側は大雨被害に注意すること。 https://t.co/v51M9Tz8Aa,2022-07-16 19:39:52,2022-07-16T10:39:52Z,104
1548255864943161344,2,20,3,http://pbs.twimg.com/media/FXyCgRvagAE2_6k.jpg,"３連敗中のヤクルト　４番・村上が３１号同点２ラン　チームは２９人がコロナ陽性で離脱
https://t.co/mZ9ePWh9lu

　「ＤｅＮＡ－ヤクルト」（１６日、横浜スタジアム）

　コロナ禍のヤクルトが２点を追う四回、４番・村上の３１号２ランで同点に追いついた。

　大雨の影響から中断を挟んだこの... https://t.co/iNHXdAtyGv",2022-07-16 19:38:58,2022-07-16T10:38:58Z,25
1548255629361709056,3,5,2,http://pbs.twimg.com/media/FXyCSTeakAAxp6u.jpg,"大雨警報が発令されてる静岡市清水、てっきり中止されたと想ってた今日の灯籠まつりの花火。
大雨の中打ち上げてます！ https://t.co/TSdWRjB1qy",2022-07-16 19:38:01,2022-07-16T10:38:01Z,18
1548255508691238914,1,12,0,http://pbs.twimg.com/media/FXyCLQUVsAMMGkf.jpg,"お疲れ様です
夜仕事の方は顔笑ってください

明日お通夜ができたので諸々確認
靴がへたってたので新調しました🎵

静岡至る所で大雨警報出てたんですね
その他大雨の地域の方も気をつけください⚠️

皆さん素敵な夜を✨😊🤘 https://t.co/dCmlIh295P",2022-07-16 19:37:33,2022-07-16T10:37:33Z,104
1548255168717660162,1,3,0,http://pbs.twimg.com/media/FXyB3u0UcAIbXFp.jpg,"We♥️HAPPYswing vol.3

開催が決まってから この日に夏休みをとる❗️と目標を掲げて働きました💪
今回はTERUちゃんのアクティブ魂に影響されて一人旅も兼ねて色々プランを練りましたが…まさかの大雨☔️💦💦旅のプランは完全リセット状態ですがww
仙台2DAYSが無事に開催されますように🍀
#GLAY https://t.co/zFzf6P9i6j",2022-07-16 19:36:12,2022-07-16T10:36:12Z,104
1548119179433512960,1,0,31,http://pbs.twimg.com/media/FXwGLWLagAAIjSY.jpg,"再びの大雨。
仙台市泉区北部地区では土砂崩れ発生しています。山肌法面緩んでいます。どうか皆さまお気をつけて。#石川けんじ #仙台市議 からの報告より。 https://t.co/ABcXA9Nh1m",2022-07-16 19:35:52,2022-07-16T01:35:49Z,104
1548119179433512960,1,0,31,http://pbs.twimg.com/media/FXwGLz7aQAA-5mN.jpg,"再びの大雨。
仙台市泉区北部地区では土砂崩れ発生しています。山肌法面緩んでいます。どうか皆さまお気をつけて。#石川けんじ #仙台市議 からの報告より。 https://t.co/ABcXA9Nh1m",2022-07-16 19:35:52,2022-07-16T01:35:49Z,104
1548254923241844737,1,1,0,http://pbs.twimg.com/media/FXyBpa4VQAAuqXS.jpg,"#tenki 16:49大雨と雷及び突風に関する全般気象情報 第8号:西日本は16日夜遅くにかけ,東~北日本では17日にかけ,土砂災害,低地の浸水,河川の増水や氾濫に警戒してください.東北地方と中国地では,土砂災害に厳重に警戒してください.西日本と東日本では,落雷や竜巻などの激しい突風に注意してください https://t.co/rJcnblFbZ4",2022-07-16 19:35:13,2022-07-16T10:35:13Z,104
1548254760951681026,1,13,0,http://pbs.twimg.com/media/FXyBf4GUsAUobdS.jpg,"富士山南西部、大雨警報発令中☔️🚨🚨
あと2時間は大雨。
今日一日ずっと降ってるけど、すぐそばの潤井川大丈夫かしら？💦
 #大雨警報 https://t.co/gWVj6Ru5wU",2022-07-16 19:34:34,2022-07-16T10:34:34Z,104
1548202262576521217,2,0,23,http://pbs.twimg.com/media/FXxRv4LUcAEdcE_.jpg,宮城県は、令和4年7月14日からの大雨災害にかかる災害救助法を、大崎市・松島町に適用する事を決定。 https://t.co/fbjWWiwUnt,2022-07-16 19:34:04,2022-07-16T07:05:58Z,25
1548254625912229889,1,2,0,http://pbs.twimg.com/media/FXyBYAjaAAEvn1i.jpg,"現在真庭市に大雨・洪水警報が出ております。
皆さまご自身の安全を1番に行動してくださいませ🙇‍♀️

#岡山 #真庭市 #蒜山 #ひるぜん 
#大雨警報 #洪水警報 https://t.co/WEMwPfiaJ1",2022-07-16 19:34:02,2022-07-16T10:34:02Z,104
1548254502267940872,1,0,0,http://pbs.twimg.com/media/FXyBQs5aMAA_Tmr.jpg,"【NHKニュース】 #nhk_news
相模原市 緑区・中央区・南区の一部に避難指示:相模原市は大雨で土砂災害のおそれが高まっているとして、午後6時すぎ、緑区の一部1万8852世帯3万9747人と、中央区の一部1009世帯2307人、それに南区の一部、368世帯765人に避難指示を出しました。… 
https://t.co/GvwGJisAKQ https://t.co/n4blWk24rh",2022-07-16 19:33:33,2022-07-16T10:33:33Z,104
1548068231264743425,1,0,389,http://pbs.twimg.com/media/FXvX2XfaIAAD9e_.jpg,"おはようござりす
大雨で松島町に「緊急安全確保」が発令されてっちゃ
大崎市も冠水している所があるみでぇだっちゃ
あっつこっつで地盤が緩んで川が増水してっちゃ〜
土砂災害や洪水に警戒してけさいん https://t.co/y8RW0zbJ8y",2022-07-16 19:33:04,2022-07-15T22:13:22Z,104
1548254277915013121,1,8,0,http://pbs.twimg.com/media/FXyBCFHaMAA0vol.jpg,"11日〜13日、仙台と秋田に行ってました〜✈️🚅
大雨凄かったけど、念願のしばっちとの日本酒！🍶を実現！
今朝のkanaさんのセッション聴いて、リアルライブラン（ドリンク😝）ってやっぱり素敵って思いました〜
しばっち、ありがとう！
#ライブラン https://t.co/E3OFfndWMn",2022-07-16 19:32:39,2022-07-16T10:32:39Z,104
1548254277915013121,1,8,0,http://pbs.twimg.com/media/FXyBCFLakAAh1Ol.jpg,"11日〜13日、仙台と秋田に行ってました〜✈️🚅
大雨凄かったけど、念願のしばっちとの日本酒！🍶を実現！
今朝のkanaさんのセッション聴いて、リアルライブラン（ドリンク😝）ってやっぱり素敵って思いました〜
しばっち、ありがとう！
#ライブラン https://t.co/E3OFfndWMn",2022-07-16 19:32:39,2022-07-16T10:32:39Z,104
1548254277915013121,1,8,0,http://pbs.twimg.com/media/FXyBCFkacAAwwF0.jpg,"11日〜13日、仙台と秋田に行ってました〜✈️🚅
大雨凄かったけど、念願のしばっちとの日本酒！🍶を実現！
今朝のkanaさんのセッション聴いて、リアルライブラン（ドリンク😝）ってやっぱり素敵って思いました〜
しばっち、ありがとう！
#ライブラン https://t.co/E3OFfndWMn",2022-07-16 19:32:39,2022-07-16T10:32:39Z,104
1548254127280771072,9,9,8,http://pbs.twimg.com/media/FXyA6-maAAAFdj7.jpg,"東部にも大雨警報
今夜まで浸水害、あす明け方まで土砂災害に警戒を

#静岡 #大雨 https://t.co/Ha669qII9n",2022-07-16 19:32:03,2022-07-16T10:32:03Z,6
1548254127280771072,9,9,8,http://pbs.twimg.com/media/FXyA6-kagAA3WD3.jpg,"東部にも大雨警報
今夜まで浸水害、あす明け方まで土砂災害に警戒を

#静岡 #大雨 https://t.co/Ha669qII9n",2022-07-16 19:32:03,2022-07-16T10:32:03Z,6
1548253886917791745,1,0,0,http://pbs.twimg.com/media/FXyAtJDagAEhwC0.jpg,"岡山 島根で記録的大雨 西日本や東日本は非常に激しい雨に警戒 - nhk․or․jp
https://t.co/57wHxnEF7w

【NHK】低気圧と前線の影響で岡山県と島根県では猛烈な雨が降ったとみられ、気象庁は記録的短時間大雨情報を発表しました。西日本では1… https://t.co/Cd3Bze7la9",2022-07-16 19:31:06,2022-07-16T10:31:06Z,104
1548253705329205249,1,1,0,http://pbs.twimg.com/media/FXyAiD-VsAArjR7.jpg,東北本線の下り列車、大雨の影響で陸前山王までしか行かないの辛い🥺 https://t.co/9ifJCrC3GO,2022-07-16 19:30:23,2022-07-16T10:30:23Z,104
1548253430439092224,8,8,7,http://pbs.twimg.com/media/FXyASavaAAAFfk1.jpg,"解析雨量でも
島田市周辺に猛烈な雨の紫表示

赤は50mm以上の非常に激しい雨です

この状況が2時間以上続くと
かなり危険な状況となります
まだ余裕がある内に安全な場所へ

#静岡 #大雨 https://t.co/nSKvYq0KSM",2022-07-16 19:29:17,2022-07-16T10:29:17Z,7
1548253209013002240,5,13,5,http://pbs.twimg.com/media/FXyAFdAUsAAM5Ct.jpg,"宮城県仙台市の大雨ニュースで皆様からご心配をいただいております
緑水亭大丈夫です
秋保温泉は現在雨止み涼しい風が吹いております
また朝方まで降る予報ひどくならないことを祈るばかり
館内3連休、ご家族の笑い声が響いております
願う事は明日チェックアウト時間帯に
大雨になりませんように。 https://t.co/aewopBxOVG",2022-07-16 19:28:24,2022-07-16T10:28:24Z,11
1548095794162503680,1,0,1,http://pbs.twimg.com/media/FXvw6jjUcAAa4n_.jpg,復旧支援に全力挙げる／記録的大雨の被害現場を調査／埼玉・ときがわ町で矢倉氏 #公明新聞電子版 2022年07月16日付  https://t.co/lEHcxmbf8x https://t.co/fzlD2wBgnW,2022-07-16 19:28:04,2022-07-16T00:02:54Z,104
1548252885783556097,1,11,0,http://pbs.twimg.com/media/FXx_yYNakAIi_1p.jpg,"途中ガスが凄かったけどお釜は絶景でした！
まるふくさん大雨で被害があったとのことでお大事にです。再チャレンジします！
#ジャパン峠プロジェクト
#蔵王エコーライン https://t.co/SrXAo1OCQh",2022-07-16 19:27:07,2022-07-16T10:27:07Z,104
