RID,n,nf,nr,Purl,text,JTime,RTime,Rank
1543947198689574913,1,0,0,http://pbs.twimg.com/media/FW0zyqpaAAAtJ1Q.jpg,"月曜22時台🔈

先ず被害に遭われた皆様へ
お悔やみ•お見舞い申し上げます.

台風による大雨の影響が
出ている地域があるかと思います.
早めの判断＋避難をして
身の安全を図ってください🙇‍♀️

#東日本大震災 #熊本地震
#九州北部豪雨 #大阪北部地震
#西日本豪雨  #北海道胆振東部地震
#スマスマ #SMAP https://t.co/lxHektOFBM",2022-07-04 22:17:51,2022-07-04T13:17:51Z,43
1543947003297959936,1,9,0,http://pbs.twimg.com/media/FW0zkUcaUAAFG3N.jpg,"4日午後からの北見地方大雨の影響で特急大雪1号の北見～網走間が部分運休になり折り返しの特急オホーツク4号も北見始発になった関係で北見運転所の留置線にキハ183が入線して来ました。
きたかみさん情報ありがとうございます https://t.co/rRtDtacMf6",2022-07-04 22:17:05,2022-07-04T13:17:05Z,43
1543947003297959936,1,9,0,http://pbs.twimg.com/media/FW0zlmwaUAYC2Ru.jpg,"4日午後からの北見地方大雨の影響で特急大雪1号の北見～網走間が部分運休になり折り返しの特急オホーツク4号も北見始発になった関係で北見運転所の留置線にキハ183が入線して来ました。
きたかみさん情報ありがとうございます https://t.co/rRtDtacMf6",2022-07-04 22:17:05,2022-07-04T13:17:05Z,43
1543947003297959936,1,9,0,http://pbs.twimg.com/media/FW0zmpuacAErW-l.jpg,"4日午後からの北見地方大雨の影響で特急大雪1号の北見～網走間が部分運休になり折り返しの特急オホーツク4号も北見始発になった関係で北見運転所の留置線にキハ183が入線して来ました。
きたかみさん情報ありがとうございます https://t.co/rRtDtacMf6",2022-07-04 22:17:05,2022-07-04T13:17:05Z,43
1543947003297959936,1,9,0,http://pbs.twimg.com/media/FW0zncZaAAAEsJb.jpg,"4日午後からの北見地方大雨の影響で特急大雪1号の北見～網走間が部分運休になり折り返しの特急オホーツク4号も北見始発になった関係で北見運転所の留置線にキハ183が入線して来ました。
きたかみさん情報ありがとうございます https://t.co/rRtDtacMf6",2022-07-04 22:17:05,2022-07-04T13:17:05Z,43
1543946557548265479,1,0,0,http://pbs.twimg.com/media/FW0zLOtaQAAYLwo.jpg,#舞鶴港 の #フェリーターミナル で乗船待機中です。昨夜は #てんきてんき村オートキャンプ場 で宿泊、大雨警報もありましたが十分に睡眠できました。朝は海岸を散歩です。#伊根 #天橋立 #三方五湖 まで足をのばしました。あと少し、 #安全運転 で行こう❗またこれるかな😀 https://t.co/j8g4AfjYjI,2022-07-04 22:15:19,2022-07-04T13:15:19Z,43
1543946557548265479,1,0,0,http://pbs.twimg.com/media/FW0zMBwaAAA3tQi.jpg,#舞鶴港 の #フェリーターミナル で乗船待機中です。昨夜は #てんきてんき村オートキャンプ場 で宿泊、大雨警報もありましたが十分に睡眠できました。朝は海岸を散歩です。#伊根 #天橋立 #三方五湖 まで足をのばしました。あと少し、 #安全運転 で行こう❗またこれるかな😀 https://t.co/j8g4AfjYjI,2022-07-04 22:15:19,2022-07-04T13:15:19Z,43
1543946557548265479,1,0,0,http://pbs.twimg.com/media/FW0zM77aAAEEaw7.jpg,#舞鶴港 の #フェリーターミナル で乗船待機中です。昨夜は #てんきてんき村オートキャンプ場 で宿泊、大雨警報もありましたが十分に睡眠できました。朝は海岸を散歩です。#伊根 #天橋立 #三方五湖 まで足をのばしました。あと少し、 #安全運転 で行こう❗またこれるかな😀 https://t.co/j8g4AfjYjI,2022-07-04 22:15:19,2022-07-04T13:15:19Z,43
1543945768238587904,1,0,0,http://pbs.twimg.com/media/FW0vRPhVEAArji7.png,"〈台風第4号に関する情報〉
○大雨
高知県：250mm/24h
徳島県・和歌山県：200mm/24h
鹿児島県：180mm/24h

○高波
九州西海上：しけ(4m、うねりを伴う)
豊後水道：しけ(4m、うねりを伴う)
鹿児島県：しけ(4m、うねりを伴う）

落雷や竜巻などの激しい突風にも、各地で注意が必要です。 https://t.co/51nLoLPnLy",2022-07-04 22:12:10,2022-07-04T13:12:10Z,43
1543945768238587904,1,0,0,http://pbs.twimg.com/media/FW0vRQHVUAAlxEE.jpg,"〈台風第4号に関する情報〉
○大雨
高知県：250mm/24h
徳島県・和歌山県：200mm/24h
鹿児島県：180mm/24h

○高波
九州西海上：しけ(4m、うねりを伴う)
豊後水道：しけ(4m、うねりを伴う)
鹿児島県：しけ(4m、うねりを伴う）

落雷や竜巻などの激しい突風にも、各地で注意が必要です。 https://t.co/51nLoLPnLy",2022-07-04 22:12:10,2022-07-04T13:12:10Z,43
1543746581601538048,1,0,4,http://pbs.twimg.com/media/FWx9VIoaMAEFQi0.jpg,愛南町、大雨警報も発表されました。 https://t.co/fCrOkGOr1r,2022-07-04 22:10:13,2022-07-04T00:00:41Z,43
1543870040344121344,1,0,10,http://pbs.twimg.com/media/FWzsyVQUcAEhw3_.jpg,台風４号、東海地方への最接近は６日（水）未明～朝となりそうです。ただ、すでに大雨となっている所があり、あさってにかけて長く大雨に警戒が必要です。 https://t.co/rnVefZ96nE,2022-07-04 22:07:36,2022-07-04T08:11:15Z,43
1543944344939679744,10,40,9,http://pbs.twimg.com/media/FW0xMpDacAIORzb.jpg,"【#広島 の天気】#まゆてん
台風4号はこのあと進路を変え、
九州を通過し、広島のすぐ南を進む見込み。
台風自体はそれほど勢力は強くなく、
発達した雨雲は四国など太平洋側が中心。
広島は大雨にはならないとみています。
とはいえ時折雨で、局地的にざっと強まる所も⚡️風もやや強まる。 https://t.co/S5FXj9POPg",2022-07-04 22:06:31,2022-07-04T13:06:31Z,3
1543910127920893952,1,0,3,http://pbs.twimg.com/media/FW0SEy2agAA49fj.jpg,"佐伯市に大雨警報が発表されました。
あす5日夕方まで土砂災害に警戒が必要です。 https://t.co/GvhQr2FdpW",2022-07-04 22:05:44,2022-07-04T10:50:33Z,43
1543943884157636608,5,0,4,http://pbs.twimg.com/media/FW0wxDFagAAq6Su.jpg,"月曜日の22時です。 #西日本豪雨 や #熱海土石流 #令和2年7月豪雨 など、大雨被害が記憶に新しいですが、台風の影響で大雨に見舞われている地域に、被害が出ないことを願っています。早く穏やかな日常が戻ってきますように。

#スマスマ #復興に向けて手を繋ごう #いっしょにがんばりましょう #SMAP https://t.co/mS9tO9x63f",2022-07-04 22:04:41,2022-07-04T13:04:41Z,13
1543943884157636608,5,0,4,http://pbs.twimg.com/media/FW0wxUyaQAEKFkj.jpg,"月曜日の22時です。 #西日本豪雨 や #熱海土石流 #令和2年7月豪雨 など、大雨被害が記憶に新しいですが、台風の影響で大雨に見舞われている地域に、被害が出ないことを願っています。早く穏やかな日常が戻ってきますように。

#スマスマ #復興に向けて手を繋ごう #いっしょにがんばりましょう #SMAP https://t.co/mS9tO9x63f",2022-07-04 22:04:41,2022-07-04T13:04:41Z,13
1543943884157636608,5,0,4,http://pbs.twimg.com/media/FW0wxmtaAAIoWwU.jpg,"月曜日の22時です。 #西日本豪雨 や #熱海土石流 #令和2年7月豪雨 など、大雨被害が記憶に新しいですが、台風の影響で大雨に見舞われている地域に、被害が出ないことを願っています。早く穏やかな日常が戻ってきますように。

#スマスマ #復興に向けて手を繋ごう #いっしょにがんばりましょう #SMAP https://t.co/mS9tO9x63f",2022-07-04 22:04:41,2022-07-04T13:04:41Z,13
1543943884157636608,5,0,4,http://pbs.twimg.com/media/FW0wx6PacAA5MCs.jpg,"月曜日の22時です。 #西日本豪雨 や #熱海土石流 #令和2年7月豪雨 など、大雨被害が記憶に新しいですが、台風の影響で大雨に見舞われている地域に、被害が出ないことを願っています。早く穏やかな日常が戻ってきますように。

#スマスマ #復興に向けて手を繋ごう #いっしょにがんばりましょう #SMAP https://t.co/mS9tO9x63f",2022-07-04 22:04:41,2022-07-04T13:04:41Z,13
1543943416752484352,1,2,0,http://pbs.twimg.com/media/FW0wWiRUEAATdH5.jpg,"東日本大震災から11年、熊本地震から6年が経ちましたが、まだまだ皆さんの協力が必要です。また、この度の大雨で多くの方が被災されています。一人一人が出来ることは小さくても集まれば大きな力になると信じて……。

#SMAP #スマスマ #新しい地図 #震災復興 #復興に向けて手を繋ごう https://t.co/skiokWYtFK",2022-07-04 22:02:50,2022-07-04T13:02:50Z,43
1543943112677924865,1,0,0,http://pbs.twimg.com/media/FW0wE2IUEAUFwhu.jpg,"東日本大震災から11年、熊本地震から6年が経ちましたが、まだまだ皆さんの協力が必要です。また、この度の大雨で多くの方が被災されています。一人一人が出来ることは小さくても集まれば大きな力になると信じて……。

#SMAP #スマスマ #新しい地図 #震災復興 #復興に向けて手を繋ごう https://t.co/OUwjOAwxuN",2022-07-04 22:01:37,2022-07-04T13:01:37Z,43
1543942924702195713,28,22,27,http://pbs.twimg.com/media/FW0v5N_aAAADa8o.jpg,"月曜日の夜10時
#スマスマ の時間です
#SMAP の復興支援の想いを繋ぎます
#復興に向けて手を繋ごう 
照りつける暑さから台風の影響で蒸し蒸し🥵
大雨や風の備えも要るし、体調にも気をつけないと。
季節の野菜を摂って元気をつけよう！
熊本県産のかぼちゃ🎃
甘くてホクホクです
#大事なのは続けること https://t.co/5PBlNGycnS",2022-07-04 22:00:52,2022-07-04T13:00:52Z,2
1543942924702195713,28,22,27,http://pbs.twimg.com/media/FW0v58SakAAHvhQ.jpg,"月曜日の夜10時
#スマスマ の時間です
#SMAP の復興支援の想いを繋ぎます
#復興に向けて手を繋ごう 
照りつける暑さから台風の影響で蒸し蒸し🥵
大雨や風の備えも要るし、体調にも気をつけないと。
季節の野菜を摂って元気をつけよう！
熊本県産のかぼちゃ🎃
甘くてホクホクです
#大事なのは続けること https://t.co/5PBlNGycnS",2022-07-04 22:00:52,2022-07-04T13:00:52Z,2
1543942604525514752,1,1,0,http://pbs.twimg.com/media/FW0vnVeVQAAyLDf.jpg,"九州は本当に最近、大雨だらけなんだね。
福岡県は大雨特別警報5年連続出されていたし。 https://t.co/l8JPgehfay",2022-07-04 21:59:36,2022-07-04T12:59:36Z,43
1543221479289958401,1,63,7,http://pbs.twimg.com/media/FW0uDSIUEAAZzVs.jpg,昨日、新見市は大雨が降り、あちこちの側溝が溢れましたが、いつも作業をしている側溝は溢れずに済んだと現場前のご主人から連絡とお礼がありました！台所や洗濯機等からの生活雑排水と山からの土砂がたまる側溝で溢れると少し厄介なので、継続の成果が出てよかったです！台風も何もありませんように！ https://t.co/jvgH4uT5Ta https://t.co/Q5XL2KISQj,2022-07-04 21:52:46,2022-07-02T13:14:06Z,43
1543221479289958401,1,63,7,http://pbs.twimg.com/media/FW0uDSNUIAEkAKM.jpg,昨日、新見市は大雨が降り、あちこちの側溝が溢れましたが、いつも作業をしている側溝は溢れずに済んだと現場前のご主人から連絡とお礼がありました！台所や洗濯機等からの生活雑排水と山からの土砂がたまる側溝で溢れると少し厄介なので、継続の成果が出てよかったです！台風も何もありませんように！ https://t.co/jvgH4uT5Ta https://t.co/Q5XL2KISQj,2022-07-04 21:52:46,2022-07-02T13:14:06Z,43
1543908031821672448,2,0,6,http://pbs.twimg.com/media/FW0QH5iacAU7DQ_.jpg,"佐伯市に大雨警報が発表されました。
あす夕方まで土砂災害に警戒が必要です。
特に蒲江周辺で降り方が強まっています。
キキクルやレーダーなど確認しつつ、安全な場所で過ごすようにしてください。 https://t.co/IAwrsFW9fO",2022-07-04 21:52:12,2022-07-04T10:42:13Z,16
1543908031821672448,2,0,6,http://pbs.twimg.com/media/FW0QH5fagAEQj1P.jpg,"佐伯市に大雨警報が発表されました。
あす夕方まで土砂災害に警戒が必要です。
特に蒲江周辺で降り方が強まっています。
キキクルやレーダーなど確認しつつ、安全な場所で過ごすようにしてください。 https://t.co/IAwrsFW9fO",2022-07-04 21:52:12,2022-07-04T10:42:13Z,16
1543940679125987328,1,1,0,http://pbs.twimg.com/media/FW0t3QvUUAIcbTo.jpg,今‼️筑紫野から古賀インターまで今大雨でしたが北九州に来たら晴れとるなぁー今から来るんやろーなぁ😃　#恋寿華堂　#こんぺいとうカフェ　#金平糖専門店　#konpeitou #北九州カフェ　#conpeitou　#通販サイト　#福岡金平糖　#縁起物　#こんぺいとう　#コンペイトウ　#金平糖　#筑紫野　#古賀インター https://t.co/0xezq1mMzr,2022-07-04 21:51:57,2022-07-04T12:51:57Z,43
1543737988382740481,1,0,7,http://pbs.twimg.com/media/FWx1g92UYAAfsnI.jpg,"おはようございます☔️。
高知県はまだ台風はまだ来ていないけど、かなり☔️が降っています😢。
大雨☔️に負けないで、ラピスの空のように頑張りまーす😊🍀^_^。 https://t.co/tU0JmvGCfK",2022-07-04 21:48:54,2022-07-03T23:26:32Z,43
1543869751507963904,2,0,20,http://pbs.twimg.com/media/FWztWr0akAAK3Vt.jpg,"台風4号の影響で、あしたは雨。
高知でも大雨の恐れがあるがやと。
みんな、気をつけてね。

#高知地方気象台17時発表
#天気予報 https://t.co/ireCPIFlkM",2022-07-04 21:45:15,2022-07-04T08:10:07Z,16
1543938385555107841,6,24,5,http://pbs.twimg.com/media/FW0rxxtagAAHPjj.jpg,"💠三重県 天気💠
7/5(火)
一日雨で、雷を伴い雨足が強まる所もある見込み。台風4号などの影響で湿った空気が流れ込みやすく、大雨になる恐れがあります。土砂災害や河川増水にも警戒を⚠️
また風もでてくるのでしっかりした傘があると安心🌂
気温は27℃前後でジメジメ。
#三重 #三重県 https://t.co/dUEYVtj3LI",2022-07-04 21:42:50,2022-07-04T12:42:50Z,7
1543938150661124096,1,1,0,http://pbs.twimg.com/media/FW0rYz3aAAAeNcp.jpg,"ウクライナ復興で日本の知見が期待されている

ニュースウオッチ９▽スマホ使えないに備え▽台風接近で大雨に警戒▽熱海土石流 https://t.co/iK3zGaVhcw https://t.co/OjVA36bjqL",2022-07-04 21:41:54,2022-07-04T12:41:54Z,43
1543938150661124096,1,1,0,http://pbs.twimg.com/media/FW0rYzyaQAATfzW.jpg,"ウクライナ復興で日本の知見が期待されている

ニュースウオッチ９▽スマホ使えないに備え▽台風接近で大雨に警戒▽熱海土石流 https://t.co/iK3zGaVhcw https://t.co/OjVA36bjqL",2022-07-04 21:41:54,2022-07-04T12:41:54Z,43
1543938150661124096,1,1,0,http://pbs.twimg.com/media/FW0rYzuagAA1FBO.jpg,"ウクライナ復興で日本の知見が期待されている

ニュースウオッチ９▽スマホ使えないに備え▽台風接近で大雨に警戒▽熱海土石流 https://t.co/iK3zGaVhcw https://t.co/OjVA36bjqL",2022-07-04 21:41:54,2022-07-04T12:41:54Z,43
1543938150661124096,1,1,0,http://pbs.twimg.com/media/FW0rYz0aAAAPBRh.jpg,"ウクライナ復興で日本の知見が期待されている

ニュースウオッチ９▽スマホ使えないに備え▽台風接近で大雨に警戒▽熱海土石流 https://t.co/iK3zGaVhcw https://t.co/OjVA36bjqL",2022-07-04 21:41:54,2022-07-04T12:41:54Z,43
1543937954950721536,6,149,5,http://pbs.twimg.com/media/FW0rYd0VQAIRZDa.jpg,"台風までに掘らないと！！

大雨に弱い畑の鳴門金時🍠

昨日、無事に掘り終わりました🤗

救出作戦

大成功です🙆

今日は１日雨だったので、本当によかった

これで台風が来ても少し安心です🤗

今後の台風の動きが気になります。

どこも被害が無い事を願っています🙏

#鳴門金時　#仲井農園 https://t.co/PKTzTVRnfR",2022-07-04 21:41:08,2022-07-04T12:41:08Z,7
1543937954950721536,6,149,5,http://pbs.twimg.com/media/FW0rYypUsAMLk4_.jpg,"台風までに掘らないと！！

大雨に弱い畑の鳴門金時🍠

昨日、無事に掘り終わりました🤗

救出作戦

大成功です🙆

今日は１日雨だったので、本当によかった

これで台風が来ても少し安心です🤗

今後の台風の動きが気になります。

どこも被害が無い事を願っています🙏

#鳴門金時　#仲井農園 https://t.co/PKTzTVRnfR",2022-07-04 21:41:08,2022-07-04T12:41:08Z,7
1543936780076187648,1,16,1,http://pbs.twimg.com/media/FW0qT1uaMAAJOV_.jpg,"大雨による規制の影響で鹿児島中央行きが並ぶ面白い1枚に。1番の817系は多分元直方車だと思われます。

6963M 普通 鹿児島中央行
415系500番台 Fk514
at 日豊本線
on 07/04/2022 https://t.co/PGMBoqERbx",2022-07-04 21:36:27,2022-07-04T12:36:27Z,43
1543936579441664005,1,10,0,http://pbs.twimg.com/media/FW0qIsFaMAgzUnQ.jpg,"初めての富士山登山の準備ですが、、ちょこっとずつ前進してまして😊
先日、とうとうレインウェアGETしました！
今日は台風の影響で大雨の中の出勤だったため、初おろし🥰
みせてもらおうか、GORE-TEXの実力とやらを…笑
大雨なのにこんなにウキウキしたの初めてです🤣🤣 https://t.co/TbHN8gjvcz",2022-07-04 21:35:40,2022-07-04T12:35:40Z,43
1543927375519395840,5,0,10,http://pbs.twimg.com/media/FW0hti5UEAEBv-G.jpg,"【台風4号】
あすの午前中にも九州北部にかなり接近、上陸するおそれがあります。西日本の太平洋側と東海を中心に、広範囲で大雨に警戒が必要です。関東は(水)の朝に雨と風のピークとなりそうです。 https://t.co/rzQBPxcPcL",2022-07-04 21:34:00,2022-07-04T11:59:05Z,13
1543881441917906945,5,0,67,http://pbs.twimg.com/amplify_video_thumb/1543879156848414720/img/pUn6Q9zl6GaXp3lr.jpg,"【動画】あす7月5日(火)の天気
「太平洋側では大雨に警戒を」お天気お姉さん大島璃音キャスターからのメッセージはこちら→https://t.co/MzQGeO1NBX https://t.co/w01Ozo1XGB",2022-07-04 21:33:41,2022-07-04T08:56:34Z,13
1543852894939922434,1,0,51,http://pbs.twimg.com/media/FWzdg-JaQAAxhfA.jpg,北海道道東を中心に雨雲が発達し、雨が勢いを増しています。1時間に50mmを超える記録的な雨を観測し、雹や雷が頻発している状況です。十勝地方・釧路地方・青森県には大雨警報が発表されています。 https://t.co/acHqDOLpNB,2022-07-04 21:33:33,2022-07-04T07:03:08Z,43
1543920288806879232,7,0,51,http://pbs.twimg.com/media/FW0bUQ8aIAIxS6o.jpg,"あすの近畿の天気イラスト
台風が九州にいても、南から非常に湿った空気が入るので、近畿南部を中心に大雨に警戒！
近畿北部、中部も急な激しい雨に各地注意！ https://t.co/V6ET1NBUSs",2022-07-04 21:32:46,2022-07-04T11:30:56Z,4
