RID,n,nf,nr,Purl,text,JTime,RTime,Rank
1574897562078785536,1,5,0,http://pbs.twimg.com/media/Fdso_ASVUAAVkvw.jpg,"今日の伊那市は小雨降る曇天です。
今日は一日曇り空みたいです。
昨晩は大雨で安定しない天気が続きますが、秋ってこんなでしたっけね？

#企業公式が毎朝地元の天気を言い合う
 #企業公式秋のフォロー祭り https://t.co/ha1u85dDc5",2022-09-28 08:03:33,2022-09-27T23:03:33Z,27
1574897139347783681,1,6,0,http://pbs.twimg.com/media/FdsomXSVUAAMdT3.jpg,"おはようございます😊

今の東大阪は曇☁️

昨日は晴れたと思っていたら大雨が。今日も曇っているので洗濯物は外に出すのはギャンブルになりそうな…。

では今日も良い1日を😊

#企業公式が毎朝地元の天気を言い合う
#企業公式秋のフォロー祭り 
#企業公式相互フォロー
#東大阪
#妊活
#不妊 https://t.co/NskqVfDV4B",2022-09-28 08:01:52,2022-09-27T23:01:52Z,27
1574896672693399552,1,0,0,http://pbs.twimg.com/media/Fc_EVWgaAAAOCnn.jpg,"⏰月光団本部から深夜のお知らせ
📢「それゆけ！月光団本部」は「台風」「地震」「大雨」などの気象災害、大きな事件・事故などが発生した場合、放送スケジュールを変更し、みなさんの安全と安心に直結した情報を放送します。 https://t.co/MHCeQc2SiF",2022-09-28 08:00:01,2022-09-27T23:00:01Z,27
1574893818285297664,1,1,0,http://pbs.twimg.com/media/FdslktdakAAvxSa.jpg,"みゆちゃん、おはよー！！
今朝のこちらはいい天気だよー☀️
風も爽やかで気持ちいいー！
富士山もうーっすらと見えるよ。

さ、週の真ん中水曜日。
まだまだ大雨の被害は残ってるけど張り切って行ってきまーす！！
今日も一日笑顔で一緒に頑張ってこうねー！！😊✨
#門脇実優菜
#オニオン隊 https://t.co/XWixVOg0tQ",2022-09-28 07:48:41,2022-09-27T22:48:41Z,27
1574891791979253760,1,7,0,http://pbs.twimg.com/media/FdsjvFHUcAAkpDv.jpg,"昨日は、大雨・土砂降り、雷もすごく「まずい！」と思って、パソコンやらハードディスクに刺さったコンセントを抜いて仕事。

今日もずっと太陽を見ることない一日になりそうですが、気温もそんなに上がらないので良しということにしておきます😌

今日のポートレート写真は横浜某所で撮ったもです😌✨ https://t.co/4AUFZUWgk6",2022-09-28 07:40:37,2022-09-27T22:40:37Z,27
1574891634273263621,1,0,0,http://pbs.twimg.com/media/FdrzAsxVQAEyc7g.jpg,"台風による大雨で被害が発生した天竜浜名湖鉄道が、昨日27日に運行再開。沿線には被害の跡が残っているそうですが、歴史ある鉄道施設とともに穏やかな景観が再び見られることを願っています。

#天浜線 #天竜二俣 #転車台 https://t.co/QIYelDb0X6",2022-09-28 07:40:00,2022-09-27T22:40:00Z,27
1574891634273263621,1,0,0,http://pbs.twimg.com/media/Fdrzf0ZUcAEkY43.jpg,"台風による大雨で被害が発生した天竜浜名湖鉄道が、昨日27日に運行再開。沿線には被害の跡が残っているそうですが、歴史ある鉄道施設とともに穏やかな景観が再び見られることを願っています。

#天浜線 #天竜二俣 #転車台 https://t.co/QIYelDb0X6",2022-09-28 07:40:00,2022-09-27T22:40:00Z,27
1574710727029366786,1,0,32,http://pbs.twimg.com/media/Fdp-er6UAAAV89k.jpg,"＃静岡県 ＃島田市 の市道石上日掛線の災害箇所では、地元の方の大雨時の状況説明を伺いながら、災害状況調査を行いました。

＃中部地方整備局 ＃名四国道事務所 ＃TECFORCE https://t.co/fpZkpsykUQ",2022-09-28 07:39:48,2022-09-27T10:41:08Z,27
1574710727029366786,1,0,32,http://pbs.twimg.com/media/Fdp-gllUoAAkaV1.jpg,"＃静岡県 ＃島田市 の市道石上日掛線の災害箇所では、地元の方の大雨時の状況説明を伺いながら、災害状況調査を行いました。

＃中部地方整備局 ＃名四国道事務所 ＃TECFORCE https://t.co/fpZkpsykUQ",2022-09-28 07:39:48,2022-09-27T10:41:08Z,27
1574891515352326144,3,3,2,http://pbs.twimg.com/media/Fdsjev5akAEgcVz.jpg,"今月23日大雨で被災された方、お見舞い申し上げます。

弊社事務所では水道、トイレ、お風呂を解放しております。
事務所にスタッフ不在の事もございますので、その際にはメッセージ等頂けますと幸いです。

めぐみ不動産
住所:静岡市駿河区大谷1-19-19

#清水区断水
#水道
#めぐみ不動産 https://t.co/tndsalYBsu",2022-09-28 07:39:31,2022-09-27T22:39:31Z,2
1574891274062397440,1,15,0,http://pbs.twimg.com/media/FdsjQ2IaAAATv0L.jpg,"おはよーございますヾ(๑╹◡╹)ﾉ""

昨日は朝から線状降水帯発生で大雨大変でした(*_*)
それにしても福岡はまだ暑い🫠もう10月なるのに週末は30℃って(　ﾟдﾟ)

まだ水曜日、よろしくお願いします🫡
👇ヘッドロココとHiν👇
大トリは私の1番大好きなヘッド😇
#ガンプラ https://t.co/HDOX8ruWHV",2022-09-28 07:38:34,2022-09-27T22:38:34Z,27
1574237189231476736,1,0,73,http://pbs.twimg.com/media/FdjQXyYaAAEUFDe.jpg,山形県へ視察に来ました。先月の大雨による農林水産関係(農業用ため池、アスパラガス団地、農業用水路)の被害状況の実態調査です。#山形県 #参議院 https://t.co/IW4ut9Xyde,2022-09-28 07:28:51,2022-09-26T03:19:28Z,27
1574886707920797697,1,42,0,http://pbs.twimg.com/media/FdsfHGAUoAAZwfM.jpg,"中1日ずつのゴルフ3連戦が終わりました✨
明智の大雨の85は大満足で☺️、ホームの月例の2OBは悲しくて😇、豊田で判断ミスしてトリ叩いたのは反省します🥶 https://t.co/ATHhepaZCs",2022-09-28 07:20:25,2022-09-27T22:20:25Z,27
1574886707920797697,1,42,0,http://pbs.twimg.com/media/FdsfHF_UUAI61tg.jpg,"中1日ずつのゴルフ3連戦が終わりました✨
明智の大雨の85は大満足で☺️、ホームの月例の2OBは悲しくて😇、豊田で判断ミスしてトリ叩いたのは反省します🥶 https://t.co/ATHhepaZCs",2022-09-28 07:20:25,2022-09-27T22:20:25Z,27
1574886707920797697,1,42,0,http://pbs.twimg.com/media/FdsfHF-UcAAeZZR.jpg,"中1日ずつのゴルフ3連戦が終わりました✨
明智の大雨の85は大満足で☺️、ホームの月例の2OBは悲しくて😇、豊田で判断ミスしてトリ叩いたのは反省します🥶 https://t.co/ATHhepaZCs",2022-09-28 07:20:25,2022-09-27T22:20:25Z,27
1574885179990380544,1,6,0,http://pbs.twimg.com/media/FdsduEUaUAA67ft.jpg,"おはようございます😃

☀️

秋晴れと呼ぶにふさわしい天気

最近は録画した番組を見る程度で
あまりテレビでニュースを見る機会がないが
国葬の話題はあるが
今回の静岡の大雨被害が余り報道されてないように感じる
(見てないのでわからないのだが)

想像以上の大きな被害に驚き

ホトトギス https://t.co/468SBOQ0jO",2022-09-28 07:14:21,2022-09-27T22:14:21Z,27
1574885179990380544,1,6,0,http://pbs.twimg.com/media/FdsduETagAAc_RQ.jpg,"おはようございます😃

☀️

秋晴れと呼ぶにふさわしい天気

最近は録画した番組を見る程度で
あまりテレビでニュースを見る機会がないが
国葬の話題はあるが
今回の静岡の大雨被害が余り報道されてないように感じる
(見てないのでわからないのだが)

想像以上の大きな被害に驚き

ホトトギス https://t.co/468SBOQ0jO",2022-09-28 07:14:21,2022-09-27T22:14:21Z,27
1574885179990380544,1,6,0,http://pbs.twimg.com/media/FdsduEaacAUsS33.jpg,"おはようございます😃

☀️

秋晴れと呼ぶにふさわしい天気

最近は録画した番組を見る程度で
あまりテレビでニュースを見る機会がないが
国葬の話題はあるが
今回の静岡の大雨被害が余り報道されてないように感じる
(見てないのでわからないのだが)

想像以上の大きな被害に驚き

ホトトギス https://t.co/468SBOQ0jO",2022-09-28 07:14:21,2022-09-27T22:14:21Z,27
1574885179990380544,1,6,0,http://pbs.twimg.com/media/FdsduEYacAEbTk8.jpg,"おはようございます😃

☀️

秋晴れと呼ぶにふさわしい天気

最近は録画した番組を見る程度で
あまりテレビでニュースを見る機会がないが
国葬の話題はあるが
今回の静岡の大雨被害が余り報道されてないように感じる
(見てないのでわからないのだが)

想像以上の大きな被害に驚き

ホトトギス https://t.co/468SBOQ0jO",2022-09-28 07:14:21,2022-09-27T22:14:21Z,27
1574884999366553600,1,0,0,http://pbs.twimg.com/media/FZAgOlraUAAmOG6.jpg,あついぞ熊谷！最高気温日本一になーれ。大雨の記録で喜んで不謹慎だったり、気象台が嘘ついたり、ライバル叩いて自身は記録を捏造したり、マスコミ取り込んで売名したり。気象町おこし何でもやってるって噂よん。これからも売名やるぞよん！ #ズル熊 #ぜーんぶ八木橋案件 https://t.co/UO9wVgefLh,2022-09-28 07:13:38,2022-09-27T22:13:38Z,27
1574884999366553600,1,0,0,http://pbs.twimg.com/media/FZAgO1oaQAEfldY.jpg,あついぞ熊谷！最高気温日本一になーれ。大雨の記録で喜んで不謹慎だったり、気象台が嘘ついたり、ライバル叩いて自身は記録を捏造したり、マスコミ取り込んで売名したり。気象町おこし何でもやってるって噂よん。これからも売名やるぞよん！ #ズル熊 #ぜーんぶ八木橋案件 https://t.co/UO9wVgefLh,2022-09-28 07:13:38,2022-09-27T22:13:38Z,27
1574884999366553600,1,0,0,http://pbs.twimg.com/media/FZAgPD_agAESg-a.jpg,あついぞ熊谷！最高気温日本一になーれ。大雨の記録で喜んで不謹慎だったり、気象台が嘘ついたり、ライバル叩いて自身は記録を捏造したり、マスコミ取り込んで売名したり。気象町おこし何でもやってるって噂よん。これからも売名やるぞよん！ #ズル熊 #ぜーんぶ八木橋案件 https://t.co/UO9wVgefLh,2022-09-28 07:13:38,2022-09-27T22:13:38Z,27
1574884999366553600,1,0,0,http://pbs.twimg.com/media/FZAgPRxagAYgX1E.jpg,あついぞ熊谷！最高気温日本一になーれ。大雨の記録で喜んで不謹慎だったり、気象台が嘘ついたり、ライバル叩いて自身は記録を捏造したり、マスコミ取り込んで売名したり。気象町おこし何でもやってるって噂よん。これからも売名やるぞよん！ #ズル熊 #ぜーんぶ八木橋案件 https://t.co/UO9wVgefLh,2022-09-28 07:13:38,2022-09-27T22:13:38Z,27
1574881654882959360,1,13,0,http://pbs.twimg.com/media/FdsahEdVsAEfdOT.jpg,"ブラジルから帰国して速攻渋谷のWOMBで開催されたVOLTに出演しホテルで休んでからGAIAに出演する為京都へ行こうとしたら大雨で静岡駅でストップし8時間も水、食い物もない状況で隔離され外に出てからマサト君に電話して助けてもらGAIAに連れてってもらえた神ストーリー！
#烈風伝説スペソニ編 https://t.co/wmggnq6VNn",2022-09-28 07:00:21,2022-09-27T22:00:21Z,27
1574880032153276416,1,4,0,http://pbs.twimg.com/media/FdsZCoWaIAEQAyA.jpg,"静岡県こないだの大雨の被害…
断水…
早く水が手元に届きますように
  #静岡県
 #被災 https://t.co/ZkM4qGvPvv",2022-09-28 06:53:54,2022-09-27T21:53:54Z,27
1573298232435904512,1,0,5990,http://pbs.twimg.com/media/FdV6ZffVQAAannQ.jpg,乗車中の新幹線が大雨の影響で豊橋駅に停まっているのですが、ホームに出るために隣の新幹線を経由するという珍しい経験をしました。おかげさまで改札近くの売店で飲食物を購入する事ができました😌 https://t.co/FraEVAVRjb,2022-09-28 06:48:28,2022-09-23T13:08:23Z,27
1574878299352072192,13,29,13,http://pbs.twimg.com/ext_tw_video_thumb/1574878246427992064/pu/img/mfOvoPaF3GAlCCnO.jpg,"令和4年9月28日(水曜日)
【また大雨が降ったら】
動画撮影は、昨日です。
静岡市葵区牛妻の小学校の
真横を流れる川に架かる橋
橋の下と川底の高さは、15㌢
周辺は、住宅地も広がる場所
農業用水入口も土砂で埋まって
水も止まったままでした。
静岡市内至る所に…(´θ`llll) https://t.co/cmygzms1Nq",2022-09-28 06:47:01,2022-09-27T21:47:01Z,1
