RID,n,nf,nr,Purl,text,JTime,RTime,Rank
1555876252216881152,1,0,0,http://pbs.twimg.com/media/FZeVMURakAAEc0I.jpg,"5日、福井市は、大雨で土砂災害や河川の氾濫の危険性が高まっているとして、福井市全域の9万9872世帯26万5904人に避難指示を出した。
敦賀市も土砂災害の為、国道や高速道路が通行止めだ。

この異常災害に、岸田文雄首相からは見舞いの言葉が全く無い‼️ https://t.co/mFWZR6BKQn",2022-08-06 20:19:39,2022-08-06T11:19:39Z,25
1555790048955895808,1,0,2,http://pbs.twimg.com/media/FZdGzK6akAAqm4F.jpg,"本日8/6は77回目の広島•原爆の日。
街頭から「核なき世界」の実現に向けた公明党の取り組みと大雨被害等対策も含め、防災•減災への公明党の取り組みをお訴えさせて頂きました。 https://t.co/n6g1q6C6Ls",2022-08-06 20:19:31,2022-08-06T05:37:07Z,25
1555876183375749120,1,0,0,http://pbs.twimg.com/ext_tw_video_thumb/1555876169622630401/pu/img/C1fLgqvIkzG1YxZY.jpg,"お問合せありがとうございます。
🔽飼い主さんを募集している
猫たちのページを更新しました。
https://t.co/sNVhlYYOhw
32匹掲載は過去最高です…

先日の大雨による道路寸断でお見合いが中止になりました。今後も交通状況が心配です。被害に遭われた地域の方々に心よりお見舞い申し上げます。

#福井 https://t.co/47tTz8CkuM https://t.co/phsOTRf8qi",2022-08-06 20:19:23,2022-08-06T11:19:23Z,25
1555875998528221184,1,0,0,http://pbs.twimg.com/media/FZeU-aZVQAA7-4Z.jpg,"のぶくんから直々に頂きました、 #RIZIN36 沖縄大会🌺🌴🐠のポスター…大雨降ろうが濡らさず持ち帰る👍😆
ポスターも、アレもホントありがとうございます😊
めっちゃかっこいいし、優しいし、素敵なのぶくんでした😭😭😭
（直視出来ず、このポスターで目を隠してお話する変態おばさん…😅） https://t.co/icES5Pqs8R",2022-08-06 20:18:39,2022-08-06T11:18:39Z,25
1554809439043338249,1,0,15,http://pbs.twimg.com/media/FZPK8deakAAKUxh.jpg,"TVで長岡花火
フェニックス感動😭💕
こっちは雷⚡鳴ったり大雨だったり💦
麻ピーは美味しい辛さ😋 https://t.co/liTWihBdTK",2022-08-06 20:12:40,2022-08-03T12:40:31Z,25
1555874276464398338,1,1,0,http://pbs.twimg.com/media/FZeTZ_aVEAAMpNn.jpg,"連日遅くまで仕事をしていて、あまりにも忙しくて、各地で大雨の被害があったことを今朝知ったレベル…。新潟県の覚えのある地名とかがニュースに載っててビックリ…。被害が最小限でありますように…。(|||´Д｀)

とりあえず昼まで爆睡して、神座ラーメンをガッツリ食べてきた。(*^^*) https://t.co/tk3dT0E9Nu",2022-08-06 20:11:48,2022-08-06T11:11:48Z,25
1555874135456174080,3,30,2,http://pbs.twimg.com/media/FZeTRsBUEAE3TdD.jpg,"こんばんは😊

今日は朝から学校で、ようやく帰って来た〜😵

そして広島は蒸し暑く、
晴れたり曇ったり、急な大雨も…

#広島平和記念日
#平和公園

昨年から大切な1日！を身近に感じるようになりました🕊

皆さん、良い日曜日を〜🤗 https://t.co/AmanDyULHl",2022-08-06 20:11:15,2022-08-06T11:11:15Z,6
1555874135456174080,3,30,2,http://pbs.twimg.com/media/FZeTRsCUUAAHAzE.jpg,"こんばんは😊

今日は朝から学校で、ようやく帰って来た〜😵

そして広島は蒸し暑く、
晴れたり曇ったり、急な大雨も…

#広島平和記念日
#平和公園

昨年から大切な1日！を身近に感じるようになりました🕊

皆さん、良い日曜日を〜🤗 https://t.co/AmanDyULHl",2022-08-06 20:11:15,2022-08-06T11:11:15Z,6
1555874026605924353,2,7,1,http://pbs.twimg.com/media/FZeSMOIaAAIodLS.jpg,"本来なら青森に来ることは無いのですが
先日の大雨の影響で、秋田に帰ることが出来ない701系N36編成😅 https://t.co/STLd2u4cAE",2022-08-06 20:10:49,2022-08-06T11:10:49Z,12
1555874026605924353,2,7,1,http://pbs.twimg.com/media/FZeSMOSaAAA50Ox.jpg,"本来なら青森に来ることは無いのですが
先日の大雨の影響で、秋田に帰ることが出来ない701系N36編成😅 https://t.co/STLd2u4cAE",2022-08-06 20:10:49,2022-08-06T11:10:49Z,12
1555874026605924353,2,7,1,http://pbs.twimg.com/media/FZeSMOmaUAAIiSe.jpg,"本来なら青森に来ることは無いのですが
先日の大雨の影響で、秋田に帰ることが出来ない701系N36編成😅 https://t.co/STLd2u4cAE",2022-08-06 20:10:49,2022-08-06T11:10:49Z,12
1555874026605924353,2,7,1,http://pbs.twimg.com/media/FZeSMOhakAAwOSG.jpg,"本来なら青森に来ることは無いのですが
先日の大雨の影響で、秋田に帰ることが出来ない701系N36編成😅 https://t.co/STLd2u4cAE",2022-08-06 20:10:49,2022-08-06T11:10:49Z,12
1555869318134767616,1,0,2,http://pbs.twimg.com/ext_tw_video_thumb/1555869190766366722/pu/img/zUp50GnJwKPFcnZo.jpg,尾鷲の花火大会の会場なんやけど流石尾鷲やね。尾鷲入った瞬間大雨よ😳 https://t.co/LOLe8Z7pH0,2022-08-06 20:10:28,2022-08-06T10:52:06Z,25
1555873835714740224,3,16,2,http://pbs.twimg.com/media/FZeTAPHaUAA8F0R.jpg,"先日の大雨で磐越西線が運休でふさぎ込んでいましたが、午後から倉ケ崎SL花畑に行って来ました。
大樹は６号と8号のみの撮影となりましたが、バリ鉄にゆる鉄にと満喫しました。
工夫するといろいろ楽しめますね✨ https://t.co/qYwZQHV3xq",2022-08-06 20:10:03,2022-08-06T11:10:03Z,6
1555873835714740224,3,16,2,http://pbs.twimg.com/media/FZeTAXwakAA-O0X.jpg,"先日の大雨で磐越西線が運休でふさぎ込んでいましたが、午後から倉ケ崎SL花畑に行って来ました。
大樹は６号と8号のみの撮影となりましたが、バリ鉄にゆる鉄にと満喫しました。
工夫するといろいろ楽しめますね✨ https://t.co/qYwZQHV3xq",2022-08-06 20:10:03,2022-08-06T11:10:03Z,6
1555873835714740224,3,16,2,http://pbs.twimg.com/media/FZeTAh2aAAA53u-.jpg,"先日の大雨で磐越西線が運休でふさぎ込んでいましたが、午後から倉ケ崎SL花畑に行って来ました。
大樹は６号と8号のみの撮影となりましたが、バリ鉄にゆる鉄にと満喫しました。
工夫するといろいろ楽しめますね✨ https://t.co/qYwZQHV3xq",2022-08-06 20:10:03,2022-08-06T11:10:03Z,6
1555553039427436544,1,0,2,http://pbs.twimg.com/media/FZZvPVDagAASXPS.jpg,"川入集落から御沢野営場までの道路が8/3の大雨の影響で通行止めとなっているようです。福島側から飯豊山に登山される方は注意して下さい。

https://t.co/1VtfqiO2Nj https://t.co/x1rLCZ2zFX",2022-08-06 20:09:48,2022-08-05T13:55:20Z,25
1555798455280631808,1,0,5,http://pbs.twimg.com/ext_tw_video_thumb/1555798411177508865/pu/img/QBxGwlDuPeRe2g6s.jpg,"広島大雨、雷が😱

ほくちゃん撮影中光りました

ほくちゃんバイオリン🎻引いてるように見える https://t.co/Bv0drYupfK",2022-08-06 20:08:32,2022-08-06T06:10:31Z,25
1555670228880998400,1,0,25,http://pbs.twimg.com/media/FZbZ0wlakAA3vFO.jpg,"酒田の🎆花火中止😭
大雨の影響で、観覧席など
水没の為みたいです。😓 https://t.co/F4pjAbIi3b",2022-08-06 20:05:59,2022-08-05T21:41:00Z,25
1555872633748475904,2,4,1,http://pbs.twimg.com/media/FZeR6QxUUAAKPKl.jpg,国土地理院が公開した新潟県村上市、坂町周辺の浸水推定図を「スーパー地形」アプリで読めるようにしました。アプリ再起動で「その他」の「大雨」フォルダに追加されます。 https://t.co/uzQDGj1VRA,2022-08-06 20:05:17,2022-08-06T11:05:17Z,12
1555872633748475904,2,4,1,http://pbs.twimg.com/media/FZeR6RcUsAAHU5F.jpg,国土地理院が公開した新潟県村上市、坂町周辺の浸水推定図を「スーパー地形」アプリで読めるようにしました。アプリ再起動で「その他」の「大雨」フォルダに追加されます。 https://t.co/uzQDGj1VRA,2022-08-06 20:05:17,2022-08-06T11:05:17Z,12
1555872582145941509,1,8,0,http://pbs.twimg.com/media/FZeR2fDUcAEnUF6.jpg,先日の大雨で二戸の現場のﾌｨｰﾙﾄﾞｻｲﾝは一旦ﾘｾｯﾄされた。その翌日と今日の午前中、山に上がったがｶﾓｼｶの足跡しかなかった。そして薬莢が落ちていた。つまりﾊﾝﾀｰさんはｲﾉｼｼのやぎにぐか…と思っていた帰り道。ｲﾉｼｼは まだこの山にいるかも？熊さんの足跡はまだ見ていない。 https://t.co/2Ho1P60ZXb,2022-08-06 20:05:04,2022-08-06T11:05:04Z,25
1555872582145941509,1,8,0,http://pbs.twimg.com/media/FZeR3KVVsAAqcqT.jpg,先日の大雨で二戸の現場のﾌｨｰﾙﾄﾞｻｲﾝは一旦ﾘｾｯﾄされた。その翌日と今日の午前中、山に上がったがｶﾓｼｶの足跡しかなかった。そして薬莢が落ちていた。つまりﾊﾝﾀｰさんはｲﾉｼｼのやぎにぐか…と思っていた帰り道。ｲﾉｼｼは まだこの山にいるかも？熊さんの足跡はまだ見ていない。 https://t.co/2Ho1P60ZXb,2022-08-06 20:05:04,2022-08-06T11:05:04Z,25
1555872582292742144,1,0,0,http://pbs.twimg.com/media/FZeR3mbVUAAKl-p.jpg,東日本の記録的大雨でJAF宮城支部が注意喚起。豪雨時のアンダーパスなどは特に注意: ■宮城県内は7月の3日間だけで179件の救護要請… https://t.co/G9OAtSwNE5 #エンタメ #映像動画 #違反事故オービス https://t.co/WmC7SEjAAJ,2022-08-06 20:05:04,2022-08-06T11:05:04Z,25
1555365953424486401,16,0,1008,http://pbs.twimg.com/media/FZXEaPGaUAEKgnk.jpg,大雨の影響で、滋賀県長浜市の高時川が氾濫（はんらん）し、田んぼや河川敷が水没していました。午前９時４７分撮影。（矢） https://t.co/GM6F9Uo8yU,2022-08-06 20:03:10,2022-08-05T01:31:55Z,1
