RID,n,nf,nr,Purl,text,JTime,RTime,Rank
1556780993771872257,1,0,0,http://pbs.twimg.com/media/FZrMDtTaUAAmBkl.jpg,"今日の公明新聞からのピックアップです！

公明、早期復旧へ総力／大雨・浸水の被害を調査／青森、福井県 #公明新聞電子版 2022年08月09日付 https://t.co/K6oZqmyZlh",2022-08-09 08:14:47,2022-08-08T23:14:47Z,58
1556780983659024384,1,0,0,http://pbs.twimg.com/media/FZrMDUMUUAEFk9i.jpg,大雨 青森県 洪水・土砂災害に厳重警戒 https://t.co/VM1mD7Gbq9,2022-08-09 08:14:44,2022-08-08T23:14:44Z,58
1556780983659024384,1,0,0,http://pbs.twimg.com/media/FZrMDULUUAAO7vZ.jpg,大雨 青森県 洪水・土砂災害に厳重警戒 https://t.co/VM1mD7Gbq9,2022-08-09 08:14:44,2022-08-08T23:14:44Z,58
1556780927191109633,1,0,0,http://pbs.twimg.com/media/FZrL6TPVUAAPBrp.jpg,"週間天気　東北北部で警報級の大雨　関東以西はお盆休みも猛暑とゲリラ雷雨に注意
(;´･ω･)気象情報 https://t.co/FEsws0jQ2m",2022-08-09 08:14:31,2022-08-08T23:14:31Z,58
1556780856852680704,2,1,1,http://pbs.twimg.com/media/FZrLRM0UIAIzg6m.jpg,"～直ちに安全確保を！　” #正常性バイアス”は捨てて!～
お願いです、＃特別警報を待つことなく、身の安全を確保してください。

東北では、大雨はこれからですが、既に災害の危険度が極めて高くなっている所があります。人間には、危険なのに『自分だけは大丈夫』と思いこむ正常性バイアスがあります。 https://t.co/XwLvCRMje2",2022-08-09 08:14:14,2022-08-08T23:14:14Z,15
1556780695833288706,1,0,0,http://pbs.twimg.com/media/FZrLyvQUUAELnQW.jpg,"おほのち💕
8/9(火)
秋田は☔(大雨)30℃
🟥大雨警報あり
🟥熱中症に警戒
１時間に50ミリ以上の非常に激しい雨が降る恐れ！しかも所によっては１時間に80ミリにもなる猛烈な雨の可能性も。

気象情報、自治体の情報に注意して安全に行動をしてね！
避難はなるべく早めのタイミングで！ https://t.co/gHUr1xW3k0",2022-08-09 08:13:36,2022-08-08T23:13:36Z,58
1556780591437058048,1,0,0,http://pbs.twimg.com/media/FZrLsfvUsAA6rPe.jpg,"おはよーございます💙

今日も朝から暑い💦
ソウルは大丈夫でしょうか？
東北も今日は大雨予報が出てるみたいなので外出される方は気をつけてください🥺

息子の気が向いたら、ブルーベリー狩りにでも行こうかな🫐

投票がんばりつつ、今日しかない今日を丁寧に楽しく過ごします😊
みんなに届けー💙 https://t.co/iytyzL9ENS",2022-08-09 08:13:11,2022-08-08T23:13:11Z,58
1556780360960454656,1,0,0,http://pbs.twimg.com/media/FZrLZs8agAAYsAV.jpg,"■大雨と雷及び突風に関する全般気象情報 第5号

北日本や北陸地方では11日にかけ雷を伴った非常に激しい雨や激しい雨が降り大雨となる所がある見込み
土砂災害や低い土地の浸水/河川の増水や氾濫に警戒・注意を
また落雷や竜巻などの激しい突風にご注意下さい

青森に強い降雨域⚡️☔️
ご留意下さい⚠️ https://t.co/4AYDU3yqO5",2022-08-09 08:12:16,2022-08-08T23:12:16Z,58
1556780360960454656,1,0,0,http://pbs.twimg.com/media/FZrLbB4aIAAZjN1.jpg,"■大雨と雷及び突風に関する全般気象情報 第5号

北日本や北陸地方では11日にかけ雷を伴った非常に激しい雨や激しい雨が降り大雨となる所がある見込み
土砂災害や低い土地の浸水/河川の増水や氾濫に警戒・注意を
また落雷や竜巻などの激しい突風にご注意下さい

青森に強い降雨域⚡️☔️
ご留意下さい⚠️ https://t.co/4AYDU3yqO5",2022-08-09 08:12:16,2022-08-08T23:12:16Z,58
1556780360960454656,1,0,0,http://pbs.twimg.com/media/FZrLddkaAAAOD8v.jpg,"■大雨と雷及び突風に関する全般気象情報 第5号

北日本や北陸地方では11日にかけ雷を伴った非常に激しい雨や激しい雨が降り大雨となる所がある見込み
土砂災害や低い土地の浸水/河川の増水や氾濫に警戒・注意を
また落雷や竜巻などの激しい突風にご注意下さい

青森に強い降雨域⚡️☔️
ご留意下さい⚠️ https://t.co/4AYDU3yqO5",2022-08-09 08:12:16,2022-08-08T23:12:16Z,58
1554878369673555970,1,0,515,http://pbs.twimg.com/ext_tw_video_thumb/1554877409538686978/pu/img/X3yQlFifzljSg1Dw.jpg,"【大雨特別警報 新潟 山形】
計算上では20万年に1度という、要するに経験したことのないような雨となっています。 https://t.co/JZdMQYwd9O",2022-08-09 08:12:15,2022-08-03T17:14:26Z,58
1556780227321180161,1,4,0,http://pbs.twimg.com/media/FZrLXSkVEAAw_wa.jpg,"おはようございます😃
現在の南区簾舞…曇り/23℃

もこもこした厚い雲に覆われた #イマソラ
👩‍🦰の地元(函館)方面は大雨で避難指示が出た地域もあったようです。
もうすぐ終わってしまう北海道の夏、青空を満喫したい！

本日もよろしくお願いいたします🙇🏻🙏🏻

#企業公式が毎朝地元の天気を言い合う https://t.co/2zEOL9ObzS",2022-08-09 08:11:44,2022-08-08T23:11:44Z,58
1556779947397906433,1,2,0,http://pbs.twimg.com/media/FZrLGupagAAtlk-.jpg,"めざまし8、函館の雨ニュースやってないかなぁと付けたらメインは韓国で大雨って紹介してるの凄えやだ
東北北海道をついでにやるの違うだろ https://t.co/ViASUH1qy3",2022-08-09 08:10:37,2022-08-08T23:10:37Z,58
1556779800404332545,1,0,0,http://pbs.twimg.com/media/FZrK-nRUcAAp1gl.png,【青森県土砂災害警戒情報】降り続く大雨のため、警戒対象地域では土砂災害の危険度が高まっています。避難が必要となる危険な状況となっています【警戒レベル４相当】。つがる市 https://t.co/TMRdJ1vj0O #青森県 #土砂災害 #Hayabusa https://t.co/720u8aS8kA,2022-08-09 08:10:02,2022-08-08T23:10:02Z,58
1556757490968436736,1,0,10,http://pbs.twimg.com/media/FZq2r_ZaQAEc09M.jpg,"おはようございます。
現在津軽地方に、大雨警報、洪水警報が出されています。深浦町はかなり強い雨が降っているようです。
今後の気象情報に十分注意してください。 https://t.co/Wyxol4uGfn",2022-08-09 08:09:37,2022-08-08T21:41:23Z,58
1556779605326827520,1,4,0,http://pbs.twimg.com/media/FZrKzJ4UEAIQx5h.jpg,"おはようございます┏●
今朝は久しぶりに暑くて
目覚まし⏰鳴る前に起きました
(；´д｀)ゞ ｱﾁｰ!!
今日は猛暑日💦
東京は晴れてますが 北日本は大雨、
川の氾濫には注意ですね

今日も事故、怪我ないように1日頑張れに
( ᐛ  )و https://t.co/nxwEVbxVhZ",2022-08-09 08:09:16,2022-08-08T23:09:16Z,58
1556779483289784320,3,6,2,http://pbs.twimg.com/media/FZrKryCaUAIaceV.jpg,"おはようございます。8月9日(火)となりました。
東北地方では本日大雨予報だそうです。お気をつけください。豊橋も雷注意報が出ていますので、突然の雨には気をつけたいと思っています。
今日も良い日になりますように。
#TLを花でいっぱいにしよう https://t.co/8IJAprLEjt",2022-08-09 08:08:47,2022-08-08T23:08:47Z,8
1556779411885633537,8,104,10,http://pbs.twimg.com/media/FZrKnphVQAAWNmr.jpg,"青森市は今日も大雨☔️
6時台の雨間に散歩行ったので濡れなかったよ😊 https://t.co/K4vyALC08X",2022-08-09 08:08:30,2022-08-08T23:08:30Z,5
1556779396249161728,1,0,0,http://pbs.twimg.com/media/FZrKm9pUcAAJg0z.jpg,"【今日（8月9日）の天気】
・北日本は断続的に雨で、東北北部を中心に大雨☔️
・すでに地盤の緩んでいる所は少しの雨でも災害に警戒続けて⚠️
・東北南部から沖縄は日差しが照り付けるが、午後は激しい雨や雷雨の所も⚡️
・最高気温は東北南部から南で35度前後と猛烈な暑さ😵‍💫
・暑い時間の外出は控えて‼️ https://t.co/ZX6YMgT0XF",2022-08-09 08:08:26,2022-08-08T23:08:26Z,58
1556779396249161728,1,0,0,http://pbs.twimg.com/media/FZrKm8oUcAEpMts.jpg,"【今日（8月9日）の天気】
・北日本は断続的に雨で、東北北部を中心に大雨☔️
・すでに地盤の緩んでいる所は少しの雨でも災害に警戒続けて⚠️
・東北南部から沖縄は日差しが照り付けるが、午後は激しい雨や雷雨の所も⚡️
・最高気温は東北南部から南で35度前後と猛烈な暑さ😵‍💫
・暑い時間の外出は控えて‼️ https://t.co/ZX6YMgT0XF",2022-08-09 08:08:26,2022-08-08T23:08:26Z,58
1556779396249161728,1,0,0,http://pbs.twimg.com/media/FZrKm8UVQAA18aK.jpg,"【今日（8月9日）の天気】
・北日本は断続的に雨で、東北北部を中心に大雨☔️
・すでに地盤の緩んでいる所は少しの雨でも災害に警戒続けて⚠️
・東北南部から沖縄は日差しが照り付けるが、午後は激しい雨や雷雨の所も⚡️
・最高気温は東北南部から南で35度前後と猛烈な暑さ😵‍💫
・暑い時間の外出は控えて‼️ https://t.co/ZX6YMgT0XF",2022-08-09 08:08:26,2022-08-08T23:08:26Z,58
1556779340171706369,9,19,8,http://pbs.twimg.com/media/FZrKipZaUAEb-1f.jpg,"東北北部
大雨に最大限の警戒
再び、災害発生のおそれ

#おはよう #天気予報 
#集中豪雨 #大雨 #線状降水帯 
#猛暑日 #熱中症 https://t.co/mZdRMdRrr3",2022-08-09 08:08:12,2022-08-08T23:08:12Z,4
1556779328897044480,2,2,1,http://pbs.twimg.com/media/FZrKiyPUcAAKyCs.png,"【大雨に関する情報】
［避難所開設］
西目屋村
村市いこいの館、大白公民館、中央公民館(9日7:50)
https://t.co/lWf6BFMfo8 https://t.co/XUS53efshc",2022-08-09 08:08:10,2022-08-08T23:08:10Z,15
1556751876112035841,1,0,9,http://pbs.twimg.com/media/FZqxkfPaAAAOsNv.jpg,公明、早期復旧へ総力／大雨・浸水の被害を調査／青森、福井県 #公明新聞電子版 2022年08月09日付 https://t.co/qXfoos78xO,2022-08-09 08:07:34,2022-08-08T21:19:04Z,58
1556779123124555776,1,6,0,http://pbs.twimg.com/media/FZrJUBVUsAAf4dm.jpg,"おはようございます😆埼玉は今日も良い天気☀️
家内の実家函館は、大雨で大変な事になってますが😟

狭いようで広い日本、こんなに天候が違う物なんですね‼️

各地、各エリアで注意することが違いますが、先ずは身の安全を優先にお願いします。🙏

それでは皆様、本日も良き一日を🤲

＃火曜日　＃快晴 https://t.co/MLAERVPZRz",2022-08-09 08:07:21,2022-08-08T23:07:21Z,58
1556756791425630208,1,0,3,http://pbs.twimg.com/media/FZq2DPcaUAACyiE.jpg,"大雨警報再度発令されました
#函館災害情報 #函館 #今日も１日雨予報です https://t.co/7iSVaka6DW",2022-08-09 08:07:18,2022-08-08T21:38:36Z,58
1556695715887296512,1,0,10,http://pbs.twimg.com/media/FZp-gK1VsAABNHD.jpg,"前線停滞 東北大雨警戒続く
■北海道南部と東北北部は大雨に
■土砂災害や河川の増水など警戒
■関東から西は猛烈な暑さに
■局地的な雷雨に気をつけて https://t.co/xmrDcnaDcm",2022-08-09 08:06:54,2022-08-08T17:35:55Z,58
1556778934103990272,1,1,0,http://pbs.twimg.com/media/FZrKMCjaIAAxFpc.jpg,"おはようございます。
東北北部は大雨警戒☔️関東以西は猛暑

本日🐽21時~｢定時配信 噂の○○料理レビュー｣ツイキャスで配信予定🎙
Twitter要チェック👍

8/9(火)お出かけの皆さん行ってらっしゃい!!仕事終わりの皆さんお疲れさまでした!!

＊ヒメヒマワリ https://t.co/MvKOLG90ev",2022-08-09 08:06:36,2022-08-08T23:06:36Z,58
1556719088533409792,1,0,4,http://pbs.twimg.com/media/FZqTwTOaMAAtHFY.jpg,"【大雨情報】
現在の西部地区は雨雲の通過時に10〜15分くらいの強い雨が降る状況です。降ったり止んだりの小康状態です。河川の増水は引き続きですのでご安全に。
#函館 https://t.co/EtbRXkXbaR",2022-08-09 08:05:33,2022-08-08T19:08:47Z,58
1556778458361245697,1,11,0,http://pbs.twimg.com/media/FZrJwdWaIAA6h19.jpg,"おはヨコちゃん🍎🍏😊
青森に記録的短時間大雨情報が出されていて、心配です😱
関東は今日も厳しい暑さになりそうで、熱中症にも気をつけて、過ごしていきたいですね✋
本日もよろしくお願いします🙏
#横山結衣 https://t.co/maDQcUTEqp",2022-08-09 08:04:42,2022-08-08T23:04:42Z,58
1556778352199241728,1,1,0,http://pbs.twimg.com/media/FZrJqCZagAEguSK.jpg,公明、早期復旧へ総力／大雨・浸水の被害を調査／青森、福井県 #公明新聞電子版 2022年08月09日付  https://t.co/3dgj0btNnO https://t.co/3TBO5zrTyp,2022-08-09 08:04:17,2022-08-08T23:04:17Z,58
1556778294409695232,3,12,2,http://pbs.twimg.com/media/FZrJmrEUcAI2QFu.jpg,"おはちぇっちぇ〜(∩˃o˂∩)♡
今日はとっても暑くなるみたいだし、東北の方は大雨がふるみたいだから、みんないろいろと気をつけてすごしてね🥺💕💕
今日も1日元気でがんばろう❣
ちぇっちぇも宿題と課題、今週中に全部終わらせる予定〜😆
いっしょにがんばろうね💖おー٩(˃̶͈̀ᗜ˂̶͈́ )و‼︎ https://t.co/pvTUcG2u4N",2022-08-09 08:04:03,2022-08-08T23:04:03Z,8
1556778189955149824,1,2,0,http://pbs.twimg.com/media/FZrJgvDaQAANHWH.jpg,"おはようございます☀︎
今日も雲一つない晴天で朝から溶けるような暑さ🫠
打って変わって北海道とソウルの方では大雨のようで被害が心配です。

昨日はちょっとやるせなくなる話題のツイート見ちゃって、夜間のTwitterお休みしてました。
お返事後ほどお返ししますね💦

火曜日。今日も頑張りましょ❣️ https://t.co/METosgzblM",2022-08-09 08:03:38,2022-08-08T23:03:38Z,58
1556775098270760961,2,0,8,http://pbs.twimg.com/media/FZrGqyCaIAAhkVP.jpg,"＃函館運輸所 #転車台 #大雨 #冠水
函館運輸所の転車台が昨夜の大雨で冠水してた。 https://t.co/fCWeg5OSrW",2022-08-09 08:03:06,2022-08-08T22:51:21Z,15
1556775098270760961,2,0,8,http://pbs.twimg.com/media/FZrGrazakAARDZE.jpg,"＃函館運輸所 #転車台 #大雨 #冠水
函館運輸所の転車台が昨夜の大雨で冠水してた。 https://t.co/fCWeg5OSrW",2022-08-09 08:03:06,2022-08-08T22:51:21Z,15
1556775098270760961,2,0,8,http://pbs.twimg.com/media/FZrGr9KagAA1jkP.jpg,"＃函館運輸所 #転車台 #大雨 #冠水
函館運輸所の転車台が昨夜の大雨で冠水してた。 https://t.co/fCWeg5OSrW",2022-08-09 08:03:06,2022-08-08T22:51:21Z,15
1556775098270760961,2,0,8,http://pbs.twimg.com/media/FZrGsiUacAAlnaE.jpg,"＃函館運輸所 #転車台 #大雨 #冠水
函館運輸所の転車台が昨夜の大雨で冠水してた。 https://t.co/fCWeg5OSrW",2022-08-09 08:03:06,2022-08-08T22:51:21Z,15
1556639872185942016,3,0,107,http://pbs.twimg.com/ext_tw_video_thumb/1556638407547564032/pu/img/9kol46G_DdtK_lip.jpg,"🚨大雨警戒🚨
今週、訪韓する方はご注意ください。
いま、江南駅周辺です😨
ほとんど動けない状況です。

今週、ずっと雨だそうです🌧☂

#韓国　#ソウル https://t.co/EERcXHZPyI",2022-08-09 08:02:45,2022-08-08T13:54:01Z,8
1556777919153786885,1,1,0,http://pbs.twimg.com/media/FZrJQy9UcAAtqA2.jpg,おはようございます火曜日☁️昨日からの大雨で函館心配してたけど実家のあたりはとりあえず大丈夫そう。早く雨雲通り過ぎておくれ。 https://t.co/naYN0EWgIk,2022-08-09 08:02:34,2022-08-08T23:02:34Z,58
1556777905446785025,1,5,0,http://pbs.twimg.com/media/FZrJPlFUcAAJVQ8.jpg,"おはようございます😊
今朝はピーカンの夏空☀
東北北部や道南で、非常に激しい雨が降るおそれがあり、特に東北は10日以降も雨が続き経験のない大雨となる恐れがあります。関東以西は夏空が続き35℃前後の厳しい残暑とな予報です😅
今日も水分補給しっかり熱中症対策して笑顔でお過ごしください😁👍 https://t.co/27SQcpkGHX",2022-08-09 08:02:30,2022-08-08T23:02:30Z,58
1556777905446785025,1,5,0,http://pbs.twimg.com/media/FZrJPy1UYAAFyQN.jpg,"おはようございます😊
今朝はピーカンの夏空☀
東北北部や道南で、非常に激しい雨が降るおそれがあり、特に東北は10日以降も雨が続き経験のない大雨となる恐れがあります。関東以西は夏空が続き35℃前後の厳しい残暑とな予報です😅
今日も水分補給しっかり熱中症対策して笑顔でお過ごしください😁👍 https://t.co/27SQcpkGHX",2022-08-09 08:02:30,2022-08-08T23:02:30Z,58
1556777905446785025,1,5,0,http://pbs.twimg.com/media/FZrJQETVEAAoCzB.jpg,"おはようございます😊
今朝はピーカンの夏空☀
東北北部や道南で、非常に激しい雨が降るおそれがあり、特に東北は10日以降も雨が続き経験のない大雨となる恐れがあります。関東以西は夏空が続き35℃前後の厳しい残暑とな予報です😅
今日も水分補給しっかり熱中症対策して笑顔でお過ごしください😁👍 https://t.co/27SQcpkGHX",2022-08-09 08:02:30,2022-08-08T23:02:30Z,58
1556777905446785025,1,5,0,http://pbs.twimg.com/media/FZrJQT9UUAAXKO8.jpg,"おはようございます😊
今朝はピーカンの夏空☀
東北北部や道南で、非常に激しい雨が降るおそれがあり、特に東北は10日以降も雨が続き経験のない大雨となる恐れがあります。関東以西は夏空が続き35℃前後の厳しい残暑とな予報です😅
今日も水分補給しっかり熱中症対策して笑顔でお過ごしください😁👍 https://t.co/27SQcpkGHX",2022-08-09 08:02:30,2022-08-08T23:02:30Z,58
1556777770239557632,1,7,0,http://pbs.twimg.com/media/FZrJEDWaAAALjNJ.jpg,"おはようございます٩(๑❛ᴗ❛๑)۶

8月9日火曜日です

今日は長崎原爆の日
日本は2度も原爆を落とされた
歴史を忘れてはならないです🙏

東北北部に前線停滞で大雨☔️
自然には敵わないけれど
どうにかならないのかな💧
災害おきないよう願うばかりです

暑さや色々…十分気をつけて
お過ごしください🌿 https://t.co/uwDSOvlcjz",2022-08-09 08:01:58,2022-08-08T23:01:58Z,58
1556777700471472130,1,2,0,http://pbs.twimg.com/media/FZrJEQ3agAA17V8.jpg,公明、早期復旧へ総力／大雨・浸水の被害を調査／青森、福井県 #公明新聞電子版 2022年08月09日付 https://t.co/kbb67gz6NH https://t.co/iTZmBNR5Qo,2022-08-09 08:01:41,2022-08-08T23:01:41Z,58
1556777623380164608,1,1,0,http://pbs.twimg.com/media/FZrI_iAaUAEQRZ9.jpg,"グッモきょんこいず〜🍜
今日も朝から暑い🥵
今度は北海道、青森付近で大雨☔️みたいですね各地方の方はお気を付けてお過ごしください🤚
それでは皆さん行ってらー👋
#グッモきょんこいず
#きょんこいず共和国 https://t.co/06QoLtvzjI",2022-08-09 08:01:23,2022-08-08T23:01:23Z,58
1556777540781363201,20,42,21,http://pbs.twimg.com/media/FZrIpZdUUAEXd5E.jpg,"青森県　記録的短時間大雨情報

青森県付近で局地的に雨が強まっています。

青森県深浦町付近では7時00分までの1時間に約100mmの猛烈な雨が降ったとみられ、気象庁は記録的短時間大雨情報を発表しました。

▼No.1お天気アプリ「ウェザーニュース」
https://t.co/LTBjO98wH2

#大雨 https://t.co/B4TKn5Nwmh",2022-08-09 08:01:03,2022-08-08T23:01:03Z,1
1556777364088029184,1,7,0,http://pbs.twimg.com/media/FZrIwOSagAAukS2.png,"おはようございます。
今日も各地で厳しい残暑☀️
東北、北海道の太平洋側では大雨のおそれとのことです☔大雨の地域のみなさまは十分にお気をつけください。

みなさま、ご無理のありませんように…
穏やかな1日でありますように🍀

#小澤真利奈 #FF12 #DFF_OO #パンネロ https://t.co/6eU86knAm3",2022-08-09 08:00:21,2022-08-08T23:00:21Z,58
1556777170231775232,1,10,0,http://pbs.twimg.com/media/FZrIlegaQAAFKTS.jpg,"青森で前泊でした。
昨夜は、
近くの健康ランドで身体を回復（笑）😁
家のAlexaへアクセスして、家族とテレビ電話で心の回復（笑）😁

そして、朝から土砂降りです😅💦

青森は大雨警戒なので、今回は雨の開催かな?😅💦

頑張ってきます✨

#ガールズケイリン
#Alexa https://t.co/ixU1sXtxGH",2022-08-09 07:59:35,2022-08-08T22:59:35Z,58
1556762959623626752,2,0,19,http://pbs.twimg.com/media/FZq7p08aMAApE7z.jpg,"おはようございます😊
今週は熱中症対策大事ですね！
北海道、東北の方、大雨が心配です。
今日もよろしくお願いします😊
#おはようございます
#鬼滅の刃 https://t.co/tgJFmTPAGG",2022-08-09 07:59:26,2022-08-08T22:03:07Z,15
1556771061273747457,10,0,16,http://pbs.twimg.com/media/FZrC2CYUYAAGBKn.jpg,"松倉川はだいぶ水位下がってますね
でも普段草生えてるところ全部流れてたみたいです
#大雨 #函館 #函館災害情報 https://t.co/Hku5Sghk77",2022-08-09 07:59:21,2022-08-08T22:35:19Z,3
1556771061273747457,10,0,16,http://pbs.twimg.com/media/FZrC2CfUcAIYmHg.jpg,"松倉川はだいぶ水位下がってますね
でも普段草生えてるところ全部流れてたみたいです
#大雨 #函館 #函館災害情報 https://t.co/Hku5Sghk77",2022-08-09 07:59:21,2022-08-08T22:35:19Z,3
1556777087691735040,1,0,0,http://pbs.twimg.com/media/FZrIcgqUcAAMQqu.jpg,先程テレビでも、伝えていましたが。青森県に、大雨の情報が出ましたね。雨雲からも、これから更に強まりそうです。 https://t.co/bDjYLixf6p,2022-08-09 07:59:15,2022-08-08T22:59:15Z,58
1556772941638995969,1,0,2,http://pbs.twimg.com/media/FZrEvOvUsAAi9uN.jpg,"おはようございます♪

道南、青森など東北北部は大雨に注意！道路冠水や河川増水、土砂災害に警戒してください💦
関東より西は、35度超の猛暑に注意！ https://t.co/BApeocbzMk",2022-08-09 07:59:12,2022-08-08T22:42:47Z,58
1556772941638995969,1,0,2,http://pbs.twimg.com/media/FZrEvOvUUAEusvk.jpg,"おはようございます♪

道南、青森など東北北部は大雨に注意！道路冠水や河川増水、土砂災害に警戒してください💦
関東より西は、35度超の猛暑に注意！ https://t.co/BApeocbzMk",2022-08-09 07:59:12,2022-08-08T22:42:47Z,58
1556772941638995969,1,0,2,http://pbs.twimg.com/media/FZrEvOuUsAApmna.jpg,"おはようございます♪

道南、青森など東北北部は大雨に注意！道路冠水や河川増水、土砂災害に警戒してください💦
関東より西は、35度超の猛暑に注意！ https://t.co/BApeocbzMk",2022-08-09 07:59:12,2022-08-08T22:42:47Z,58
1556777062060290049,1,7,0,http://pbs.twimg.com/media/FZrIeinUIAAN-ZK.jpg,"押忍！もはようさん･ω･*)ﾉ

北東北ゎ大雨、南東北ゎ猛暑
どっちもしんどいわね( ꒪⌓꒪)

さてさて
今日も1日楽しく穏やかに
☀️😫☀️ https://t.co/5voOPZTMxw",2022-08-09 07:59:09,2022-08-08T22:59:09Z,58
1556777021983756290,1,7,0,http://pbs.twimg.com/media/FZrFpaxakAAkXq_.jpg,"おはようございます。
東北は大雨に厳重警戒、関東より西は夏空が続き猛暑となる予報。今日も熱中症対策は万全に、コロナ感染症予防も怠りなく!!

【リマインド今月の9日目】 
社会正義に反しない道の第一人者になる
#リマインド
#先人の知恵 #リスクマネジメント 
#OKHTH #OKBRW #ROOTS #WORTH https://t.co/sOIVaRroWs",2022-08-09 07:59:00,2022-08-08T22:59:00Z,58
