RID,n,nf,nr,Purl,text,JTime,RTime,Rank
1548074164623671296,1,0,1,http://pbs.twimg.com/media/FXvdPpaaIAA4xpX.jpg,"おはようございます🙋
今朝は小雨🌂
大雨警報出てます😞
今日は休日出勤😢

今朝の家の紫陽花😊

良い週末を🍀 https://t.co/uGu4BglHNj",2022-07-16 19:49:20,2022-07-15T22:36:57Z,119
1548074164623671296,1,0,1,http://pbs.twimg.com/media/FXvdP46aMAIEZj1.jpg,"おはようございます🙋
今朝は小雨🌂
大雨警報出てます😞
今日は休日出勤😢

今朝の家の紫陽花😊

良い週末を🍀 https://t.co/uGu4BglHNj",2022-07-16 19:49:20,2022-07-15T22:36:57Z,119
1548258008815177728,1,0,0,http://pbs.twimg.com/media/FXyEc7KUUAIA1Zs.jpg,"静岡県の皆さん大雨に警戒してください
命を守る行動をしてください
レベル4
#静岡県
#大雨 https://t.co/DSpfH9g1q0",2022-07-16 19:47:29,2022-07-16T10:47:29Z,119
1548257632326037504,1,3,0,http://pbs.twimg.com/media/FXyC0VcUsAA-9C9.jpg,大雨による影響で、陸前山王駅折り返しとなっている東北本線。陸前山王駅では半自動扱いとなっていて、自動扱いに慣れた乗客はちょっと困惑していました。 https://t.co/xo1EvTIXRD,2022-07-16 19:45:59,2022-07-16T10:45:59Z,119
1548257632326037504,1,3,0,http://pbs.twimg.com/media/FXyC1m9UcAAYanu.jpg,大雨による影響で、陸前山王駅折り返しとなっている東北本線。陸前山王駅では半自動扱いとなっていて、自動扱いに慣れた乗客はちょっと困惑していました。 https://t.co/xo1EvTIXRD,2022-07-16 19:45:59,2022-07-16T10:45:59Z,119
1548257632326037504,1,3,0,http://pbs.twimg.com/media/FXyC2qKUIAEHx-g.jpg,大雨による影響で、陸前山王駅折り返しとなっている東北本線。陸前山王駅では半自動扱いとなっていて、自動扱いに慣れた乗客はちょっと困惑していました。 https://t.co/xo1EvTIXRD,2022-07-16 19:45:59,2022-07-16T10:45:59Z,119
1548257632326037504,1,3,0,http://pbs.twimg.com/media/FXyC4cuVEAAnVNc.jpg,大雨による影響で、陸前山王駅折り返しとなっている東北本線。陸前山王駅では半自動扱いとなっていて、自動扱いに慣れた乗客はちょっと困惑していました。 https://t.co/xo1EvTIXRD,2022-07-16 19:45:59,2022-07-16T10:45:59Z,119
1547717340238065664,1,0,10,http://pbs.twimg.com/media/FXqYRcdaQAAyDpu.jpg,"大雨。警報出ているので最新の気象情報に留意し、最大限注意を。
災害が起きないことを願うらしい。
#小林市 #警報 https://t.co/qIonCCYDWg",2022-07-16 19:45:07,2022-07-14T22:59:03Z,119
1548105213126803456,1,0,4,http://pbs.twimg.com/media/FXv5e87aMAAO_T1.jpg,"大雨の影響が心配されます

いさみやは通常営業しております

今日は皮が少し破れたり、サービス価格の大島まんぢゅうがあります
味はいつもと同じです✨
ご自宅のオヤツにオススメです😊 https://t.co/BDmwTIDHqO",2022-07-16 19:43:40,2022-07-16T00:40:19Z,119
1548256840118517760,1,1,0,http://pbs.twimg.com/media/FXyDWphUsAIdwLD.jpg,まるふくさんが大雨災害で被災されてしまったようですね…😭今私はまるふくさんの近くの遠刈田温泉にて宿泊してます。でも、石巻市からここまで来るのに想像を超えた試練の連続でした…😇冠水地獄に引っ掛かりフィットのアンダーカバーがほとんど外れて、道路にガリガリでした🥺何とか直してやっと…着 https://t.co/B0KdWnJhxh https://t.co/Ci708enNbM,2022-07-16 19:42:50,2022-07-16T10:42:50Z,119
1548256840118517760,1,1,0,http://pbs.twimg.com/media/FXyDXz4VUAEcILX.jpg,まるふくさんが大雨災害で被災されてしまったようですね…😭今私はまるふくさんの近くの遠刈田温泉にて宿泊してます。でも、石巻市からここまで来るのに想像を超えた試練の連続でした…😇冠水地獄に引っ掛かりフィットのアンダーカバーがほとんど外れて、道路にガリガリでした🥺何とか直してやっと…着 https://t.co/B0KdWnJhxh https://t.co/Ci708enNbM,2022-07-16 19:42:50,2022-07-16T10:42:50Z,119
1548256381312319488,2,5,1,http://pbs.twimg.com/ext_tw_video_thumb/1548256012532346880/pu/img/Bw9h1gY0Py5O6os1.jpg,"あすは楽天戦実況生中継！
連勝して欲しい！
ミヤテレスタジアムも球場から生放送！

県内では大雨の被害が出ています。
引き続き土砂災害など
注意してお過ごしください。

#ミヤテレスタジアム
#楽天
#楽天イーグルス
#ベガルタ仙台
#阿波野秀幸
#髙橋礼華
#ミヤギテレビ
#松原稜典
#福盛田悠 https://t.co/2Sec5KLupr",2022-07-16 19:41:01,2022-07-16T10:41:01Z,31
1548256354338750464,1,0,0,http://pbs.twimg.com/media/FXyB7kLakAEmMwo.jpg,"宮城は大雨でだいぶ凄い事になってるみたいだなー
普段大したことなく見える川も増水するととんでもないことになるので無理して外出したり田んぼとかの様子を見に行かない事
←普段の志津川のコメリ近く　→本日新聞にでてたコメリ近く

実家近くの川もだいぶ水位あがってきてるから大丈夫だといいけど https://t.co/w0mp1LY54r",2022-07-16 19:40:54,2022-07-16T10:40:54Z,119
1548256354338750464,1,0,0,http://pbs.twimg.com/media/FXyCHluagAAd7JC.png,"宮城は大雨でだいぶ凄い事になってるみたいだなー
普段大したことなく見える川も増水するととんでもないことになるので無理して外出したり田んぼとかの様子を見に行かない事
←普段の志津川のコメリ近く　→本日新聞にでてたコメリ近く

実家近くの川もだいぶ水位あがってきてるから大丈夫だといいけど https://t.co/w0mp1LY54r",2022-07-16 19:40:54,2022-07-16T10:40:54Z,119
1548256092685475840,1,0,0,http://pbs.twimg.com/media/FXyCtioaQAAsvbS.jpg,関東から東北北海道の太平洋側は大雨被害に注意すること。 https://t.co/v51M9Tz8Aa,2022-07-16 19:39:52,2022-07-16T10:39:52Z,119
1548255864943161344,2,19,2,http://pbs.twimg.com/media/FXyCgRvagAE2_6k.jpg,"３連敗中のヤクルト　４番・村上が３１号同点２ラン　チームは２９人がコロナ陽性で離脱
https://t.co/mZ9ePWh9lu

　「ＤｅＮＡ－ヤクルト」（１６日、横浜スタジアム）

　コロナ禍のヤクルトが２点を追う四回、４番・村上の３１号２ランで同点に追いついた。

　大雨の影響から中断を挟んだこの... https://t.co/iNHXdAtyGv",2022-07-16 19:38:58,2022-07-16T10:38:58Z,31
1548255629361709056,3,4,2,http://pbs.twimg.com/media/FXyCSTeakAAxp6u.jpg,"大雨警報が発令されてる静岡市清水、てっきり中止されたと想ってた今日の灯籠まつりの花火。
大雨の中打ち上げてます！ https://t.co/TSdWRjB1qy",2022-07-16 19:38:01,2022-07-16T10:38:01Z,20
1548255508691238914,1,10,0,http://pbs.twimg.com/media/FXyCLQUVsAMMGkf.jpg,"お疲れ様です
夜仕事の方は顔笑ってください

明日お通夜ができたので諸々確認
靴がへたってたので新調しました🎵

静岡至る所で大雨警報出てたんですね
その他大雨の地域の方も気をつけください⚠️

皆さん素敵な夜を✨😊🤘 https://t.co/dCmlIh295P",2022-07-16 19:37:33,2022-07-16T10:37:33Z,119
1548255168717660162,1,2,0,http://pbs.twimg.com/media/FXyB3u0UcAIbXFp.jpg,"We♥️HAPPYswing vol.3

開催が決まってから この日に夏休みをとる❗️と目標を掲げて働きました💪
今回はTERUちゃんのアクティブ魂に影響されて一人旅も兼ねて色々プランを練りましたが…まさかの大雨☔️💦💦旅のプランは完全リセット状態ですがww
仙台2DAYSが無事に開催されますように🍀
#GLAY https://t.co/zFzf6P9i6j",2022-07-16 19:36:12,2022-07-16T10:36:12Z,119
1548119179433512960,1,0,31,http://pbs.twimg.com/media/FXwGLWLagAAIjSY.jpg,"再びの大雨。
仙台市泉区北部地区では土砂崩れ発生しています。山肌法面緩んでいます。どうか皆さまお気をつけて。#石川けんじ #仙台市議 からの報告より。 https://t.co/ABcXA9Nh1m",2022-07-16 19:35:52,2022-07-16T01:35:49Z,119
1548119179433512960,1,0,31,http://pbs.twimg.com/media/FXwGLz7aQAA-5mN.jpg,"再びの大雨。
仙台市泉区北部地区では土砂崩れ発生しています。山肌法面緩んでいます。どうか皆さまお気をつけて。#石川けんじ #仙台市議 からの報告より。 https://t.co/ABcXA9Nh1m",2022-07-16 19:35:52,2022-07-16T01:35:49Z,119
1548254923241844737,1,1,0,http://pbs.twimg.com/media/FXyBpa4VQAAuqXS.jpg,"#tenki 16:49大雨と雷及び突風に関する全般気象情報 第8号:西日本は16日夜遅くにかけ,東~北日本では17日にかけ,土砂災害,低地の浸水,河川の増水や氾濫に警戒してください.東北地方と中国地では,土砂災害に厳重に警戒してください.西日本と東日本では,落雷や竜巻などの激しい突風に注意してください https://t.co/rJcnblFbZ4",2022-07-16 19:35:13,2022-07-16T10:35:13Z,119
1548254760951681026,1,8,0,http://pbs.twimg.com/media/FXyBf4GUsAUobdS.jpg,"富士山南西部、大雨警報発令中☔️🚨🚨
あと2時間は大雨。
今日一日ずっと降ってるけど、すぐそばの潤井川大丈夫かしら？💦
 #大雨警報 https://t.co/gWVj6Ru5wU",2022-07-16 19:34:34,2022-07-16T10:34:34Z,119
1548254625912229889,1,2,0,http://pbs.twimg.com/media/FXyBYAjaAAEvn1i.jpg,"現在真庭市に大雨・洪水警報が出ております。
皆さまご自身の安全を1番に行動してくださいませ🙇‍♀️

#岡山 #真庭市 #蒜山 #ひるぜん 
#大雨警報 #洪水警報 https://t.co/WEMwPfiaJ1",2022-07-16 19:34:02,2022-07-16T10:34:02Z,119
1548254502267940872,1,0,0,http://pbs.twimg.com/media/FXyBQs5aMAA_Tmr.jpg,"【NHKニュース】 #nhk_news
相模原市 緑区・中央区・南区の一部に避難指示:相模原市は大雨で土砂災害のおそれが高まっているとして、午後6時すぎ、緑区の一部1万8852世帯3万9747人と、中央区の一部1009世帯2307人、それに南区の一部、368世帯765人に避難指示を出しました。… 
https://t.co/GvwGJisAKQ https://t.co/n4blWk24rh",2022-07-16 19:33:33,2022-07-16T10:33:33Z,119
1548254277915013121,1,6,0,http://pbs.twimg.com/media/FXyBCFHaMAA0vol.jpg,"11日〜13日、仙台と秋田に行ってました〜✈️🚅
大雨凄かったけど、念願のしばっちとの日本酒！🍶を実現！
今朝のkanaさんのセッション聴いて、リアルライブラン（ドリンク😝）ってやっぱり素敵って思いました〜
しばっち、ありがとう！
#ライブラン https://t.co/E3OFfndWMn",2022-07-16 19:32:39,2022-07-16T10:32:39Z,119
1548254277915013121,1,6,0,http://pbs.twimg.com/media/FXyBCFLakAAh1Ol.jpg,"11日〜13日、仙台と秋田に行ってました〜✈️🚅
大雨凄かったけど、念願のしばっちとの日本酒！🍶を実現！
今朝のkanaさんのセッション聴いて、リアルライブラン（ドリンク😝）ってやっぱり素敵って思いました〜
しばっち、ありがとう！
#ライブラン https://t.co/E3OFfndWMn",2022-07-16 19:32:39,2022-07-16T10:32:39Z,119
1548254277915013121,1,6,0,http://pbs.twimg.com/media/FXyBCFkacAAwwF0.jpg,"11日〜13日、仙台と秋田に行ってました〜✈️🚅
大雨凄かったけど、念願のしばっちとの日本酒！🍶を実現！
今朝のkanaさんのセッション聴いて、リアルライブラン（ドリンク😝）ってやっぱり素敵って思いました〜
しばっち、ありがとう！
#ライブラン https://t.co/E3OFfndWMn",2022-07-16 19:32:39,2022-07-16T10:32:39Z,119
1548254127280771072,6,7,5,http://pbs.twimg.com/media/FXyA6-maAAAFdj7.jpg,"東部にも大雨警報
今夜まで浸水害、あす明け方まで土砂災害に警戒を

#静岡 #大雨 https://t.co/Ha669qII9n",2022-07-16 19:32:03,2022-07-16T10:32:03Z,8
1548254127280771072,6,7,5,http://pbs.twimg.com/media/FXyA6-kagAA3WD3.jpg,"東部にも大雨警報
今夜まで浸水害、あす明け方まで土砂災害に警戒を

#静岡 #大雨 https://t.co/Ha669qII9n",2022-07-16 19:32:03,2022-07-16T10:32:03Z,8
1548253886917791745,1,0,0,http://pbs.twimg.com/media/FXyAtJDagAEhwC0.jpg,"岡山 島根で記録的大雨 西日本や東日本は非常に激しい雨に警戒 - nhk․or․jp
https://t.co/57wHxnEF7w

【NHK】低気圧と前線の影響で岡山県と島根県では猛烈な雨が降ったとみられ、気象庁は記録的短時間大雨情報を発表しました。西日本では1… https://t.co/Cd3Bze7la9",2022-07-16 19:31:06,2022-07-16T10:31:06Z,119
1548253705329205249,1,1,0,http://pbs.twimg.com/media/FXyAiD-VsAArjR7.jpg,東北本線の下り列車、大雨の影響で陸前山王までしか行かないの辛い🥺 https://t.co/9ifJCrC3GO,2022-07-16 19:30:23,2022-07-16T10:30:23Z,119
1548253430439092224,8,8,7,http://pbs.twimg.com/media/FXyASavaAAAFfk1.jpg,"解析雨量でも
島田市周辺に猛烈な雨の紫表示

赤は50mm以上の非常に激しい雨です

この状況が2時間以上続くと
かなり危険な状況となります
まだ余裕がある内に安全な場所へ

#静岡 #大雨 https://t.co/nSKvYq0KSM",2022-07-16 19:29:17,2022-07-16T10:29:17Z,6
1548253209013002240,5,9,5,http://pbs.twimg.com/media/FXyAFdAUsAAM5Ct.jpg,"宮城県仙台市の大雨ニュースで皆様からご心配をいただいております
緑水亭大丈夫です
秋保温泉は現在雨止み涼しい風が吹いております
また朝方まで降る予報ひどくならないことを祈るばかり
館内3連休、ご家族の笑い声が響いております
願う事は明日チェックアウト時間帯に
大雨になりませんように。 https://t.co/aewopBxOVG",2022-07-16 19:28:24,2022-07-16T10:28:24Z,9
1548095794162503680,1,0,1,http://pbs.twimg.com/media/FXvw6jjUcAAa4n_.jpg,復旧支援に全力挙げる／記録的大雨の被害現場を調査／埼玉・ときがわ町で矢倉氏 #公明新聞電子版 2022年07月16日付  https://t.co/lEHcxmbf8x https://t.co/fzlD2wBgnW,2022-07-16 19:28:04,2022-07-16T00:02:54Z,119
1548252885783556097,1,8,0,http://pbs.twimg.com/media/FXx_yYNakAIi_1p.jpg,"途中ガスが凄かったけどお釜は絶景でした！
まるふくさん大雨で被害があったとのことでお大事にです。再チャレンジします！
#ジャパン峠プロジェクト
#蔵王エコーライン https://t.co/SrXAo1OCQh",2022-07-16 19:27:07,2022-07-16T10:27:07Z,119
1548252885783556097,1,8,0,http://pbs.twimg.com/media/FXx_ylkaIAEaSHJ.jpg,"途中ガスが凄かったけどお釜は絶景でした！
まるふくさん大雨で被害があったとのことでお大事にです。再チャレンジします！
#ジャパン峠プロジェクト
#蔵王エコーライン https://t.co/SrXAo1OCQh",2022-07-16 19:27:07,2022-07-16T10:27:07Z,119
1548252885783556097,1,8,0,http://pbs.twimg.com/media/FXx_yyracAAxOvt.jpg,"途中ガスが凄かったけどお釜は絶景でした！
まるふくさん大雨で被害があったとのことでお大事にです。再チャレンジします！
#ジャパン峠プロジェクト
#蔵王エコーライン https://t.co/SrXAo1OCQh",2022-07-16 19:27:07,2022-07-16T10:27:07Z,119
1548252834344230912,1,2,0,http://pbs.twimg.com/media/FXx-ZPNUIAAuAr7.jpg,"宮城県黒川郡大和町吉田の
鳴瀬川水系南川ダム
大雨の影響で放水していました。 https://t.co/1qONifsk5T",2022-07-16 19:26:55,2022-07-16T10:26:55Z,119
1548252834344230912,1,2,0,http://pbs.twimg.com/media/FXx_Dy0UsAMcQ9Y.jpg,"宮城県黒川郡大和町吉田の
鳴瀬川水系南川ダム
大雨の影響で放水していました。 https://t.co/1qONifsk5T",2022-07-16 19:26:55,2022-07-16T10:26:55Z,119
1548252834344230912,1,2,0,http://pbs.twimg.com/media/FXx_RouVsAEcMZs.jpg,"宮城県黒川郡大和町吉田の
鳴瀬川水系南川ダム
大雨の影響で放水していました。 https://t.co/1qONifsk5T",2022-07-16 19:26:55,2022-07-16T10:26:55Z,119
1548252834344230912,1,2,0,http://pbs.twimg.com/media/FXx_st1UIAIsrGW.jpg,"宮城県黒川郡大和町吉田の
鳴瀬川水系南川ダム
大雨の影響で放水していました。 https://t.co/1qONifsk5T",2022-07-16 19:26:55,2022-07-16T10:26:55Z,119
1548252829944492033,1,1,0,http://pbs.twimg.com/media/FXx-ZURVQAAXLF4.jpg,"宮城県仙台市泉区福岡の
七北田川水系七北田ダムです。
大雨の影響で放水していました。
ダムには近づけないので遠くから撮影 https://t.co/rdt41SvXXu",2022-07-16 19:26:54,2022-07-16T10:26:54Z,119
1548252829944492033,1,1,0,http://pbs.twimg.com/media/FXx_GHwUEAI7eHa.jpg,"宮城県仙台市泉区福岡の
七北田川水系七北田ダムです。
大雨の影響で放水していました。
ダムには近づけないので遠くから撮影 https://t.co/rdt41SvXXu",2022-07-16 19:26:54,2022-07-16T10:26:54Z,119
1548252829944492033,1,1,0,http://pbs.twimg.com/media/FXx_ah-UEAATKrM.jpg,"宮城県仙台市泉区福岡の
七北田川水系七北田ダムです。
大雨の影響で放水していました。
ダムには近づけないので遠くから撮影 https://t.co/rdt41SvXXu",2022-07-16 19:26:54,2022-07-16T10:26:54Z,119
1548252831089496068,1,1,0,http://pbs.twimg.com/media/FXx-ZOLVUAAe1kD.jpg,"宮城県黒川郡大和町宮床の
鳴瀬川水系宮床ダムです。
こちらも大雨の影響で放水していました。 https://t.co/igAAtRPGsc",2022-07-16 19:26:54,2022-07-16T10:26:54Z,119
1548252831089496068,1,1,0,http://pbs.twimg.com/media/FXx_BoZUYAE_Gf1.jpg,"宮城県黒川郡大和町宮床の
鳴瀬川水系宮床ダムです。
こちらも大雨の影響で放水していました。 https://t.co/igAAtRPGsc",2022-07-16 19:26:54,2022-07-16T10:26:54Z,119
1548252831089496068,1,1,0,http://pbs.twimg.com/media/FXx_QsrUsAIwFFU.jpg,"宮城県黒川郡大和町宮床の
鳴瀬川水系宮床ダムです。
こちらも大雨の影響で放水していました。 https://t.co/igAAtRPGsc",2022-07-16 19:26:54,2022-07-16T10:26:54Z,119
1548252831089496068,1,1,0,http://pbs.twimg.com/media/FXx_k2wUEAIer1e.jpg,"宮城県黒川郡大和町宮床の
鳴瀬川水系宮床ダムです。
こちらも大雨の影響で放水していました。 https://t.co/igAAtRPGsc",2022-07-16 19:26:54,2022-07-16T10:26:54Z,119
1548252815352483842,1,1,0,http://pbs.twimg.com/media/FXx-ZUQUcAceDn6.jpg,"宮城県仙台市青葉区大倉の
仙台環境開発大倉ダムです。
大雨の影響で4つあるゲートが全開してました！ https://t.co/rNeloPzXCw",2022-07-16 19:26:50,2022-07-16T10:26:50Z,119
1548252815352483842,1,1,0,http://pbs.twimg.com/media/FXx_GGpUUAEDq1q.jpg,"宮城県仙台市青葉区大倉の
仙台環境開発大倉ダムです。
大雨の影響で4つあるゲートが全開してました！ https://t.co/rNeloPzXCw",2022-07-16 19:26:50,2022-07-16T10:26:50Z,119
1548252815352483842,1,1,0,http://pbs.twimg.com/media/FXx_Z51UIAIR5Fz.jpg,"宮城県仙台市青葉区大倉の
仙台環境開発大倉ダムです。
大雨の影響で4つあるゲートが全開してました！ https://t.co/rNeloPzXCw",2022-07-16 19:26:50,2022-07-16T10:26:50Z,119
1548242451709562881,1,0,3,http://pbs.twimg.com/media/FXx2Td5agAAhS6T.jpg,"【きのくに線 上下線 運転見合わせ】
きのくに線は、17:04頃、大雨による運転規制の影響で、紀伊田原～周参見の上下線で運転を見合わせています。 https://t.co/Gmxd7d553B",2022-07-16 19:26:35,2022-07-16T09:45:40Z,119
1548252606816210946,1,1,0,http://pbs.twimg.com/media/FXx_iQJakAA1-1b.jpg,"大雨が心配された仙台でしたが、
講義が終わって、夕方の駅前はこんな感じ。

雨は上がっていました。

宮城県で被害が出たところもあるようで心配です。

#仙台 https://t.co/P3Cj4tVMy1",2022-07-16 19:26:01,2022-07-16T10:26:01Z,119
1548252331372081152,1,0,0,http://pbs.twimg.com/media/FXx_SitaMAA1foF.jpg,"[速報] 7月16日19時21分頃、広島県に大雨警報・雷注意報などが発表
https://t.co/E9shT3hIVe https://t.co/AHjriqAzCZ",2022-07-16 19:24:55,2022-07-16T10:24:55Z,119
1548197768312672256,2,0,8,http://pbs.twimg.com/media/FXxNokYUsAEgUtR.jpg,柴田町・第一分団・四班大雨警報が発令され解除となりましたが、地域の安全確保の為、防火槽・用水路・排水路などの見守りを行いました。 https://t.co/Tsul4uuRy9,2022-07-16 19:24:09,2022-07-16T06:48:06Z,31
1548197768312672256,2,0,8,http://pbs.twimg.com/media/FXxNpiVVsAI9n65.jpg,柴田町・第一分団・四班大雨警報が発令され解除となりましたが、地域の安全確保の為、防火槽・用水路・排水路などの見守りを行いました。 https://t.co/Tsul4uuRy9,2022-07-16 19:24:09,2022-07-16T06:48:06Z,31
1548197768312672256,2,0,8,http://pbs.twimg.com/media/FXxNqKvVQAEfeAR.jpg,柴田町・第一分団・四班大雨警報が発令され解除となりましたが、地域の安全確保の為、防火槽・用水路・排水路などの見守りを行いました。 https://t.co/Tsul4uuRy9,2022-07-16 19:24:09,2022-07-16T06:48:06Z,31
1548252114182623232,1,23,0,http://pbs.twimg.com/media/FXx_F2QaIAI9iB2.jpg,"今日は大雨で大変な1日でしたね💦まだ明日にかけて大雨となる場所もあるとのこと、土砂災害に気をつけつつ慎重に行動したいと思います😖
盛岡は今雨も止み夕焼け空も見られました！湿度もあり疲れの溜まる1日でした、皆様どうぞゆっくりお休みくださいね🌙#岩手山 #盛岡 #夕陽 #夕焼け #岩手県 #夕日 https://t.co/hfntFRP2xz",2022-07-16 19:24:03,2022-07-16T10:24:03Z,119
1548252052446658560,1,0,0,http://pbs.twimg.com/media/FXx_CMRaMAA44ur.jpg,今は晴れて来ましたが、昨日は雨に雷ひどかったです。でも九州より宮城県など東北が、かなりひどい被害ですね。お見舞い申し上げます。これどう考えても、梅雨末期の大雨でしょうよ。しっかりと前線もあるし、６月下旬は一時的に消えたんだと思います。本来例年の梅雨明けはこれからです。 https://t.co/PenyABgJcz,2022-07-16 19:23:49,2022-07-16T10:23:49Z,119
1548251491269750784,1,0,0,http://pbs.twimg.com/media/FXx-gr_aIAEbGHX.jpg,"鳩山町に昨晩入り、朝から復旧のお手伝い。
とは言っても詳しい状況もわからず、お手伝いするお宅も決まっていない。。
災害ゴミ集積所を確認して被害が大きかった地区へ移動し、被害が大きいお宅へ声を掛ける。
快く受け入れていただき、精一杯作業させていただきました。
#鳩山町
#大雨
#災害 https://t.co/pr0njctOLy",2022-07-16 19:21:35,2022-07-16T10:21:35Z,119
1548251404137304064,9,6,8,http://pbs.twimg.com/media/FXx-cbpaIAEbzKd.jpg,"雨雲停滞気味

南風が山の斜面にぶつかり積乱雲を作り
上空の南西風が北東方向へその雲を流す
この繰り返しでライン状の降水域が出来ています

西部、中部、東部は
同じ場所で激しい雨が降り続き
災害危険度が急激に高まる恐れがあります

#静岡 #大雨 https://t.co/TEORGDs2PD",2022-07-16 19:21:14,2022-07-16T10:21:14Z,4
1548251404137304064,9,6,8,http://pbs.twimg.com/media/FXx-cbkaUAAbtXP.jpg,"雨雲停滞気味

南風が山の斜面にぶつかり積乱雲を作り
上空の南西風が北東方向へその雲を流す
この繰り返しでライン状の降水域が出来ています

西部、中部、東部は
同じ場所で激しい雨が降り続き
災害危険度が急激に高まる恐れがあります

#静岡 #大雨 https://t.co/TEORGDs2PD",2022-07-16 19:21:14,2022-07-16T10:21:14Z,4
1548251197794295810,4,7,3,http://pbs.twimg.com/ext_tw_video_thumb/1548251160343347200/pu/img/224NUGMcBSYXuMYW.jpg,気仙沼の大雨の被害 https://t.co/fCK1tpD3mO,2022-07-16 19:20:25,2022-07-16T10:20:25Z,16
1548217176477544448,2,0,8,http://pbs.twimg.com/media/FXxfT5PaIAAsHbO.jpg,"【記録的短時間大雨情報】
島根県で記録的短時間大雨
隠岐の島町付近で約１００ミリ
土砂災害の危険度が高まっています

危険な崖から離れるなど、
ただちに身を守る行動を取って下さい https://t.co/Zz9kvxIB2j",2022-07-16 19:20:24,2022-07-16T08:05:14Z,31
1548251108577263616,1,1,0,http://pbs.twimg.com/media/FXx-LN9agAUolUo.jpg,"今日の　#七條大橋

昼からは大雨になるのではと警戒していましたが、大丈夫でしたね。
涼しくて過ごしやすい1日でした😊

#七條大橋をキレイにする会
#鴨川　#橋 https://t.co/HOMKCEozVX",2022-07-16 19:20:04,2022-07-16T10:20:04Z,119
1548250929988005889,4,18,3,http://pbs.twimg.com/media/FXx-AYPaIAABbz7.jpg,"大雨が降っている地域がまだまだあります...被害が増えないことを祈るばかりです｡
今の門司港は雨が止んで､めちゃ綺麗な夕陽空が見えてます！
これを見て少しでも癒されますように～🍀
ライブカメラに感謝✡.*
#イマソラ
#門司港の夕陽空 
#繋がりに感謝 
@hukurou0317 
@karintoto_4 https://t.co/N3sQrgUQsC",2022-07-16 19:19:21,2022-07-16T10:19:21Z,16
