RID,n,nf,nr,Purl,text,JTime,RTime,Rank
1548250929988005889,4,18,3,http://pbs.twimg.com/media/FXx-A6_aAAYpUie.jpg,"大雨が降っている地域がまだまだあります...被害が増えないことを祈るばかりです｡
今の門司港は雨が止んで､めちゃ綺麗な夕陽空が見えてます！
これを見て少しでも癒されますように～🍀
ライブカメラに感謝✡.*
#イマソラ
#門司港の夕陽空 
#繋がりに感謝 
@hukurou0317 
@karintoto_4 https://t.co/N3sQrgUQsC",2022-07-16 19:19:21,2022-07-16T10:19:21Z,16
1548250881207898112,2,2,1,http://pbs.twimg.com/media/FXx99-AaUAA9JyZ.jpg,"球磨村で土砂崩れ 一時孤立の地区も

https://t.co/Vf8SPojLHa

#KABニュース #熊本 #大雨 https://t.co/2ByxfXdhR6",2022-07-16 19:19:09,2022-07-16T10:19:09Z,31
1548232564053508097,1,0,2,http://pbs.twimg.com/media/FXxtR-7agAAxTkt.jpg,"7月16日(土曜日)
今日は雲☁️時々にわか雨
岡山県北部は大雨警報😅
今日は草刈り頑張りました。
梅雨の戻りで恵みの☔雨
でも災害レベルは大変😱 https://t.co/Uc2gR56FUa",2022-07-16 19:18:08,2022-07-16T09:06:22Z,119
1548232564053508097,1,0,2,http://pbs.twimg.com/media/FXxtTmgaUAAdVxR.jpg,"7月16日(土曜日)
今日は雲☁️時々にわか雨
岡山県北部は大雨警報😅
今日は草刈り頑張りました。
梅雨の戻りで恵みの☔雨
でも災害レベルは大変😱 https://t.co/Uc2gR56FUa",2022-07-16 19:18:08,2022-07-16T09:06:22Z,119
1548250381238796288,10,11,9,http://pbs.twimg.com/media/FXx9g7baAAA2ezx.jpg,"西部、中部はあす明け方まで土砂災害警戒
浸水害は今夜いっぱい警戒

伊豆南はこれから大雨となり
夜遅くからあす明け方にかけ警戒

レベル4相当の土砂災害警戒情報が出る恐れもあり
安全な場所でお過ごしを

#静岡 #大雨 https://t.co/5TMOI98J0l",2022-07-16 19:17:10,2022-07-16T10:17:10Z,2
1548250296283181056,1,0,1,http://pbs.twimg.com/media/FXx9bl0aUAA3b1c.jpg,"記録的大雨で家が床上浸水になった家主に対しテレビ朝日系列局の取材記者「この状況を見ていかがですか?」

→家財道具すべて泥だらけになりショックを受けている家主に対してなんて質問してるんだか。こういうときによくインタビューなんて出来るよな。空気読めよ https://t.co/Ryflg77kIl",2022-07-16 19:16:50,2022-07-16T10:16:50Z,119
1548250275529785344,1,14,0,http://pbs.twimg.com/media/FXx9UOtakAI1M4_.jpg,"北と南の気温差

低気圧が秋田沖にあり、このあと東北地方を横切って、日本の東へ。この影響で大雨や暴風、高波などの警戒が必要です。

激しすぎる気温差にも注意を。この低気圧の北側と南側で、まるで別世界の猛暑と低温になる。
北海道は１０月の気温となり関東は４０度前後の記録的な猛暑。 https://t.co/lp4fQ5lf0Z",2022-07-16 19:16:45,2022-07-16T10:16:45Z,119
1548250275529785344,1,14,0,http://pbs.twimg.com/media/FXx9YqgakAADplW.jpg,"北と南の気温差

低気圧が秋田沖にあり、このあと東北地方を横切って、日本の東へ。この影響で大雨や暴風、高波などの警戒が必要です。

激しすぎる気温差にも注意を。この低気圧の北側と南側で、まるで別世界の猛暑と低温になる。
北海道は１０月の気温となり関東は４０度前後の記録的な猛暑。 https://t.co/lp4fQ5lf0Z",2022-07-16 19:16:45,2022-07-16T10:16:45Z,119
1548250140016005120,1,20,0,http://pbs.twimg.com/media/FXx9S9TaUAEJK1E.jpg,"幸い災害対応参集はなかったものの、雨に振り込められた一日☔
家族に作る今夜の菜、エビをちくわニンニクの芽もやしと炒めてナンプラー＋レモン汁で味付けしたやーつ🦐もりもり食べれ〜( ﾟДﾟ)b
宮城県北部はじめ各地に大雨の大きな被害がないことを祈りつつ🙏
#Twitter家庭料理部  #おうちごはん https://t.co/hVLokoaEYm",2022-07-16 19:16:13,2022-07-16T10:16:13Z,119
1548249713300078596,8,5,7,http://pbs.twimg.com/media/FXx86E5aQAAUnn0.jpg,伊豆南にも大雨警報 https://t.co/5NKRac9rV6,2022-07-16 19:14:31,2022-07-16T10:14:31Z,6
1548068231264743425,2,0,389,http://pbs.twimg.com/media/FXvX2XfaIAAD9e_.jpg,"おはようござりす
大雨で松島町に「緊急安全確保」が発令されてっちゃ
大崎市も冠水している所があるみでぇだっちゃ
あっつこっつで地盤が緩んで川が増水してっちゃ〜
土砂災害や洪水に警戒してけさいん https://t.co/y8RW0zbJ8y",2022-07-16 19:13:14,2022-07-15T22:13:22Z,31
1548249305404047361,1,3,0,http://pbs.twimg.com/media/FXx8hryakAYnv0d.jpg,"今日から出張で東北へ😊
途中宮城を通過しましたが、大雨の影響で交通規制や道路の冠水してました😅
なんとか目的地の栃木まで到着しましたのでゆっくりしたいと思います🤗
写真は川ではなく畑です😱 https://t.co/9CLNMIZujB",2022-07-16 19:12:54,2022-07-16T10:12:54Z,119
1548249305404047361,1,3,0,http://pbs.twimg.com/media/FXx8iKwaAAAH_eC.jpg,"今日から出張で東北へ😊
途中宮城を通過しましたが、大雨の影響で交通規制や道路の冠水してました😅
なんとか目的地の栃木まで到着しましたのでゆっくりしたいと思います🤗
写真は川ではなく畑です😱 https://t.co/9CLNMIZujB",2022-07-16 19:12:54,2022-07-16T10:12:54Z,119
1548249200130854913,1,0,0,http://pbs.twimg.com/media/FXx8cN7VQAMsaKZ.jpg,大雨で５２８人が避難　球磨村で土砂崩れ(KAB熊本朝日放送) https://t.co/Q3ixePVc9z https://t.co/o5CvRMUF1X,2022-07-16 19:12:29,2022-07-16T10:12:29Z,119
1548206598689996800,2,0,13,http://pbs.twimg.com/media/FXxVr3BUYAMEIBP.jpg,"大崎市災害対策本部会議から議会に情報提供がありました。
令和4年7月15日大雨による被害状況等(16日11:00現在)
被害状況・避難状況及び救急状況等は別紙の通りです。 https://t.co/Je7DFBmBKJ",2022-07-16 19:11:05,2022-07-16T07:23:12Z,31
1548206598689996800,2,0,13,http://pbs.twimg.com/media/FXxVsSpUIAA2IT7.jpg,"大崎市災害対策本部会議から議会に情報提供がありました。
令和4年7月15日大雨による被害状況等(16日11:00現在)
被害状況・避難状況及び救急状況等は別紙の通りです。 https://t.co/Je7DFBmBKJ",2022-07-16 19:11:05,2022-07-16T07:23:12Z,31
1548248851005710337,1,9,0,http://pbs.twimg.com/media/FXx6mHVaQAAIlC-.jpg,"「三重にようこそ～杏ちゃん」（１７）

杏ちゃん、暑い中、お疲れ様でした。ラストは伊勢おはらいまちでした。今、宮城県は大雨警報がでております。安全を保って下さい。

三重県亀山市「鈴鹿峠自然の家」
　　　伊勢市
@annchan_666  八海杏奈さん
 
#八海杏奈 #杏ちゃん #東北モデル #仙台 #宮城県 https://t.co/mRrq6ezg0W",2022-07-16 19:11:05,2022-07-16T10:11:05Z,119
1548248851005710337,1,9,0,http://pbs.twimg.com/media/FXx6zYWakAA_WhM.jpg,"「三重にようこそ～杏ちゃん」（１７）

杏ちゃん、暑い中、お疲れ様でした。ラストは伊勢おはらいまちでした。今、宮城県は大雨警報がでております。安全を保って下さい。

三重県亀山市「鈴鹿峠自然の家」
　　　伊勢市
@annchan_666  八海杏奈さん
 
#八海杏奈 #杏ちゃん #東北モデル #仙台 #宮城県 https://t.co/mRrq6ezg0W",2022-07-16 19:11:05,2022-07-16T10:11:05Z,119
1548248842826809346,1,11,0,http://pbs.twimg.com/media/FXx8HanakAIuczm.jpg,やっとスクショのやり方がわかった😃。これは7月9日。今日の静岡は大雨です。 https://t.co/FcoP0zdCo5,2022-07-16 19:11:03,2022-07-16T10:11:03Z,119
1548248387203796992,3,2,2,http://pbs.twimg.com/media/FXx7s1FacAEq_4m.jpg,"【17日の天気のツボ】
・北日本は激しい雨や雷雨となる⛈️
・続く大雨による土砂災害等に厳重警戒‼️
・西日本中心に晴れ間があるが、関東～中国地方で1時間50ミリの雨が降る所も🌧️
・最高気温は東北南部～沖縄で30度を超えムシムシ😅
・18日は西から再び雨に、避難所や備蓄品の確認をして⚠️
#天気予報 https://t.co/SXb3g6KYlX",2022-07-16 19:09:15,2022-07-16T10:09:15Z,20
1548248387203796992,3,2,2,http://pbs.twimg.com/media/FXx7s1EakAAlAcv.jpg,"【17日の天気のツボ】
・北日本は激しい雨や雷雨となる⛈️
・続く大雨による土砂災害等に厳重警戒‼️
・西日本中心に晴れ間があるが、関東～中国地方で1時間50ミリの雨が降る所も🌧️
・最高気温は東北南部～沖縄で30度を超えムシムシ😅
・18日は西から再び雨に、避難所や備蓄品の確認をして⚠️
#天気予報 https://t.co/SXb3g6KYlX",2022-07-16 19:09:15,2022-07-16T10:09:15Z,20
1548248186732441602,1,0,0,http://pbs.twimg.com/media/FXx7hPiacAA_7KC.jpg,[khb公式]🆕 宮城県で記録的な大雨　大崎市の名蓋川が氾濫するなど各地で被害｜東日本放送 YouTube 宮城県　https://t.co/wSnt0yLYMf https://t.co/JTpLiKvyiw,2022-07-16 19:08:27,2022-07-16T10:08:27Z,119
1548218897257549824,1,0,16,http://pbs.twimg.com/media/FXxg4LKVQAA4hwe.jpg,"大雨と雷及びひょうに関する宮城県気象情報　第10号が発表されました。

https://t.co/qcdfd4Hzqn https://t.co/C2zQWDzCaV",2022-07-16 19:08:04,2022-07-16T08:12:04Z,119
1548080101996126210,1,0,4,http://pbs.twimg.com/media/FXvin0UVQAIO6NW.jpg,"宮城の大雨で氾濫箇所が出ています。
加美町の名蓋川のカメラを見ると、平常時とはまったく違う風景になってしまっています。
気象台や自治体の発表情報に注意してください。 https://t.co/0eoJztq4BC",2022-07-16 19:07:56,2022-07-15T23:00:32Z,119
1548080101996126210,1,0,4,http://pbs.twimg.com/media/FXvin0YUEAAMVkR.jpg,"宮城の大雨で氾濫箇所が出ています。
加美町の名蓋川のカメラを見ると、平常時とはまったく違う風景になってしまっています。
気象台や自治体の発表情報に注意してください。 https://t.co/0eoJztq4BC",2022-07-16 19:07:56,2022-07-15T23:00:32Z,119
1548091102040756224,1,0,13,http://pbs.twimg.com/media/FXvspwdUUAAPYrU.jpg,"奥松島パークライン、富山駅前交差点水没につき、通行不可能です。
皆様お気をつけください。

#大雨
#宮城県 https://t.co/NI7P3GrbcX",2022-07-16 19:07:54,2022-07-15T23:44:15Z,119
1548248041643470848,10,11,9,http://pbs.twimg.com/media/FXx7YwTaAAEkPHC.jpg,"1時間雨量

静岡市南部・平山 58.0 mm
静岡市南部・麻機 54.0 mm
島田市・川根 51.0 mm
島田市・伊久美 72.0 mm

活発な雨雲が西部〜東部にかけ広がっています

#静岡 #大雨 https://t.co/7QBmHdSNv5",2022-07-16 19:07:52,2022-07-16T10:07:52Z,2
1548247909543469057,1,22,0,http://pbs.twimg.com/media/FXx7Q_9VUAIg9jO.jpg,"⚠️⚠️⚠️⚠️こんばんは⚠️⚠️⚠️⚠️

宮城県は😱記録的な大雨で😨

各地で道路の冠水や堤防決壊、土砂災害

発生し、更に3連休も重なり🙁

帰宅時も国道4号も20Km以上渋滞💦

他県ナンバー多かったです😔

ジミニーも朝、道路冠水の為、迂回😢

初めての出来事😭

皆さん良い夜🌉過ごして下さい https://t.co/4fBoxgZDWu",2022-07-16 19:07:21,2022-07-16T10:07:21Z,119
1548247589329731584,1,8,0,http://pbs.twimg.com/media/FXx6-eFaMAIF3Kg.jpg,"今日、気仙沼から届いた郵便。
暫く行けてない。
大雨災害心配です。
#気仙沼 https://t.co/kNodYl6uSZ",2022-07-16 19:06:05,2022-07-16T10:06:05Z,119
1548247526897176578,1,1,0,http://pbs.twimg.com/media/FXx66eOUUAAQnZS.jpg,"九州でも大雨となりましたが、日本九援隊の田中直子さんが急遽ボラバスサンタでお世話になった人吉市の林照寺に駆けました。昨日の写真と一昨年前の林照寺の同じ場所で写しましたものを並べていますが、水も引き晴れ間もでていて、住職とも話して、人吉は大きな被害はなかったそうです。

#防災　#復興 https://t.co/eAMPjdY6uK",2022-07-16 19:05:50,2022-07-16T10:05:50Z,119
1548247526897176578,1,1,0,http://pbs.twimg.com/media/FXx66eRVQAAnlqf.jpg,"九州でも大雨となりましたが、日本九援隊の田中直子さんが急遽ボラバスサンタでお世話になった人吉市の林照寺に駆けました。昨日の写真と一昨年前の林照寺の同じ場所で写しましたものを並べていますが、水も引き晴れ間もでていて、住職とも話して、人吉は大きな被害はなかったそうです。

#防災　#復興 https://t.co/eAMPjdY6uK",2022-07-16 19:05:50,2022-07-16T10:05:50Z,119
1548247526897176578,1,1,0,http://pbs.twimg.com/media/FXx66eMUIAEO0hy.jpg,"九州でも大雨となりましたが、日本九援隊の田中直子さんが急遽ボラバスサンタでお世話になった人吉市の林照寺に駆けました。昨日の写真と一昨年前の林照寺の同じ場所で写しましたものを並べていますが、水も引き晴れ間もでていて、住職とも話して、人吉は大きな被害はなかったそうです。

#防災　#復興 https://t.co/eAMPjdY6uK",2022-07-16 19:05:50,2022-07-16T10:05:50Z,119
1548247387675668481,1,0,0,http://pbs.twimg.com/media/FXx6ydZacAA8ohb.jpg,関東甲信 神奈川に活発な雨雲 午後は広く雨や雷雨 滝のような雨の恐れ 大雨に警戒(気象予報士 吉田 友海 2022年07月16日) - https://t.co/YDEZiNLsZj https://t.co/4ublSAdpb2 https://t.co/31jMDesHEy,2022-07-16 19:05:16,2022-07-16T10:05:16Z,119
1548247299163164672,1,0,0,http://pbs.twimg.com/media/FXx6tCSUUAAX-xx.jpg,#煮え湯ニュース 7/16 大雨警戒 最近毎日のように土砂降りで梅雨の末期の様相。各地で大きな災害が起こりませんように。ちなみに我らが水瓶、牧尾ダムは急回復の様子。美味しい木曽川の水ありがとう https://t.co/yXvQkpaP8F,2022-07-16 19:04:55,2022-07-16T10:04:55Z,119
1548247204988497920,1,9,0,http://pbs.twimg.com/media/FXx6mdLUUAAZ9td.jpg,"19:00〜⏲️☁️✨

おつかれさまです。
各地で大雨の被害が。大丈夫で
しょうか？

大阪は、☁️時々☔の1日。
画像左から昼頃・15時前・今の
様子です。
明日は天気良くなる…❓
ちょっと期待してますが😅

さっ、メシ済ませたら
夜間部📚✒️スタート☝
ファイトで〜す(^O^)/ https://t.co/t3wX4GdrW5",2022-07-16 19:04:33,2022-07-16T10:04:33Z,119
1548247204988497920,1,9,0,http://pbs.twimg.com/media/FXx6nR2VQAMglXH.jpg,"19:00〜⏲️☁️✨

おつかれさまです。
各地で大雨の被害が。大丈夫で
しょうか？

大阪は、☁️時々☔の1日。
画像左から昼頃・15時前・今の
様子です。
明日は天気良くなる…❓
ちょっと期待してますが😅

さっ、メシ済ませたら
夜間部📚✒️スタート☝
ファイトで〜す(^O^)/ https://t.co/t3wX4GdrW5",2022-07-16 19:04:33,2022-07-16T10:04:33Z,119
1548247204988497920,1,9,0,http://pbs.twimg.com/media/FXx6oI4UYAgtvFA.jpg,"19:00〜⏲️☁️✨

おつかれさまです。
各地で大雨の被害が。大丈夫で
しょうか？

大阪は、☁️時々☔の1日。
画像左から昼頃・15時前・今の
様子です。
明日は天気良くなる…❓
ちょっと期待してますが😅

さっ、メシ済ませたら
夜間部📚✒️スタート☝
ファイトで〜す(^O^)/ https://t.co/t3wX4GdrW5",2022-07-16 19:04:33,2022-07-16T10:04:33Z,119
1548247103822233600,1,12,0,http://pbs.twimg.com/media/FXx6iQ6akAALyqf.jpg,"…岡山市北区のイマソラ

 18:29撮影。夕暮れは19:46です

先程から雨が降り始めたのですが、屋根を打つ雨音が徐々に大きくなってきました

県北の鏡野町付近では記録的短時間大雨情報が出ており、南側にも雨雲が掛かってきたようです

皆様も大雨に警戒しつつご安全にお過ごしください🍀
#イマソラ https://t.co/fwUUkoZ9ju",2022-07-16 19:04:09,2022-07-16T10:04:09Z,119
1548153436935704577,1,0,13,http://pbs.twimg.com/media/FXwlVqXaAAE74J1.jpg,復旧支援に全力挙げる／記録的大雨の被害現場を調査／埼玉・ときがわ町で矢倉氏 #公明新聞電子版 2022年07月16日付  https://t.co/NpW21w4rDe https://t.co/sjEFsmA6sj,2022-07-16 19:03:29,2022-07-16T03:51:57Z,119
1548246877547573249,1,33,0,http://pbs.twimg.com/media/FXx6UhUVQAE-Cr7.jpg,"酷い雨だった。
仙台で大雨降らせた雨雲が北上してぶち当たったようです。
今日の走行距離は295km、燃費30でした。
画像は恐山。 https://t.co/cMnteDmScD",2022-07-16 19:03:15,2022-07-16T10:03:15Z,119
1548246877547573249,1,33,0,http://pbs.twimg.com/media/FXx6U7bUEAM_CSv.jpg,"酷い雨だった。
仙台で大雨降らせた雨雲が北上してぶち当たったようです。
今日の走行距離は295km、燃費30でした。
画像は恐山。 https://t.co/cMnteDmScD",2022-07-16 19:03:15,2022-07-16T10:03:15Z,119
1548246877547573249,1,33,0,http://pbs.twimg.com/media/FXx6VIXUIAQF8uc.jpg,"酷い雨だった。
仙台で大雨降らせた雨雲が北上してぶち当たったようです。
今日の走行距離は295km、燃費30でした。
画像は恐山。 https://t.co/cMnteDmScD",2022-07-16 19:03:15,2022-07-16T10:03:15Z,119
1548246828981792775,4,9,3,http://pbs.twimg.com/media/FXx6SDfVUAASOBT.jpg,"明日7/17はカメイアリーナ仙台施設見学ツアー開催日です！
昨日今日の大雨で、交通機関などにも影響が出ているところがあるかもしれません…
明日も午後から雨予報ではありますが、ご参加の皆様気をつけていらしてください☂️

館内での記念写真に有用な小物も充実してきています！✨笑 https://t.co/AZayNYqM0v",2022-07-16 19:03:03,2022-07-16T10:03:03Z,16
1548246828981792775,4,9,3,http://pbs.twimg.com/media/FXx6SDhUYAAM57j.jpg,"明日7/17はカメイアリーナ仙台施設見学ツアー開催日です！
昨日今日の大雨で、交通機関などにも影響が出ているところがあるかもしれません…
明日も午後から雨予報ではありますが、ご参加の皆様気をつけていらしてください☂️

館内での記念写真に有用な小物も充実してきています！✨笑 https://t.co/AZayNYqM0v",2022-07-16 19:03:03,2022-07-16T10:03:03Z,16
1548246828981792775,4,9,3,http://pbs.twimg.com/media/FXx6SEbUUAAF_cP.jpg,"明日7/17はカメイアリーナ仙台施設見学ツアー開催日です！
昨日今日の大雨で、交通機関などにも影響が出ているところがあるかもしれません…
明日も午後から雨予報ではありますが、ご参加の皆様気をつけていらしてください☂️

館内での記念写真に有用な小物も充実してきています！✨笑 https://t.co/AZayNYqM0v",2022-07-16 19:03:03,2022-07-16T10:03:03Z,16
1548246828981792775,4,9,3,http://pbs.twimg.com/media/FXx6SHEUYAANe9x.jpg,"明日7/17はカメイアリーナ仙台施設見学ツアー開催日です！
昨日今日の大雨で、交通機関などにも影響が出ているところがあるかもしれません…
明日も午後から雨予報ではありますが、ご参加の皆様気をつけていらしてください☂️

館内での記念写真に有用な小物も充実してきています！✨笑 https://t.co/AZayNYqM0v",2022-07-16 19:03:03,2022-07-16T10:03:03Z,16
1548246331541446657,1,2,0,http://pbs.twimg.com/media/FXx5MGSUYAIjf2Z.jpg,"色々大変だけど安全第一！
南三陸、そして宮城県の皆様どうぞお気をつけて！
#大雨　#宮城県 https://t.co/bbIcFFsqP6 https://t.co/pCaw2triIn",2022-07-16 19:01:05,2022-07-16T10:01:05Z,119
1548202262576521217,3,0,22,http://pbs.twimg.com/media/FXxRv4LUcAEdcE_.jpg,宮城県は、令和4年7月14日からの大雨災害にかかる災害救助法を、大崎市・松島町に適用する事を決定。 https://t.co/fbjWWiwUnt,2022-07-16 19:00:26,2022-07-16T07:05:58Z,20
1548242452733374464,1,0,3,http://pbs.twimg.com/media/FXx2RZpaAAAyrsl.jpg,"今週もありがとうございました。
外は大雨。
安全な場所で過ごしましょう。
私は今日もケーキを食べています🍽
#静岡　#パティスリー46 https://t.co/x7bLqR1Pua",2022-07-16 19:00:09,2022-07-16T09:45:40Z,119
1548242452733374464,1,0,3,http://pbs.twimg.com/media/FXx2TS_aAAAMExw.jpg,"今週もありがとうございました。
外は大雨。
安全な場所で過ごしましょう。
私は今日もケーキを食べています🍽
#静岡　#パティスリー46 https://t.co/x7bLqR1Pua",2022-07-16 19:00:09,2022-07-16T09:45:40Z,119
1548237788864057347,1,0,4,http://pbs.twimg.com/ext_tw_video_thumb/1548237642600312832/pu/img/GljNSSlmwZOp4RYm.jpg,"静岡県、雨が凄い‼️☔️

#大雨
#キョロキョロ https://t.co/PpEDgKMcMF",2022-07-16 18:59:37,2022-07-16T09:27:08Z,119
1548245892498886656,2,0,1,http://pbs.twimg.com/media/FXx5R5faMAAmHLb.jpg,"#浜松 ＃遠州  #大雨警報 
【警報状況】18:55現在
大雨警報：浜松市南部、掛川市、御前崎市、菊川市
１７日明け方まで土砂災害に警戒してください。 https://t.co/5FGHUpwRCt",2022-07-16 18:59:20,2022-07-16T09:59:20Z,31
