RID,n,nf,nr,Purl,text,JTime,RTime,Rank
1549371963168399360,1,0,0,http://pbs.twimg.com/media/FYB0yZWaAAYgA6d.jpg,"〈九州　大雨に警戒〉
すでにこれまでの大雨で、地盤の緩んでいるところがあります。
九州では雨が降り続き、この後も各地で激しい雷雨となる見込みです。
特に明け方にかけては、九州南部で非常に激しい雨が降るおそれもあります。
土砂災害に警戒し、激しい気象現象にもご注意ください。 https://t.co/nHFZixjtv3",2022-07-19 21:33:56,2022-07-19T12:33:56Z,73
1549371963168399360,1,0,0,http://pbs.twimg.com/media/FYB1q8FaMAEZoId.png,"〈九州　大雨に警戒〉
すでにこれまでの大雨で、地盤の緩んでいるところがあります。
九州では雨が降り続き、この後も各地で激しい雷雨となる見込みです。
特に明け方にかけては、九州南部で非常に激しい雨が降るおそれもあります。
土砂災害に警戒し、激しい気象現象にもご注意ください。 https://t.co/nHFZixjtv3",2022-07-19 21:33:56,2022-07-19T12:33:56Z,73
1549371963168399360,1,0,0,http://pbs.twimg.com/media/FYB1q8hagAE6fGp.png,"〈九州　大雨に警戒〉
すでにこれまでの大雨で、地盤の緩んでいるところがあります。
九州では雨が降り続き、この後も各地で激しい雷雨となる見込みです。
特に明け方にかけては、九州南部で非常に激しい雨が降るおそれもあります。
土砂災害に警戒し、激しい気象現象にもご注意ください。 https://t.co/nHFZixjtv3",2022-07-19 21:33:56,2022-07-19T12:33:56Z,73
1549371963168399360,1,0,0,http://pbs.twimg.com/media/FYB1q82aUAE-XMq.png,"〈九州　大雨に警戒〉
すでにこれまでの大雨で、地盤の緩んでいるところがあります。
九州では雨が降り続き、この後も各地で激しい雷雨となる見込みです。
特に明け方にかけては、九州南部で非常に激しい雨が降るおそれもあります。
土砂災害に警戒し、激しい気象現象にもご注意ください。 https://t.co/nHFZixjtv3",2022-07-19 21:33:56,2022-07-19T12:33:56Z,73
1549371945766223874,1,0,0,http://pbs.twimg.com/media/FYB5knvakAAw8IZ.jpg,"大雨で約6時間近く止まった琵琶湖線
約7時間止まった草津線
それに加え神戸線での人身事故
それの影響でアーバンネットワークは完全にアボーンネットワーク状態 https://t.co/mulBt7gup7",2022-07-19 21:33:52,2022-07-19T12:33:52Z,73
1549371726387384321,1,3,0,http://pbs.twimg.com/media/FYB5XUnacAERijM.jpg,"おりほー！
　最後野口君よく取ったね！
　今日は現地参戦しようかと思いましたが、所用や一緒に行く方が京都・滋賀の大雨の影響で参戦不可となり、自宅観戦になりましたが、勝てて良かった！明日も勝つで！ https://t.co/CgrpZwBYSJ",2022-07-19 21:33:00,2022-07-19T12:33:00Z,73
1549371726387384321,1,3,0,http://pbs.twimg.com/media/FYB5XmuagAAesuI.jpg,"おりほー！
　最後野口君よく取ったね！
　今日は現地参戦しようかと思いましたが、所用や一緒に行く方が京都・滋賀の大雨の影響で参戦不可となり、自宅観戦になりましたが、勝てて良かった！明日も勝つで！ https://t.co/CgrpZwBYSJ",2022-07-19 21:33:00,2022-07-19T12:33:00Z,73
1549371726387384321,1,3,0,http://pbs.twimg.com/media/FYB5X4ZaAAAlNh4.jpg,"おりほー！
　最後野口君よく取ったね！
　今日は現地参戦しようかと思いましたが、所用や一緒に行く方が京都・滋賀の大雨の影響で参戦不可となり、自宅観戦になりましたが、勝てて良かった！明日も勝つで！ https://t.co/CgrpZwBYSJ",2022-07-19 21:33:00,2022-07-19T12:33:00Z,73
1549218157130555393,1,0,28,http://pbs.twimg.com/ext_tw_video_thumb/1549218104974376960/pu/img/Xekkn185mjYnQMjD.jpg,"京都の大雨すごいです…！
前の道がほぼ川みたいになってます https://t.co/9D7DPhx5gJ",2022-07-19 21:32:10,2022-07-19T02:22:46Z,73
1549371156477591552,1,1,0,http://pbs.twimg.com/media/FYB42xkUYAIWL8Z.jpg,"祇園祭前祭が終わり、浴衣営業も（花火も）なんとか乗り切った！大袈裟
今週末7/22㈮23㈯の懶惰は19-24時の通常営業です

今週末金土も祇園祭は後祭の宵々山宵山ですのでまだ祭り気分でいきます（露店等は無し）

今日のような大雨の日はおうちで読書が一番ですが、京都市内あちこち被害が心配です… https://t.co/nc0X51NZSS",2022-07-19 21:30:44,2022-07-19T12:30:44Z,73
1548766904310833152,1,0,52,http://pbs.twimg.com/media/FX5TSYhUUAEffPD.jpg,浸水被害を緊急調査／宮城・大崎市、大雨で堤防が決壊／庄子、横山、若松氏ら #公明新聞電子版 2022年07月18日付 https://t.co/wsV453pXYC https://t.co/yMBNslUP5z,2022-07-19 21:28:55,2022-07-17T20:29:39Z,73
1549370500987899904,1,0,0,http://pbs.twimg.com/ext_tw_video_thumb/1549370408767717376/pu/img/izqXel8Nj_NksAt5.jpg,"2022・7/19(火)
八幡駅を発車したdec741❗
大雨の影響でダイヤが乱れて長い間停車してました。
情報提供してくれた方に感謝します(^人^)
17:35頃 https://t.co/TB4sy6N4TI",2022-07-19 21:28:08,2022-07-19T12:28:08Z,73
1549222980588564480,1,0,16,http://pbs.twimg.com/ext_tw_video_thumb/1549222916034011136/pu/img/Qvlk2Sqlpw0UPbSx.jpg,"京都御所がプール
#京都御所#御所#京都#大雨 https://t.co/ydSQt1FmP7",2022-07-19 21:27:52,2022-07-19T02:41:56Z,73
1549208016569847808,1,0,6,http://pbs.twimg.com/media/FX_kdzQUcAE_puJ.jpg,"お庭が！洪水！えらいこっちゃです😱
皆さまのところは大丈夫ですか？

#京都市上京区 #大雨 https://t.co/dTqUfYwA9i",2022-07-19 21:27:21,2022-07-19T01:42:28Z,73
1549370230107181056,1,2,0,http://pbs.twimg.com/media/FYB4Ap1aUAE5Yfr.jpg,"7/19はイエローライン🟨大雨災害情報のためチャレンジはお休み🦀
#ウェザーニュースLiVE
#リポート009 #白井ゆかり https://t.co/54RF9nDYL0",2022-07-19 21:27:03,2022-07-19T12:27:03Z,73
1549070143237799941,1,0,16,http://pbs.twimg.com/media/FX9nFSUaUAAPZFw.jpg,佐賀県・福岡県・山口県に線状降水帯発生情報、佐賀市などに大雨降水警報が出されました。土砂災害や河川の氾濫などに警戒をお願いします。 https://t.co/5BfrJs1b2Q,2022-07-19 21:22:33,2022-07-18T16:34:37Z,73
1549368742169423872,1,16,0,http://pbs.twimg.com/media/FYB2qH1aUAILXCP.jpg,"今日は京都滋賀の大雨は、仕事中に警報のお知らせが響きまくり、電車は止まるわで、大変な一日でした。
幸いに私が帰宅する時は雨め止みましたが、早く夏らしい空が見たいですね。
今日は時間が無くバンザイスクワットで脚に負荷を与えて、気分だけ頑張った感じにしました😅。 https://t.co/gd1DNhxWJD",2022-07-19 21:21:08,2022-07-19T12:21:08Z,73
1549368742169423872,1,16,0,http://pbs.twimg.com/media/FYB2qHzaMAIHk0h.jpg,"今日は京都滋賀の大雨は、仕事中に警報のお知らせが響きまくり、電車は止まるわで、大変な一日でした。
幸いに私が帰宅する時は雨め止みましたが、早く夏らしい空が見たいですね。
今日は時間が無くバンザイスクワットで脚に負荷を与えて、気分だけ頑張った感じにしました😅。 https://t.co/gd1DNhxWJD",2022-07-19 21:21:08,2022-07-19T12:21:08Z,73
1549368742169423872,1,16,0,http://pbs.twimg.com/media/FYB2qHzaQAA3SnB.jpg,"今日は京都滋賀の大雨は、仕事中に警報のお知らせが響きまくり、電車は止まるわで、大変な一日でした。
幸いに私が帰宅する時は雨め止みましたが、早く夏らしい空が見たいですね。
今日は時間が無くバンザイスクワットで脚に負荷を与えて、気分だけ頑張った感じにしました😅。 https://t.co/gd1DNhxWJD",2022-07-19 21:21:08,2022-07-19T12:21:08Z,73
1549368742169423872,1,16,0,http://pbs.twimg.com/media/FYB2qJiacAACCvr.jpg,"今日は京都滋賀の大雨は、仕事中に警報のお知らせが響きまくり、電車は止まるわで、大変な一日でした。
幸いに私が帰宅する時は雨め止みましたが、早く夏らしい空が見たいですね。
今日は時間が無くバンザイスクワットで脚に負荷を与えて、気分だけ頑張った感じにしました😅。 https://t.co/gd1DNhxWJD",2022-07-19 21:21:08,2022-07-19T12:21:08Z,73
1549368648849956864,2,2,1,http://pbs.twimg.com/media/FYB2LXdUEAM2UcY.jpg,"夕方には晴れたのでポタ。
昨日から山口は大雨だったけど、災害には成らず一安心。

#ロードバイク
#リカンベント https://t.co/BToMsvHGyd",2022-07-19 21:20:46,2022-07-19T12:20:46Z,28
1549312561266315264,1,0,7,http://pbs.twimg.com/media/FYBDjf7VQAAS2J9.jpg,"今日の雨は本当凄かったですね。
久しぶりに恐怖を感じるレベルでした💦

鴨川も大雨の影響で立入禁止になってます⛔ https://t.co/6JUz07TFCp",2022-07-19 21:20:42,2022-07-19T08:37:54Z,73
1549367976293732353,1,0,0,http://pbs.twimg.com/media/FYB19QfagAAAGbp.jpg,"無事に家に辿り着いた！！
途中大雨&amp;事故で遅れてたけど、、、
今から京都で買った駅弁食べて寝る！！ https://t.co/yrYk5krX5U",2022-07-19 21:18:06,2022-07-19T12:18:06Z,73
1549367976293732353,1,0,0,http://pbs.twimg.com/media/FYB19QdagAAujcf.jpg,"無事に家に辿り着いた！！
途中大雨&amp;事故で遅れてたけど、、、
今から京都で買った駅弁食べて寝る！！ https://t.co/yrYk5krX5U",2022-07-19 21:18:06,2022-07-19T12:18:06Z,73
1549367849075953664,1,1,0,http://pbs.twimg.com/media/FYB12C3UEAQ7rb4.jpg,"本日
トップス snidel
ボトムス しまむら(星玲奈さん)
羽織 MERCURYDUO

九州、山口の大雨☔️心配です💦現地の皆さん、まだまだお気をつけて😢 https://t.co/2RrRN7k374",2022-07-19 21:17:35,2022-07-19T12:17:35Z,73
1549367796760739840,2,0,1,http://pbs.twimg.com/media/FYB0OV9acAAYguA.jpg,"大雨に関する上川・留萌地方気象情報第2号（7月19日21時06分・旭川地方気象台発表）
旭川市と鷹栖町の大雨洪水警報は解除。20日明け方にかけて、低い土地の浸水や土砂災害・河川の増水に注意してください。また上川・留萌地方では、20日にかけて落雷や突風・ひょうにも注意。
https://t.co/2Be64JNXUW https://t.co/cO8KLN8MvF",2022-07-19 21:17:23,2022-07-19T12:17:23Z,28
1549367796760739840,2,0,1,http://pbs.twimg.com/media/FYB0lUBaQAEPq4I.jpg,"大雨に関する上川・留萌地方気象情報第2号（7月19日21時06分・旭川地方気象台発表）
旭川市と鷹栖町の大雨洪水警報は解除。20日明け方にかけて、低い土地の浸水や土砂災害・河川の増水に注意してください。また上川・留萌地方では、20日にかけて落雷や突風・ひょうにも注意。
https://t.co/2Be64JNXUW https://t.co/cO8KLN8MvF",2022-07-19 21:17:23,2022-07-19T12:17:23Z,28
1549367796760739840,2,0,1,http://pbs.twimg.com/media/FYB0mwraUAAJQ6p.jpg,"大雨に関する上川・留萌地方気象情報第2号（7月19日21時06分・旭川地方気象台発表）
旭川市と鷹栖町の大雨洪水警報は解除。20日明け方にかけて、低い土地の浸水や土砂災害・河川の増水に注意してください。また上川・留萌地方では、20日にかけて落雷や突風・ひょうにも注意。
https://t.co/2Be64JNXUW https://t.co/cO8KLN8MvF",2022-07-19 21:17:23,2022-07-19T12:17:23Z,28
1549367796760739840,2,0,1,http://pbs.twimg.com/media/FYB1u78aIAYDFSs.jpg,"大雨に関する上川・留萌地方気象情報第2号（7月19日21時06分・旭川地方気象台発表）
旭川市と鷹栖町の大雨洪水警報は解除。20日明け方にかけて、低い土地の浸水や土砂災害・河川の増水に注意してください。また上川・留萌地方では、20日にかけて落雷や突風・ひょうにも注意。
https://t.co/2Be64JNXUW https://t.co/cO8KLN8MvF",2022-07-19 21:17:23,2022-07-19T12:17:23Z,28
1549367650010161152,5,27,4,http://pbs.twimg.com/media/FYB1o22akAIGPrR.jpg,"昨日の対馬は記録的大雨でご心配をおかけしました。農家さんや田んぼには大きな被害はありませんでした。

#ツシマヤマネコ米
#ツシマヤマネコ
#対馬
#佐護 https://t.co/0xjClZjloC",2022-07-19 21:16:48,2022-07-19T12:16:48Z,11
1549367650010161152,5,27,4,http://pbs.twimg.com/media/FYB1o26aMAIZs9r.jpg,"昨日の対馬は記録的大雨でご心配をおかけしました。農家さんや田んぼには大きな被害はありませんでした。

#ツシマヤマネコ米
#ツシマヤマネコ
#対馬
#佐護 https://t.co/0xjClZjloC",2022-07-19 21:16:48,2022-07-19T12:16:48Z,11
1549367650010161152,5,27,4,http://pbs.twimg.com/media/FYB1o2yaQAALsRb.jpg,"昨日の対馬は記録的大雨でご心配をおかけしました。農家さんや田んぼには大きな被害はありませんでした。

#ツシマヤマネコ米
#ツシマヤマネコ
#対馬
#佐護 https://t.co/0xjClZjloC",2022-07-19 21:16:48,2022-07-19T12:16:48Z,11
1549233851796692994,2,0,43,http://pbs.twimg.com/media/FX_7-XCUUAI9tz6.jpg,"京都市の短時間大雨情報の警報音が携帯から鳴り響いてます、
皆さまも十分ご注意下さい。（私の地域は大丈夫です） https://t.co/TJoXheDhL8",2022-07-19 21:16:13,2022-07-19T03:25:08Z,28
1548925858626146305,1,0,46,http://pbs.twimg.com/media/FX7j14GUUAEKuOb.jpg,宮城県栗原市の大雨災害を調査。栗原市の三浦市議と被害現場を視察。２日たっても水田は水没状態。ポンプ排水が続いています。途中のサービスエリアで見つけたツバメの巣。嵐の後も元気に育ってました。 https://t.co/bzDp9FZSTX,2022-07-19 21:15:55,2022-07-18T07:01:17Z,73
1548925858626146305,1,0,46,http://pbs.twimg.com/media/FX7j2NlUUAAsoWZ.jpg,宮城県栗原市の大雨災害を調査。栗原市の三浦市議と被害現場を視察。２日たっても水田は水没状態。ポンプ排水が続いています。途中のサービスエリアで見つけたツバメの巣。嵐の後も元気に育ってました。 https://t.co/bzDp9FZSTX,2022-07-19 21:15:55,2022-07-18T07:01:17Z,73
1548925858626146305,1,0,46,http://pbs.twimg.com/media/FX7j2kGVsAAnCJE.jpg,宮城県栗原市の大雨災害を調査。栗原市の三浦市議と被害現場を視察。２日たっても水田は水没状態。ポンプ排水が続いています。途中のサービスエリアで見つけたツバメの巣。嵐の後も元気に育ってました。 https://t.co/bzDp9FZSTX,2022-07-19 21:15:55,2022-07-18T07:01:17Z,73
1548925858626146305,1,0,46,http://pbs.twimg.com/media/FX7j28xVQAAPhJo.jpg,宮城県栗原市の大雨災害を調査。栗原市の三浦市議と被害現場を視察。２日たっても水田は水没状態。ポンプ排水が続いています。途中のサービスエリアで見つけたツバメの巣。嵐の後も元気に育ってました。 https://t.co/bzDp9FZSTX,2022-07-19 21:15:55,2022-07-18T07:01:17Z,73
1549367282110980096,1,0,0,http://pbs.twimg.com/media/FYB1UyIacAEO9Ij.jpg,土砂災害に警戒を　下越では２０日までに大雨警報発表の可能性も１時間に３０ミリ以上の激しい雨となる所がある見込み　《新潟》(TeNYテレビ新潟) https://t.co/KhPXgK0QT4 https://t.co/Opt4rJ6csW,2022-07-19 21:15:20,2022-07-19T12:15:20Z,73
1549367192596013056,1,4,0,http://pbs.twimg.com/media/FYB1PwDUYAIW1fV.jpg,今日は19時から博多でアニメ・漫画好きカフェ会を開催しました！昨日の大雨の影響でキャンセルが相次ぎましたが、何とか満席で開催することができました😚この会は二回目の開催でしたが、前回のときと同様に、皆さんのアニメ・漫画愛が凄かったです！ https://t.co/k3co1ogvGN,2022-07-19 21:14:59,2022-07-19T12:14:59Z,73
1549366970214219779,1,0,0,http://pbs.twimg.com/media/FYB1CtjUUAE05eB.jpg,[仙台放送]🆕 大雨で土砂崩れ…岩出山高校の被害を確認　４日間臨時休校 そのまま夏休みに〈宮城〉 (22/07/19 19:26)｜YouTube 宮城県　https://t.co/VbDWbLX8ST https://t.co/wcO9J6Fi9g,2022-07-19 21:14:06,2022-07-19T12:14:06Z,73
1549366785337708545,1,0,0,http://pbs.twimg.com/media/FYB04DwaIAAuJoU.jpg,関西 きょう19日は大雨に警戒・注意 激しい雨や非常に激しい雨が降る恐れ(気象予報士 山本 悠二 2022年07月19日) - https://t.co/YDEZiO34nT https://t.co/LBWqVGMqcH https://t.co/fva6DJ0KKN,2022-07-19 21:13:22,2022-07-19T12:13:22Z,73
1549229613930332160,5,0,179,http://pbs.twimg.com/media/FX_2Tq6VEAI0gPu.jpg,"JR守山駅の近く、油池交差点付近のアンダーパスが冠水、乗用車が立ち往生しています。

現在、滋賀県南部に大雨洪水警報が出ています。
付近の皆さま、どうぞお気をつけください！ https://t.co/m0i405OPIr",2022-07-19 21:08:22,2022-07-19T03:08:17Z,11
1549365090150858752,1,0,0,http://pbs.twimg.com/media/FYBy2gHUUAULtOG.jpg,"７割がハザードマップ確認してるなんて信じられない。どう考えても希少種でしょうが。下手したらワクの中身を調べてる人間よりも少ないイメージだった。

大雨で冠水した地下道に誤って入り溺れた可能性も　女性が死亡　滋賀・近江八幡市(読売テレビ)
https://t.co/PXkXQEsz8M https://t.co/pQpzJKRsBq",2022-07-19 21:06:37,2022-07-19T12:06:37Z,73
1549331980831305729,2,0,10,http://pbs.twimg.com/media/FYBVOLZagAEV8q2.jpg,【221系快速長浜】琵琶湖線の大雨による折り返し遅れと運用変更のため、快速長浜行きが221系で運転してました。(幸いJR神戸線の人身事故は回避できた模様です) https://t.co/v0WU9zr7uh,2022-07-19 21:05:25,2022-07-19T09:55:04Z,28
1548970483257085952,1,0,93,http://pbs.twimg.com/media/FX8McT9aIAERpng.jpg,"九州地方の皆様、今後の大雨にご注意下さい。
8月に福岡ライブでお会いできる日を楽しみにしております。

田中謙次

https://t.co/o997yqEUqQ https://t.co/zPswTXERWe",2022-07-19 21:03:45,2022-07-18T09:58:36Z,73
1549364196021661697,1,13,0,http://pbs.twimg.com/media/FYBygw2VUAAjb9u.jpg,"大雨の被害にみまわれた地域の方、お見舞い申し上げます。
こちらは、雨の被害も無く、比較的穏やかな天気が続いてます。
南国の風景を貼っておきます。🏖
せめてもの気休めにでもなれば幸いです。

＃ロレックス　#デイトナ　#南国の風景 https://t.co/UMBpppYzN2",2022-07-19 21:03:04,2022-07-19T12:03:04Z,73
1549364196021661697,1,13,0,http://pbs.twimg.com/media/FYBygwwUsAE1Y9W.jpg,"大雨の被害にみまわれた地域の方、お見舞い申し上げます。
こちらは、雨の被害も無く、比較的穏やかな天気が続いてます。
南国の風景を貼っておきます。🏖
せめてもの気休めにでもなれば幸いです。

＃ロレックス　#デイトナ　#南国の風景 https://t.co/UMBpppYzN2",2022-07-19 21:03:04,2022-07-19T12:03:04Z,73
1549364196021661697,1,13,0,http://pbs.twimg.com/media/FYBygw1UEAExKHm.jpg,"大雨の被害にみまわれた地域の方、お見舞い申し上げます。
こちらは、雨の被害も無く、比較的穏やかな天気が続いてます。
南国の風景を貼っておきます。🏖
せめてもの気休めにでもなれば幸いです。

＃ロレックス　#デイトナ　#南国の風景 https://t.co/UMBpppYzN2",2022-07-19 21:03:04,2022-07-19T12:03:04Z,73
1549364196021661697,1,13,0,http://pbs.twimg.com/media/FYBygwvVUAAirn1.jpg,"大雨の被害にみまわれた地域の方、お見舞い申し上げます。
こちらは、雨の被害も無く、比較的穏やかな天気が続いてます。
南国の風景を貼っておきます。🏖
せめてもの気休めにでもなれば幸いです。

＃ロレックス　#デイトナ　#南国の風景 https://t.co/UMBpppYzN2",2022-07-19 21:03:04,2022-07-19T12:03:04Z,73
1549364165155778560,10,30,9,http://pbs.twimg.com/media/FYByfyGUIAAMo5N.jpg,"滋賀からただいま帰宅。
大雨警報が出てたわりにはそんなに酷い雨に合わず、ラッキーでした。
今日もお疲れ様♪
 #オールドレンズ倶楽部
 #庭先ふぉとぐらふ
 #フォトポケ

good night…✴︎🌙.° https://t.co/PJdKdWFYyj",2022-07-19 21:02:57,2022-07-19T12:02:57Z,5
1549364122273591296,2,6,1,http://pbs.twimg.com/media/FYBydSnaQAE9FLk.jpg,ベニシボリさんもこの大雨のあれた天気を心配しております。#八丈島 https://t.co/L45PphDu6z,2022-07-19 21:02:47,2022-07-19T12:02:47Z,28
1549364123221524484,2,1,2,http://pbs.twimg.com/media/FYByc2baQAIU_V1.jpg,"🔶サンダーバード
［遅延］北陸本線で大雨、北陸本線　南条～王子保駅間で異常音感知と、18:04頃、JR神戸線　灘駅で人身事故発生のため、大阪～金沢駅間の列車が遅れています
《2022.07.19 21:02》 https://t.co/kBBjhb1JzV",2022-07-19 21:02:47,2022-07-19T12:02:47Z,28
1549364021471498240,1,2,0,http://pbs.twimg.com/ext_tw_video_thumb/1549363971538399232/pu/img/N62lbPjAIVP4jjJx.jpg,"7/19(ﾌｫﾛﾜｰさんのお誘いでﾀﾞｲﾆﾝｸﾞへ)ﾀﾞｲﾆﾝｸﾞ前に🐼ﾀﾞｲﾆﾝｸﾞとゎ別に“ぱんだコパンダさん”(@mazaku125 )とお会いする事に｡大雨で心配やったし早めに東京向かったらそれに合わせて,ぱんださんが早めに来てくれはりました｡3D猫みれた😍
↓続く https://t.co/XkhLJ3ffIV",2022-07-19 21:02:23,2022-07-19T12:02:23Z,73
1549363868216233984,31,60,31,http://pbs.twimg.com/media/FYBx4NYaIAAjfKN.jpg,"新潟県に大雨警報が発表しました。
下越では19日夜遅くから20日明け方まで土砂災害に警戒してください。
https://t.co/lo4ktoeDNr https://t.co/IdNAANKwOC",2022-07-19 21:01:46,2022-07-19T12:01:46Z,1
1549363772950990848,1,11,0,http://pbs.twimg.com/media/FYByIlAaIAAu7vi.jpg,"昨日から長崎の人です😊✌️
大雨で心配したけど昼頃には止んだので母をうちに🍀
コロナで心配したけど無事迎える事が出来ました。
またお盆を2人過ごします😊
いつまでできるかなぁ🥹💕
大好きな流星くんとかき氷🍧 https://t.co/d5fZ6cHrCz",2022-07-19 21:01:23,2022-07-19T12:01:23Z,73
1549363743871860736,1,2,0,http://pbs.twimg.com/media/FYByGl6aUAAgfVE.jpg,"帰ろうとしたら、大雨の影響＆巻き込み人身事故のダブル攻撃で、まだ大阪にも着かへん🤢

今日中に帰れたらラッキーかな。。。 https://t.co/qZVih6WPTi",2022-07-19 21:01:16,2022-07-19T12:01:16Z,73
1549363575227322370,1,2,0,http://pbs.twimg.com/media/FYBx9C0acAYjtQC.jpg,"大津市御陵にて水道管工事に伴う片側交互通行を行いました👮‍♀️
本日は大雨警報が出るくらいの大雨でしたね☔️
琵琶湖線も止まっていたらしいです👀
梅雨明けとは...🤔
#アソビイズム
#チームアソビ https://t.co/qslasAqVjo",2022-07-19 21:00:36,2022-07-19T12:00:36Z,73
1549363498789904384,14,8,16,http://pbs.twimg.com/media/FYBx44NUYAIjOno.jpg,"灘駅の事故
飛び込み一名に怪我四名という五人以上の死傷者事故として、運輸安全委員会の立ち入り調査のためにJR神戸線に再開の目処が立たないのか？
大雨に人身、今日は踏んだり蹴ったりですよ…… https://t.co/7Ev0J72p8x",2022-07-19 21:00:18,2022-07-19T12:00:18Z,3
1549363132635971591,2,8,1,http://pbs.twimg.com/media/FYBxSw5aUAAKe5m.jpg,今週の盛岡の天気と気温の予想です。21日（木）は晴れますが、22日（金）～23日（土）は、再び低気圧や前線の影響で大雨のおそれがあります。24日（日）以降は、夏空が続きそうです。 https://t.co/GmjmxaEc6I,2022-07-19 20:58:51,2022-07-19T11:58:51Z,28
1549315894911721473,3,0,23,http://pbs.twimg.com/media/FYBGl2nUIAElFck.jpg,三連休中の大雨により、川の水があふれ田に水が入る箇所もあった一関市花泉町内の現場を視察しました。まだ雨が降っていますので、水防を強化しつつ、安全を確保しながら農業被害の調査、対応を進めます。 https://t.co/Xbmqtv705I,2022-07-19 20:58:49,2022-07-19T08:51:08Z,15
1549315894911721473,3,0,23,http://pbs.twimg.com/media/FYBGl2kUcAA0I-y.jpg,三連休中の大雨により、川の水があふれ田に水が入る箇所もあった一関市花泉町内の現場を視察しました。まだ雨が降っていますので、水防を強化しつつ、安全を確保しながら農業被害の調査、対応を進めます。 https://t.co/Xbmqtv705I,2022-07-19 20:58:49,2022-07-19T08:51:08Z,15
1549337913233616896,1,0,5,http://pbs.twimg.com/media/FYBanpsaIAAhAQY.jpg,"【再掲】
京都で大雨が降った後の風物詩となっている鴨川を流れてくる大山椒魚 #kyotoonze https://t.co/aW8i7x26p3",2022-07-19 20:58:48,2022-07-19T10:18:38Z,73
1549362726887165956,7,3,7,http://pbs.twimg.com/media/FYBxL2TUIAAZLTf.jpg,"7月15日以来の宮城県内での大雨被害　資料の誤廃棄防止と情報提供のお願い　ー宮城資料ネット NPO法人宮城歴史資料保全ネットワーク　

被災した歴史資料・文化財の応急処置などへのお願いです。ぜひよろしくお願いします。
https://t.co/X5ice86QrR https://t.co/ka9xznj6Oa",2022-07-19 20:57:14,2022-07-19T11:57:14Z,7
